Cites,Authors,Title,Year,Source,Publisher,ArticleURL,CitesURL,GSRank,QueryDate,Type,DOI,ISSN,CitationURL,Volume,Issue,StartPage,EndPage,ECC,CitesPerYear,CitesPerAuthor,AuthorCount,Age
0,"AL Guiot, D Rigal, G Chappuis, DH Shearer, MJ Day, BL Coomber, ...","Immunopathology, Volume 58",1997,"Veterinary Immunology and Immunopathology","","","",111,"2019-05-15","Journal article","","","https://scholar.google.com/citations?view_op=view_citation&hl=en&user=E4oA0fAAAAAJ&cstart=100&pagesize=100&citation_for_view=E4oA0fAAAAAJ:ldfaerwXgEUC",58,,375,377,0,0.00,0,7,22
0,"LF Song, B Coomber","Relaxin stimulates the production of gelatinases, plasminogen activator and plasminogen activator inhibitor by equine ovarian stromal cells in vitro",1996,"BIOLOGY OF REPRODUCTION","","","",112,"2019-05-15","Journal article","","","https://scholar.google.com/citations?view_op=view_citation&hl=en&user=E4oA0fAAAAAJ&cstart=100&pagesize=100&citation_for_view=E4oA0fAAAAAJ:a0OBvERweLwC",54,,392,392,0,0.00,0,2,23
0,"CL Galligan, BL Coomber","Function of bovine neutrophils from mastitic cows",1995,"Dairy research report (Homer, La.)(USA)","","","",113,"2019-05-15","","","","https://scholar.google.com/citations?view_op=view_citation&hl=en&user=E4oA0fAAAAAJ&cstart=100&pagesize=100&citation_for_view=E4oA0fAAAAAJ:1sJd4Hv_s6UC",,,,,0,0.00,0,2,24
0,"CG GALLIGAN, BL COOMBER","INFLUENCE OF IL-8 ISOFORMS ON BOVINE NEUTROPHIL MIGRATION IN-VITRO",1994,"JOURNAL OF CELLULAR BIOCHEMISTRY","","","",114,"2019-05-15","Journal article","","","https://scholar.google.com/citations?view_op=view_citation&hl=en&user=E4oA0fAAAAAJ&cstart=100&pagesize=100&citation_for_view=E4oA0fAAAAAJ:70eg2SAEIzsC",284,,,,0,0.00,0,2,25
0,"LF SONG, P RYAN, B COOMBER, DG PORTER","RELAXIN INHIBITS EQUINE OVARIAN STROMAL CELL-PROLIFERATION IN-VITRO",1994,"BIOLOGY OF REPRODUCTION","","","",115,"2019-05-15","Journal article","","","https://scholar.google.com/citations?view_op=view_citation&hl=en&user=E4oA0fAAAAAJ&cstart=100&pagesize=100&citation_for_view=E4oA0fAAAAAJ:f2IySw72cVMC",50,,122,122,0,0.00,0,4,25
0,"BL COOMBER, AI GOTLIEB","LOW-DOSE TAXOL AFFECTS CELL-MIGRATION BUT NOT DNA-SYNTHESIS IN AN INVITRO WOUNDED ENDOTHELIAL MONOLAYER",1988,"FASEB JOURNAL 2 (4), A404-A","","","",116,"2019-05-15","Journal article","","","https://scholar.google.com/citations?view_op=view_citation&hl=en&user=E4oA0fAAAAAJ&cstart=100&pagesize=100&citation_for_view=E4oA0fAAAAAJ:xtRiw3GOFMkC",404,,,,0,0.00,0,2,31
0,"BL Coomber, SR Scadding","Evidence for a chalone control mechanism in the limb regeneration blastema of the newt, Notophthalmus viridescens.",1983,"Cell and tissue kinetics","","","",117,"2019-05-15","Journal article","","","https://scholar.google.com/citations?view_op=view_citation&hl=en&user=E4oA0fAAAAAJ&cstart=100&pagesize=100&citation_for_view=E4oA0fAAAAAJ:3s1wT3WcHBgC",16,1,77,83,0,0.00,0,2,36
0,"BL Coomber","Control of cell proliferation in the regenerating limb of the newt, Notophthalmus viridescens rafinesque",1982,"","","","",118,"2019-05-15","","","","https://scholar.google.com/citations?view_op=view_citation&hl=en&user=E4oA0fAAAAAJ&cstart=100&pagesize=100&citation_for_view=E4oA0fAAAAAJ:hqOjcs7Dif8C",,,,,0,0.00,0,1,37
0,"L Coomber, N Mackman, JW Rak","Oncogenic events regulate tissue factor expression in colorectal cancer",,"","","","",119,"2019-05-15","","","","https://scholar.google.com/citations?view_op=view_citation&hl=en&user=E4oA0fAAAAAJ&cstart=100&pagesize=100&citation_for_view=E4oA0fAAAAAJ:hFOr9nPyWt4C",,,,,0,0.00,0,3,
