Cites,Authors,Title,Year,Source,Publisher,ArticleURL,CitesURL,GSRank,QueryDate,Type,DOI,ISSN,CitationURL,Volume,Issue,StartPage,EndPage,ECC,CitesPerYear,CitesPerAuthor,AuthorCount,Age
469,"P Whittaker, RA Kloner, DR Boughner, JG Pickering","Quantitative assessment of myocardial collagen with picrosirius red staining and circularly polarized light",1994,"Basic research in cardiology","","","https://scholar.google.com/scholar?oi=bibs&hl=en&cites=7091632749193365387",1,"2019-05-16","Journal article","","","https://scholar.google.com/citations?view_op=view_citation&hl=en&user=IlBohzIAAAAJ&pagesize=100&citation_for_view=IlBohzIAAAAJ:u-x6o8ySG0sC",89,5,397,410,469,18.76,117,4,25
432,"S Nikol, JM Isner, JG Pickering, M Kearney, G Leclerc, L Weir","Expression of transforming growth factor-beta 1 is increased in human vascular restenosis lesions.",1992,"The Journal of clinical investigation","","","https://scholar.google.com/scholar?oi=bibs&hl=en&cites=11063670222348866063",2,"2019-05-16","Journal article","","","https://scholar.google.com/citations?view_op=view_citation&hl=en&user=IlBohzIAAAAJ&pagesize=100&citation_for_view=IlBohzIAAAAJ:u5HHmVD_uO8C",90,4,1582,1592,432,16.00,72,6,27
280,"E van der Veer, C Ho, C O'Neil, N Barbosa, R Scott, SP Cregan, ...","Extension of human cell lifespan by nicotinamide phosphoribosyltransferase",2007,"Journal of Biological Chemistry","","","https://scholar.google.com/scholar?oi=bibs&hl=en&cites=17919250947791834355",3,"2019-05-16","Journal article","","","https://scholar.google.com/citations?view_op=view_citation&hl=en&user=IlBohzIAAAAJ&pagesize=100&citation_for_view=IlBohzIAAAAJ:2osOgNQ5qMEC",282,15,10841,10845,280,23.33,40,7,12
251,"E van der Veer, Z Nong, C O’Neil, B Urquhart, D Freeman, JG Pickering","Pre–B-Cell Colony–Enhancing Factor Regulates NAD+-Dependent Protein Deacetylase Activity and Promotes Vascular Smooth Muscle Cell Maturation",2005,"Circulation research","","","https://scholar.google.com/scholar?oi=bibs&hl=en&cites=3820618420283193534",4,"2019-05-16","Journal article","","","https://scholar.google.com/citations?view_op=view_citation&hl=en&user=IlBohzIAAAAJ&pagesize=100&citation_for_view=IlBohzIAAAAJ:9yKSN-GCB0IC",97,1,25,34,251,17.93,42,6,14
214,"JG Pickering, L Weir, J Jekanowski, MA Kearney, JM Isner","Proliferative activity in peripheral and coronary atherosclerotic plaque among patients undergoing percutaneous revascularization.",1993,"The Journal of clinical investigation","","","https://scholar.google.com/scholar?oi=bibs&hl=en&cites=16784188323096190233",5,"2019-05-16","Journal article","","","https://scholar.google.com/citations?view_op=view_citation&hl=en&user=IlBohzIAAAAJ&pagesize=100&citation_for_view=IlBohzIAAAAJ:d1gkVwhDpl0C",91,4,1469,1480,214,8.23,43,5,26
156,"S Li, YS Fan, LH Chow, C Van Den Diepstraten, E Van der Veer, SM Sims, ...","Innate diversity of adult human arterial smooth muscle cells: cloning of distinct subtypes from the internal thoracic artery",2001,"Circulation research","","","https://scholar.google.com/scholar?oi=bibs&hl=en&cites=12839843281966832828",6,"2019-05-16","Journal article","","","https://scholar.google.com/citations?view_op=view_citation&hl=en&user=IlBohzIAAAAJ&pagesize=100&citation_for_view=IlBohzIAAAAJ:IjCSPb-OGe4C",89,6,517,525,156,8.67,22,7,18
156,"S Li, S Sims, Y Jiao, LH Chow, JG Pickering","Evidence from a novel human cell clone that adult vascular smooth muscle cells can convert reversibly between noncontractile and contractile phenotypes",1999,"Circulation research","","","https://scholar.google.com/scholar?oi=bibs&hl=en&cites=8789879927344709986",7,"2019-05-16","Journal article","","","https://scholar.google.com/citations?view_op=view_citation&hl=en&user=IlBohzIAAAAJ&pagesize=100&citation_for_view=IlBohzIAAAAJ:UeHWp8X0CEIC",85,4,338,348,156,7.80,31,5,20
138,"CM Ford, S Li, JG Pickering","Angiotensin II Stimulates Collagen Synthesis in Human Vascular Smooth Muscle Cells: Involvement of the AT1 Receptor, Transforming Growth Factor-β, and …",1999,"Arteriosclerosis, thrombosis, and vascular biology","","","https://scholar.google.com/scholar?oi=bibs&hl=en&cites=5462426777867598081",8,"2019-05-16","Journal article","","","https://scholar.google.com/citations?view_op=view_citation&hl=en&user=IlBohzIAAAAJ&pagesize=100&citation_for_view=IlBohzIAAAAJ:W7OEmFMy1HYC",19,8,1843,1851,138,6.90,46,3,20
138,"EF Rocnik, BM Chan, JG Pickering","Evidence for a role of collagen synthesis in arterial smooth muscle cell migration.",1998,"The Journal of clinical investigation","","","https://scholar.google.com/scholar?oi=bibs&hl=en&cites=11210583089664524277",9,"2019-05-16","Journal article","","","https://scholar.google.com/citations?view_op=view_citation&hl=en&user=IlBohzIAAAAJ&pagesize=100&citation_for_view=IlBohzIAAAAJ:Y0pCki6q_DkC",101,9,1889,1898,138,6.57,46,3,21
134,"S Takeshita, D Gal, G Leclerc, JG Pickering, R Riessen, L Weir, JM Isner","Increased gene expression after liposome-mediated arterial gene transfer associated with intimal smooth muscle cell proliferation. In vitro and in vivo findings in a rabbit …",1994,"The Journal of clinical investigation","","","https://scholar.google.com/scholar?oi=bibs&hl=en&cites=1712592322607649266",10,"2019-05-16","Journal article","","","https://scholar.google.com/citations?view_op=view_citation&hl=en&user=IlBohzIAAAAJ&pagesize=100&citation_for_view=IlBohzIAAAAJ:qjMakFHDy7sC",93,2,652,661,134,5.36,19,7,25
133,"CA Argmann, JY Edwards, CG Sawyez, CH O'Neil, RA Hegele, ...","Regulation of macrophage cholesterol efflux through hydroxymethylglutaryl-CoA reductase inhibition a role for RhoA in ABCA1-mediated Cholesterol efflux",2005,"Journal of Biological Chemistry","","","https://scholar.google.com/scholar?oi=bibs&hl=en&cites=16161218298075364816",11,"2019-05-16","Journal article","","","https://scholar.google.com/citations?view_op=view_citation&hl=en&user=IlBohzIAAAAJ&pagesize=100&citation_for_view=IlBohzIAAAAJ:WF5omc3nYNoC",280,23,22212,22221,133,9.50,22,6,14
133,"S Li, C Van Den Diepstraten, SJ D'souza, BMC Chan, JG Pickering","Vascular smooth muscle cells orchestrate the assembly of type I collagen via α2β1 integrin, RhoA, and fibronectin polymerization",2003,"The American journal of pathology","","","https://scholar.google.com/scholar?oi=bibs&hl=en&cites=2294015703950347073",12,"2019-05-16","Journal article","","","https://scholar.google.com/citations?view_op=view_citation&hl=en&user=IlBohzIAAAAJ&pagesize=100&citation_for_view=IlBohzIAAAAJ:roLk4NBRz8UC",163,3,1045,1056,133,8.31,27,5,16
126,"NM Borradaile, JG Pickering","NAD+, sirtuins, and cardiovascular disease",2009,"Current pharmaceutical design","","","https://scholar.google.com/scholar?oi=bibs&hl=en&cites=12441397995141633965",13,"2019-05-16","Journal article","","","https://scholar.google.com/citations?view_op=view_citation&hl=en&user=IlBohzIAAAAJ&pagesize=100&citation_for_view=IlBohzIAAAAJ:0EnyYjriUFMC",15,1,110,117,126,12.60,63,2,10
120,"J Li, X Han, J Jiang, R Zhong, GM Williams, JG Pickering, LH Chow","Vascular smooth muscle cells of recipient origin mediate intimal expansion after aortic allotransplantation in mice",2001,"The American journal of pathology","","","https://scholar.google.com/scholar?oi=bibs&hl=en&cites=862190151914713245",14,"2019-05-16","Journal article","","","https://scholar.google.com/citations?view_op=view_citation&hl=en&user=IlBohzIAAAAJ&pagesize=100&citation_for_view=IlBohzIAAAAJ:zYLM7Y9cAGgC",158,6,1943,1947,120,6.67,17,7,18
116,"JG Pickering, DR Boughner","Fibrosis in the transplanted heart and its relation to donor ischemic time. Assessment with polarized light microscopy and digital image analysis.",1990,"Circulation","","","https://scholar.google.com/scholar?oi=bibs&hl=en&cites=1608584522582578148",15,"2019-05-16","Journal article","","","https://scholar.google.com/citations?view_op=view_citation&hl=en&user=IlBohzIAAAAJ&pagesize=100&citation_for_view=IlBohzIAAAAJ:_FxGoFyzp5QC",81,3,949,958,116,4.00,58,2,29
113,"DW Losordo, JG Pickering, S Takeshita, G Leclerc, D Gal, L Weir, ...","Use of the rabbit ear artery to serially assess foreign protein secretion after site-specific arterial gene transfer in vivo. Evidence that anatomic identification of …",1994,"Circulation","","","https://scholar.google.com/scholar?oi=bibs&hl=en&cites=1834847441324385335",16,"2019-05-16","Journal article","","","https://scholar.google.com/citations?view_op=view_citation&hl=en&user=IlBohzIAAAAJ&pagesize=100&citation_for_view=IlBohzIAAAAJ:Tyk-4Ss8FVUC",89,2,785,792,113,4.52,16,7,25
111,"MH Khandaker, L Xu, R Rahimpour, G Mitchell, ME DeVries, JG Pickering, ...","CXCR1 and CXCR2 are rapidly down-modulated by bacterial endotoxin through a unique agonist-independent, tyrosine kinase-dependent mechanism",1998,"The Journal of Immunology","","","https://scholar.google.com/scholar?oi=bibs&hl=en&cites=4046068008724854351",17,"2019-05-16","Journal article","","","https://scholar.google.com/citations?view_op=view_citation&hl=en&user=IlBohzIAAAAJ&pagesize=100&citation_for_view=IlBohzIAAAAJ:YsMSGLbcyi4C",161,4,1930,1938,111,5.29,16,7,21
106,"JG Pickering, CM Ford, B Tang, LH Chow","Coordinated effects of fibroblast growth factor-2 on expression of fibrillar collagens, matrix metalloproteinases, and tissue inhibitors of matrix metalloproteinases by human …",1997,"Arteriosclerosis, thrombosis, and vascular biology","","","https://scholar.google.com/scholar?oi=bibs&hl=en&cites=2729021232651981540",18,"2019-05-16","Journal article","","","https://scholar.google.com/citations?view_op=view_citation&hl=en&user=IlBohzIAAAAJ&pagesize=100&citation_for_view=IlBohzIAAAAJ:eQOLeE2rZwMC",17,3,475,482,106,4.82,27,4,22
103,"D Gal, L Weir, G Leclerc, JG Pickering, J Hogan, JM Isner","Direct myocardial transfection in two animal models. Evaluation of parameters affecting gene expression and percutaneous gene delivery.",1993,"Laboratory investigation; a journal of technical methods and pathology 68 (1 …","","","https://scholar.google.com/scholar?oi=bibs&hl=en&cites=2390879668248673313",19,"2019-05-16","Journal article","","","https://scholar.google.com/citations?view_op=view_citation&hl=en&user=IlBohzIAAAAJ&pagesize=100&citation_for_view=IlBohzIAAAAJ:ufrVoPGSRksC",,,,,103,3.96,17,6,26
92,"JG Pickering, LH Chow, S Li, KA Rogers, EF Rocnik, R Zhong, BMC Chan","α5β1 integrin expression and luminal edge fibronectin matrix assembly by smooth muscle cells after arterial injury",2000,"The American journal of pathology","","","https://scholar.google.com/scholar?oi=bibs&hl=en&cites=9880854862809578222",20,"2019-05-16","Journal article","","","https://scholar.google.com/citations?view_op=view_citation&hl=en&user=IlBohzIAAAAJ&pagesize=100&citation_for_view=IlBohzIAAAAJ:5nxA0vEk-isC",156,2,453,465,92,4.84,13,7,19
91,"JG Pickering, S Uniyal, CM Ford, T Chau, MA Laurin, LH Chow, CG Ellis, ...","Fibroblast Growth Factor-2 Potentiates Vascular Smooth Muscle Cell Migration to Platelet-Derived Growth Factor: Upregulation of α2β1 Integrin and Disassembly …",1997,"Circulation research","","","https://scholar.google.com/scholar?oi=bibs&hl=en&cites=14050449660280382618",21,"2019-05-16","Journal article","","","https://scholar.google.com/citations?view_op=view_citation&hl=en&user=IlBohzIAAAAJ&pagesize=100&citation_for_view=IlBohzIAAAAJ:Se3iqnhoufwC",80,5,627,637,91,4.14,11,8,22
87,"NM Borradaile, JG Pickering","Nicotinamide phosphoribosyltransferase imparts human endothelial cells with extended replicative lifespan and enhanced angiogenic capacity in a high glucose environment",2009,"Aging cell","","","https://scholar.google.com/scholar?oi=bibs&hl=en&cites=15940223567560432192",22,"2019-05-16","Journal article","","","https://scholar.google.com/citations?view_op=view_citation&hl=en&user=IlBohzIAAAAJ&pagesize=100&citation_for_view=IlBohzIAAAAJ:mVmsd5A6BfQC",8,2,100,112,87,8.70,44,2,10
86,"JG Pickering, L Weir, K Rosenfield, J Stetz, J Jekanowski, JM Isner","Smooth muscle cell outgrowth from human atherosclerotic plaque: implications for the assessment of lesion biology",1992,"Journal of the American College of Cardiology","","","https://scholar.google.com/scholar?oi=bibs&hl=en&cites=16242675214888704489",23,"2019-05-16","Journal article","","","https://scholar.google.com/citations?view_op=view_citation&hl=en&user=IlBohzIAAAAJ&pagesize=100&citation_for_view=IlBohzIAAAAJ:LkGwnXOMwfcC",20,6,1430,1439,86,3.19,14,6,27
84,"MJ Frontini, Z Nong, R Gros, M Drangova, C O'neil, MN Rahman, O Akawi, ...","Fibroblast growth factor 9 delivery during angiogenesis produces durable, vasoresponsive microvessels wrapped by smooth muscle cells",2011,"Nature biotechnology","","","https://scholar.google.com/scholar?oi=bibs&hl=en&cites=8068621749787670689",24,"2019-05-16","Journal article","","","https://scholar.google.com/citations?view_op=view_citation&hl=en&user=IlBohzIAAAAJ&pagesize=100&citation_for_view=IlBohzIAAAAJ:ZeXyd9-uunAC",29,5,421,421,84,10.50,11,8,8
82,"JG Pickering, DR Boughner","Quantitative assessment of the age of fibrotic lesions using polarized light microscopy and digital image analysis.",1991,"The American journal of pathology","","","https://scholar.google.com/scholar?oi=bibs&hl=en&cites=11357295494362004779",25,"2019-05-16","Journal article","","","https://scholar.google.com/citations?view_op=view_citation&hl=en&user=IlBohzIAAAAJ&pagesize=100&citation_for_view=IlBohzIAAAAJ:UebtZRa9Y70C",138,5,1225,1225,82,2.93,41,2,28
82,"TY Lam, G Pickering, J Geltosky, CH Siu","Differential cell cohesiveness expressed by prespore and prestalk cells of Dictyostelium discoideum",1981,"Differentiation","","","https://scholar.google.com/scholar?oi=bibs&hl=en&cites=14423268617783060481",26,"2019-05-16","Journal article","","","https://scholar.google.com/citations?view_op=view_citation&hl=en&user=IlBohzIAAAAJ&pagesize=100&citation_for_view=IlBohzIAAAAJ:ipzZ9siozwsC",20,,22,28,82,2.16,21,4,38
79,"H Wang, ME DeVries, S Deng, MH Khandaker, JG Pickering, LH Chow, ...","The axis of interleukin 12 and gamma interferon regulates acute vascular xenogeneic rejection",2000,"Nature medicine","","","https://scholar.google.com/scholar?oi=bibs&hl=en&cites=7900216947696790062",27,"2019-05-16","Journal article","","","https://scholar.google.com/citations?view_op=view_citation&hl=en&user=IlBohzIAAAAJ&pagesize=100&citation_for_view=IlBohzIAAAAJ:b1wdh0AR-JQC",6,5,549,549,79,4.16,11,7,19
78,"JG Pickering, J Jekanowski, L Weir, S Takeshita, DW Losordo, JM Isner","Liposome-mediated gene transfer into human vascular smooth muscle cells.",1994,"Circulation","","","https://scholar.google.com/scholar?oi=bibs&hl=en&cites=2866770276534819923",28,"2019-05-16","Journal article","","","https://scholar.google.com/citations?view_op=view_citation&hl=en&user=IlBohzIAAAAJ&pagesize=100&citation_for_view=IlBohzIAAAAJ:hqOjcs7Dif8C",89,1,13,21,78,3.12,13,6,25
77,"C Ho, E van der Veer, O Akawi, JG Pickering","SIRT1 markedly extends replicative lifespan if the NAD+ salvage pathway is enhanced",2009,"FEBS letters","","","https://scholar.google.com/scholar?oi=bibs&hl=en&cites=6411544676459318882",29,"2019-05-16","Journal article","","","https://scholar.google.com/citations?view_op=view_citation&hl=en&user=IlBohzIAAAAJ&pagesize=100&citation_for_view=IlBohzIAAAAJ:_kc_bZDykSQC",583,18,3081,3085,77,7.70,19,4,10
77,"E Rocnik, LH Chow, JG Pickering","Heat shock protein 47 is expressed in fibrous regions of human atheroma and is regulated by growth factors and oxidized low-density lipoprotein",2000,"Circulation","","","https://scholar.google.com/scholar?oi=bibs&hl=en&cites=6073035665662122",30,"2019-05-16","Journal article","","","https://scholar.google.com/citations?view_op=view_citation&hl=en&user=IlBohzIAAAAJ&pagesize=100&citation_for_view=IlBohzIAAAAJ:8k81kl-MbHgC",101,11,1229,1233,77,4.05,26,3,19
68,"EF Rocnik, E van der Veer, H Cao, RA Hegele, JG Pickering","Functional linkage between the endoplasmic reticulum protein Hsp47 and procollagen expression in human vascular smooth muscle cells",2002,"Journal of Biological Chemistry","","","https://scholar.google.com/scholar?oi=bibs&hl=en&cites=2928320541606498047",31,"2019-05-16","Journal article","","","https://scholar.google.com/citations?view_op=view_citation&hl=en&user=IlBohzIAAAAJ&pagesize=100&citation_for_view=IlBohzIAAAAJ:MXK_kJrjxJIC",277,41,38571,38578,68,4.00,14,5,17
66,"JG Pickering, CM Ford, LH Chow","Evidence for rapid accumulation and persistently disordered architecture of fibrillar collagen in human coronary restenosis lesions",1996,"The American journal of cardiology","","","https://scholar.google.com/scholar?oi=bibs&hl=en&cites=11336062482058579898",32,"2019-05-16","Journal article","","","https://scholar.google.com/citations?view_op=view_citation&hl=en&user=IlBohzIAAAAJ&pagesize=100&citation_for_view=IlBohzIAAAAJ:3fE2CSJIrl8C",78,6,633,637,66,2.87,22,3,23
63,"HY Choi, M Rahmani, BW Wong, S Allahverdian, BM McManus, ...","ATP-binding cassette transporter A1 expression and apolipoprotein AI binding are impaired in intima-type arterial smooth muscle cells",2009,"Circulation","","","https://scholar.google.com/scholar?oi=bibs&hl=en&cites=9281498219710698906",33,"2019-05-16","Journal article","","","https://scholar.google.com/citations?view_op=view_citation&hl=en&user=IlBohzIAAAAJ&pagesize=100&citation_for_view=IlBohzIAAAAJ:TQgYirikUcIC",119,25,3223,3223,63,6.30,11,6,10
57,"R Gros, Q Ding, S Armstrong, C O'Neil, JG Pickering, RD Feldman","Rapid effects of aldosterone on clonal human vascular smooth muscle cells",2007,"American Journal of Physiology-Cell Physiology 292 (2), C788-C","","","https://scholar.google.com/scholar?oi=bibs&hl=en&cites=8319810104918389334",34,"2019-05-16","Journal article","","","https://scholar.google.com/citations?view_op=view_citation&hl=en&user=IlBohzIAAAAJ&pagesize=100&citation_for_view=IlBohzIAAAAJ:ULOm3_A8WrAC",794,,,,57,4.75,10,6,12
56,"R Gros, Q Ding, J Chorazyczewski, JG Pickering, LE Limbird, ...","Adenylyl cyclase isoform–selective regulation of vascular smooth muscle proliferation and cytoskeletal reorganization",2006,"Circulation research","","","https://scholar.google.com/scholar?oi=bibs&hl=en&cites=17634721275973930709",35,"2019-05-16","Journal article","","","https://scholar.google.com/citations?view_op=view_citation&hl=en&user=IlBohzIAAAAJ&pagesize=100&citation_for_view=IlBohzIAAAAJ:9ZlFYXVOiuMC",99,8,845,852,56,4.31,9,6,13
56,"LH Chow, S Huh, J Jiang, R Zhong, JG Pickering","Intimal thickening develops without humoral immunity in a mouse aortic allograft model of chronic vascular rejection",1996,"Circulation","","","https://scholar.google.com/scholar?oi=bibs&hl=en&cites=3417392849060041952",36,"2019-05-16","Journal article","","","https://scholar.google.com/citations?view_op=view_citation&hl=en&user=IlBohzIAAAAJ&pagesize=100&citation_for_view=IlBohzIAAAAJ:KlAtU1dfN6UC",94,12,3079,3082,56,2.43,11,5,23
53,"C Van Den Diepstraten, K Papay, Z Bolender, A Brown, JG Pickering","Cloning of a novel prolyl 4-hydroxylase subunit expressed in the fibrous cap of human atherosclerotic plaque",2003,"Circulation","","","https://scholar.google.com/scholar?oi=bibs&hl=en&cites=3249014934287704929",37,"2019-05-16","Journal article","","","https://scholar.google.com/citations?view_op=view_citation&hl=en&user=IlBohzIAAAAJ&pagesize=100&citation_for_view=IlBohzIAAAAJ:kNdYIx-mwKoC",108,5,508,511,53,3.31,11,5,16
51,"JG Pickering, PA Bacha, L Weir, J Jekanowski, JC Nichols, JM Isner","Prevention of smooth muscle cell outgrowth from human atherosclerotic plaque by a recombinant cytotoxin specific for the epidermal growth factor receptor.",1993,"The Journal of clinical investigation","","","https://scholar.google.com/scholar?oi=bibs&hl=en&cites=1536555719485077962",38,"2019-05-16","Journal article","","","https://scholar.google.com/citations?view_op=view_citation&hl=en&user=IlBohzIAAAAJ&pagesize=100&citation_for_view=IlBohzIAAAAJ:Zph67rFs4hoC",91,2,724,729,51,1.96,9,6,26
51,"M Mosseri, J Schaper, D Admon, Y Hasin, MS Gotsman, D Sapoznikov, ...","Coronary capillaries in patients with congestive cardiomyopathy or angina pectoris with patent main coronary arteries. Ultrastructural morphometry of endomyocardial biopsy samples.",1991,"Circulation","","","https://scholar.google.com/scholar?oi=bibs&hl=en&cites=1744391381125176047",39,"2019-05-16","Journal article","","","https://scholar.google.com/citations?view_op=view_citation&hl=en&user=IlBohzIAAAAJ&pagesize=100&citation_for_view=IlBohzIAAAAJ:qxL8FJ1GzNcC",84,1,203,210,51,1.82,7,7,28
50,"SK Steinbach, O El-Mounayri, RS DaCosta, MJ Frontini, Z Nong, A Maeda, ...","Directed differentiation of skin-derived precursors into functional vascular smooth muscle cells",2011,"Arteriosclerosis, thrombosis, and vascular biology","","","https://scholar.google.com/scholar?oi=bibs&hl=en&cites=7975287883578627229",40,"2019-05-16","Journal article","","","https://scholar.google.com/citations?view_op=view_citation&hl=en&user=IlBohzIAAAAJ&pagesize=100&citation_for_view=IlBohzIAAAAJ:_Qo2XoVZTnwC",31,12,2938,2948,50,6.25,7,7,8
50,"H Cao, E van der Veer, MR Ban, AJG Hanley, B Zinman, SB Harris, ...","Promoter Polymorphism in PCK1 (Phosphoenolpyruvate Carboxykinase Gene) Associated with Type 2 Diabetes Mellitus",2004,"The Journal of Clinical Endocrinology & Metabolism","","","https://scholar.google.com/scholar?oi=bibs&hl=en&cites=14100276554519747219",41,"2019-05-16","Journal article","","","https://scholar.google.com/citations?view_op=view_citation&hl=en&user=IlBohzIAAAAJ&pagesize=100&citation_for_view=IlBohzIAAAAJ:M3ejUd6NZC8C",89,2,898,903,50,3.33,7,7,15
49,"R Rahimpour, G Mitchell, MH Khandaker, C Kong, B Singh, L Xu, A Ochi, ...","Bacterial superantigens induce down-modulation of CC chemokine responsiveness in human monocytes via an alternative chemokine ligand-independent mechanism",1999,"The Journal of Immunology","","","https://scholar.google.com/scholar?oi=bibs&hl=en&cites=1609906371526138329",42,"2019-05-16","Journal article","","","https://scholar.google.com/citations?view_op=view_citation&hl=en&user=IlBohzIAAAAJ&pagesize=100&citation_for_view=IlBohzIAAAAJ:aqlVkmm33-oC",162,4,2299,2307,49,2.45,6,8,20
48,"S Li, LH Chow, JG Pickering","Cell surface-bound collagenase-1 and focal substrate degradation stimulate the rear release of motile vascular smooth muscle cells",2000,"Journal of Biological Chemistry","","","https://scholar.google.com/scholar?oi=bibs&hl=en&cites=1197873355941056694",43,"2019-05-16","Journal article","","","https://scholar.google.com/citations?view_op=view_citation&hl=en&user=IlBohzIAAAAJ&pagesize=100&citation_for_view=IlBohzIAAAAJ:YOwf2qJgpHMC",275,45,35384,35392,48,2.53,16,3,19
47,"MJ Frontini, C O'Neil, C Sawyez, BMC Chan, MW Huff, JG Pickering","Lipid incorporation inhibits Src-dependent assembly of fibronectin and type I collagen by vascular smooth muscle cells",2009,"Circulation research","","","https://scholar.google.com/scholar?oi=bibs&hl=en&cites=9760364839564228111",44,"2019-05-16","Journal article","","","https://scholar.google.com/citations?view_op=view_citation&hl=en&user=IlBohzIAAAAJ&pagesize=100&citation_for_view=IlBohzIAAAAJ:j3f4tGmQtD8C",104,7,832,841,47,4.70,8,6,10
46,"LA Bojic, AC Burke, SS Chhoker, DE Telford, BG Sutherland, JY Edwards, ...","Peroxisome proliferator–activated receptor δ agonist GW1516 attenuates diet-induced aortic inflammation, insulin resistance, and atherosclerosis in low-density lipoprotein …",2014,"Arteriosclerosis, thrombosis, and vascular biology","","","https://scholar.google.com/scholar?oi=bibs&hl=en&cites=12720622015600134732",45,"2019-05-16","Journal article","","","https://scholar.google.com/citations?view_op=view_citation&hl=en&user=IlBohzIAAAAJ&pagesize=100&citation_for_view=IlBohzIAAAAJ:PR6Y55bgFSsC",34,1,52,60,46,9.20,7,7,5
45,"CJ Pastore, JM Isner, PA Bacha, M Kearney, JG Pickering","Epidermal growth factor receptor–targeted cytotoxin inhibits neointimal hyperplasia in vivo",1995,"Circulation research","","","https://scholar.google.com/scholar?oi=bibs&hl=en&cites=2696651907304034176",46,"2019-05-16","","","","https://scholar.google.com/citations?view_op=view_citation&hl=en&user=IlBohzIAAAAJ&pagesize=100&citation_for_view=IlBohzIAAAAJ:4TOpqqG69KYC",,,,,45,1.88,9,5,24
44,"EP van der Veer, RG de Bruin, AO Kraaijeveld, MR de Vries, I Bot, T Pera, ...","Quaking, an RNA-binding protein, is a critical regulator of vascular smooth muscle cell phenotype",2013,"Circulation research","","","https://scholar.google.com/scholar?oi=bibs&hl=en&cites=4116305699206053081,13778566223295087401",47,"2019-05-16","Journal article","","","https://scholar.google.com/citations?view_op=view_citation&hl=en&user=IlBohzIAAAAJ&pagesize=100&citation_for_view=IlBohzIAAAAJ:5awf1xo2G04C",113,9,1065,1075,44,7.33,6,7,6
44,"SS Said, JG Pickering, K Mequanint","Advances in growth factor delivery for therapeutic angiogenesis",2013,"Journal of vascular research","","","https://scholar.google.com/scholar?oi=bibs&hl=en&cites=11744700013660183177",48,"2019-05-16","Journal article","","","https://scholar.google.com/citations?view_op=view_citation&hl=en&user=IlBohzIAAAAJ&pagesize=100&citation_for_view=IlBohzIAAAAJ:70eg2SAEIzsC",50,1,35,51,44,7.33,15,3,6
44,"CA Argmann, CG Sawyez, S Li, Z Nong, RA Hegele, JG Pickering, ...","Human smooth muscle cell subpopulations differentially accumulate cholesteryl ester when exposed to native and oxidized lipoproteins",2004,"Arteriosclerosis, thrombosis, and vascular biology","","","https://scholar.google.com/scholar?oi=bibs&hl=en&cites=1005943065135004141",49,"2019-05-16","Journal article","","","https://scholar.google.com/citations?view_op=view_citation&hl=en&user=IlBohzIAAAAJ&pagesize=100&citation_for_view=IlBohzIAAAAJ:4DMP91E08xMC",24,7,1290,1296,44,2.93,6,7,15
