Cites,Authors,Title,Year,Source,Publisher,ArticleURL,CitesURL,GSRank,QueryDate,Type,DOI,ISSN,CitationURL,Volume,Issue,StartPage,EndPage,ECC,CitesPerYear,CitesPerAuthor,AuthorCount,Age
3,"WC Parks, RP Mecham","Influence of extracellular matrix on elastin biosynthesis",1989,"Elastin and Elastases","","","https://scholar.google.com/scholar?oi=bibs&hl=en&cites=2458276096648574874",315,"2019-05-16","Journal article","","","https://scholar.google.com/citations?view_op=view_citation&hl=en&user=ABXJvacAAAAJ&cstart=300&pagesize=100&citation_for_view=ABXJvacAAAAJ:KUbvn5osdkgC",1,,213,28,3,0.10,2,2,30
3,"WC Parks, A Hinek, A Rosenbloom, RP Mecham","DOWN-REGULATION OF ELASTIN EXPRESSION IN FIBROBLASTS BY 1, 25 DIHYDROXYCHOLECALCIFEROL-VITAMIN-D3",1989,"JOURNAL OF INVESTIGATIVE DERMATOLOGY","","","https://scholar.google.com/scholar?oi=bibs&hl=en&cites=15724236893880162421",316,"2019-05-16","Journal article","","","https://scholar.google.com/citations?view_op=view_citation&hl=en&user=ABXJvacAAAAJ&cstart=300&pagesize=100&citation_for_view=ABXJvacAAAAJ:NyGDZy8z5eUC",92,3,497,497,3,0.10,1,4,30
2,"CS Craft, TJ Broekelmann, RP Mecham","Microfibril-associated glycoproteins MAGP-1 and MAGP-2 in disease",2018,"Matrix Biology","","","https://scholar.google.com/scholar?oi=bibs&hl=en&cites=10450945514178451061",317,"2019-05-16","Journal article","","","https://scholar.google.com/citations?view_op=view_citation&hl=en&user=ABXJvacAAAAJ&cstart=300&pagesize=100&citation_for_view=ABXJvacAAAAJ:Xz60mAmATU4C",71,,100,111,2,2.00,1,3,1
2,"CM Halabi, RP Mecham","Elastin purification and solubilization",2018,"Methods in cell biology","","","https://scholar.google.com/scholar?oi=bibs&hl=en&cites=10564660471336467731",318,"2019-05-16","Journal article","","","https://scholar.google.com/citations?view_op=view_citation&hl=en&user=ABXJvacAAAAJ&cstart=300&pagesize=100&citation_for_view=ABXJvacAAAAJ:QsaTk4IG4EwC",143,,207,222,2,2.00,1,2,1
2,"J Hidalgo‐Tamola, I Luttrell, X Jiang, D Li, RP Mecham, K Chitaley","Characterization of erectile function in elastin haploinsufficicent mice",2011,"The journal of sexual medicine","","","https://scholar.google.com/scholar?oi=bibs&hl=en&cites=16267573856135096751",319,"2019-05-16","Journal article","","","https://scholar.google.com/citations?view_op=view_citation&hl=en&user=ABXJvacAAAAJ&cstart=300&pagesize=100&citation_for_view=ABXJvacAAAAJ:anf4URPfarAC",8,11,3075,3085,2,0.25,0,6,8
2,"Z Wang, J Bryan, C Franz, A Siegel, J Wagenseil, R Mecham, LJ Sandell","A fragment of cartilage collagen, chondrostatin, inhibits migration of breast cancer cells",2008,"The FASEB Journal 22 (1_supplement), 1029.11-1029.","","","https://scholar.google.com/scholar?oi=bibs&hl=en&cites=2642960427986973312",320,"2019-05-16","Journal article","","","https://scholar.google.com/citations?view_op=view_citation&hl=en&user=ABXJvacAAAAJ&cstart=300&pagesize=100&citation_for_view=ABXJvacAAAAJ:fbc8zXXH2BUC",11,,,,2,0.18,0,7,11
2,"TM Ritty, TJ Broekelmann, RP Mecham","Fibrillin 1 contains a proteolytically activated heparin binding site important for extracellular matrix deposition",2000,"MOLECULAR BIOLOGY OF THE CELL 11, 264A-264A","","","https://scholar.google.com/scholar?oi=bibs&hl=en&cites=552256997982228620",321,"2019-05-16","","","","https://scholar.google.com/citations?view_op=view_citation&hl=en&user=ABXJvacAAAAJ&cstart=300&pagesize=100&citation_for_view=ABXJvacAAAAJ:LhH-TYMQEocC",,,,,2,0.11,1,3,19
2,"LB Sandberg, J Uitto, DW Urry, AM Tamburro, JM Davidson, ...","General discussion. 1. Hydroxylation of the VGVPG in ovine elastin",1995,"MOLECULAR BIOLOGY AND PATHOLOGY OF ELASTIC TISSUES","","","https://scholar.google.com/scholar?oi=bibs&hl=en&cites=332858034258791456",322,"2019-05-16","Journal article","","","https://scholar.google.com/citations?view_op=view_citation&hl=en&user=ABXJvacAAAAJ&cstart=300&pagesize=100&citation_for_view=ABXJvacAAAAJ:5icHVeHT4IsC",192,,51,58,2,0.08,0,6,24
2,"EC Davis, RP Mecham","Elastic fiber organization",1993,"Tissue Engineering","","","https://scholar.google.com/scholar?oi=bibs&hl=en&cites=840563627644875750,18004867344553054851",323,"2019-05-16","Book chapter","","","https://scholar.google.com/citations?view_op=view_citation&hl=en&user=ABXJvacAAAAJ&cstart=300&pagesize=100&citation_for_view=ABXJvacAAAAJ:QYdC8u9Cj1oC",,,26,34,2,0.08,1,2,26
2,"M Botney, W Parks, K Stenmark, R Mecham","Determination of Transforming Growth Factor-β mRNA Levels in Pulmonary Arteries from Normal and Hypoxic Calves",1991,"Chest 99 (3), 42S","","","https://scholar.google.com/scholar?oi=bibs&hl=en&cites=5803186118253412494",324,"2019-05-16","","","","https://scholar.google.com/citations?view_op=view_citation&hl=en&user=ABXJvacAAAAJ&cstart=300&pagesize=100&citation_for_view=ABXJvacAAAAJ:65Yg0jNCQDAC",,,,,2,0.07,1,4,28
2,"WC Parks, DS Wrenn, RP Mecham","Multiple forms of tropoelastin produced by RNA from bovine ligament",1986,"Federation Proceedings. Federation of American Societies for Experimental …","","","https://scholar.google.com/scholar?oi=bibs&hl=en&cites=6339495699860788468",325,"2019-05-16","Conference paper","","","https://scholar.google.com/citations?view_op=view_citation&hl=en&user=ABXJvacAAAAJ&cstart=300&pagesize=100&citation_for_view=ABXJvacAAAAJ:e_rmSamDkqQC",,,,,2,0.06,1,3,33
1,"RP Mecham, F Ramirez","Extracellular Determinants of Arterial Morphogenesis, Growth, and Homeostasis",2018,"Current topics in developmental biology","","","https://scholar.google.com/scholar?oi=bibs&hl=en&cites=1048889067239367118",326,"2019-05-16","Journal article","","","https://scholar.google.com/citations?view_op=view_citation&hl=en&user=ABXJvacAAAAJ&cstart=300&pagesize=100&citation_for_view=ABXJvacAAAAJ:g5Ck-dwhA_QC",130,,193,216,1,1.00,1,2,1
1,"G Villain, E Lelievre, T Broekelmann, O Gayet, C Havet, E Werkmeister, ...","MAGP‐1 and fibronectin control EGFL 7 functions by driving its deposition into distinct endothelial extracellular matrix locations",2018,"The FEBS journal","","","https://scholar.google.com/scholar?oi=bibs&hl=en&cites=13150126132774718025",327,"2019-05-16","Journal article","","","https://scholar.google.com/citations?view_op=view_citation&hl=en&user=ABXJvacAAAAJ&cstart=300&pagesize=100&citation_for_view=ABXJvacAAAAJ:RJOyoaXV5v8C",285,23,4394,4412,1,1.00,0,7,1
1,"AU Kabir, TJ Lee, H Pan, JC Berry, K Krchma, J Wu, F Liu, HK Kang, ...","Requisite endothelial reactivation and effective siRNA nanoparticle targeting of Etv2/Er71 in tumor angiogenesis",2018,"JCI insight","","","https://scholar.google.com/scholar?oi=bibs&hl=en&cites=5477965173491851971",328,"2019-05-16","Journal article","","","https://scholar.google.com/citations?view_op=view_citation&hl=en&user=ABXJvacAAAAJ&cstart=300&pagesize=100&citation_for_view=ABXJvacAAAAJ:2v_ZtQDX9iAC",3,8,,,1,1.00,0,9,1
1,"G Swaminathan, I Stoilov, T Broekelmann, R Mecham, A Ramamurthi","Phenotype‐based selection of bone marrow mesenchymal stem cell‐derived smooth muscle cells for elastic matrix regenerative repair in abdominal aortic aneurysms",2018,"Journal of tissue engineering and regenerative medicine 12 (1), e60-","","","https://scholar.google.com/scholar?oi=bibs&hl=en&cites=11429786774994876540",329,"2019-05-16","Journal article","","","https://scholar.google.com/citations?view_op=view_citation&hl=en&user=ABXJvacAAAAJ&cstart=300&pagesize=100&citation_for_view=ABXJvacAAAAJ:EPG8bYD4jVwC",,,70,,1,1.00,0,5,1
1,"H Zhang, P Cooper, C Emfinger, T Harter, M Sala-Rabanal, S Matkovich, ...","Cardiovascular Phenotypes of a Mouse Model of Cantu Syndrome",2016,"JOURNAL OF GENERAL PHYSIOLOGY 148 (2), 36A-36A","","","https://scholar.google.com/scholar?oi=bibs&hl=en&cites=7372405946703995972",330,"2019-05-16","Journal article","","","https://scholar.google.com/citations?view_op=view_citation&hl=en&user=ABXJvacAAAAJ&cstart=300&pagesize=100&citation_for_view=ABXJvacAAAAJ:BrOSOlqYqPUC",,,,,1,0.33,0,7,3
1,"RP Mecham","Extracellular matrix, tissue mechanics, and regenerative repair",2014,"JOURNAL OF TISSUE ENGINEERING AND REGENERATIVE MEDICINE","","","https://scholar.google.com/scholar?oi=bibs&hl=en&cites=2408694632705170708",331,"2019-05-16","Journal article","","","https://scholar.google.com/citations?view_op=view_citation&hl=en&user=ABXJvacAAAAJ&cstart=300&pagesize=100&citation_for_view=ABXJvacAAAAJ:-mN3Mh-tlDkC",8,,38,38,1,0.20,1,1,5
1,"R Schnaar, JC Paulson, MS Macauley, C Nycholat, F Pfrengle, ...","Program and abstracts for the 2012 Joint Meeting of the Society for Glycobiology & American Society for Matrix Biology",2012,"Glycobiology","","","https://scholar.google.com/scholar?oi=bibs&hl=en&cites=14743012652887371189",332,"2019-05-16","Journal article","","","https://scholar.google.com/citations?view_op=view_citation&hl=en&user=ABXJvacAAAAJ&cstart=300&pagesize=100&citation_for_view=ABXJvacAAAAJ:sJsF-0ZLhtgC",22,11,1518,1518,1,0.14,0,6,7
1,"A Shifren, Q Hu, RH Knutsen, CH Ciliberto, RP Mecham, Z Urban","Both elastin quantity and quality determine lung mechanics",2006,"Matrix Biology, S18-S","","","https://scholar.google.com/scholar?oi=bibs&hl=en&cites=14614402454066059818",333,"2019-05-16","Journal article","","","https://scholar.google.com/citations?view_op=view_citation&hl=en&user=ABXJvacAAAAJ&cstart=300&pagesize=100&citation_for_view=ABXJvacAAAAJ:GtLg2Ama23sC",19,,,,1,0.08,0,6,13
1,"SL Merklinger, RA Wagner, RH Knutsen, G Kabir, K Desai, S Hacker, ...","Fibulin-5 may protect against pulmonary vascular obliterative disease in mice overexpressing Mts1 (S100A4)",2004,"Circulation","","","https://scholar.google.com/scholar?oi=bibs&hl=en&cites=3215742832988935330",334,"2019-05-16","Journal article","","","https://scholar.google.com/citations?view_op=view_citation&hl=en&user=ABXJvacAAAAJ&cstart=300&pagesize=100&citation_for_view=ABXJvacAAAAJ:OcBU2YAGkTUC",110,17,19,19,1,0.07,0,7,15
1,"MJ Silva, MD Brodt, M Ko, N Kusano, RP Mecham, B Wopenka","Decreased whole-bone strength in the SAMP6 mouse is explained by decreased material strength of demineralized bone matrix.",2003,"JOURNAL OF BONE AND MINERAL RESEARCH 18, S306-S","","","https://scholar.google.com/scholar?oi=bibs&hl=en&cites=5872164896356868590",335,"2019-05-16","Journal article","","","https://scholar.google.com/citations?view_op=view_citation&hl=en&user=ABXJvacAAAAJ&cstart=300&pagesize=100&citation_for_view=ABXJvacAAAAJ:4X0JR2_MtJMC",306,,,,1,0.06,0,6,16
1,"C Bernal-Mizrachi, S Weng, AC Bloodsworth, RH Knutsen, S Pennathur, ...","Inducible expression of uncoupling protein-1 in mouse aortic smooth muscle cells promotes hypertension and atherosclerosis",2003,"Arteriosclerosis Thrombosis and Vascular Biology 23 (5), A76-A","","","https://scholar.google.com/scholar?oi=bibs&hl=en&cites=12275220693208304209",336,"2019-05-16","Journal article","","","https://scholar.google.com/citations?view_op=view_citation&hl=en&user=ABXJvacAAAAJ&cstart=300&pagesize=100&citation_for_view=ABXJvacAAAAJ:OR75R8vi5nAC",76,,,,1,0.06,0,6,16
1,"SM JONES","Cell Biology",1998,"A Laboratory Handbook","","","https://scholar.google.com/scholar?oi=bibs&hl=en&cites=643050635672286772,9874706625675440532",337,"2019-05-16","Journal article","","","https://scholar.google.com/citations?view_op=view_citation&hl=en&user=ABXJvacAAAAJ&cstart=300&pagesize=100&citation_for_view=ABXJvacAAAAJ:kw52XkFRtyQC",2,,12,12,1,0.05,1,1,21
1,"DD Roberts, RP Mecham","Cell surface and extracellular glycoconjugates(structure and function)",1994,"Biology of extracellular matrix","","","https://scholar.google.com/scholar?oi=bibs&hl=en&cites=3298975421523732481,18307305461383282676",338,"2019-05-16","","","","https://scholar.google.com/citations?view_op=view_citation&hl=en&user=ABXJvacAAAAJ&cstart=300&pagesize=100&citation_for_view=ABXJvacAAAAJ:PVjk1bu6vJQC",,,,,1,0.04,1,2,25
1,"MG FRID, RP Mecham, EO Moiseeva, KR Stenmark","IDENTIFICATION OF PHENOTYPICALLY DISTINCT SMOOTH-MUSCLE CELL-POPULATIONS IN MATURE AND DEVELOPING BOVINE PULMONARY-ARTERIES",1993,"AMERICAN REVIEW OF RESPIRATORY DISEASE 147 (4), A493-A","","","https://scholar.google.com/scholar?oi=bibs&hl=en&cites=4364232304157645551",339,"2019-05-16","Journal article","","","https://scholar.google.com/citations?view_op=view_citation&hl=en&user=ABXJvacAAAAJ&cstart=300&pagesize=100&citation_for_view=ABXJvacAAAAJ:nZcligLrVowC",493,,,,1,0.04,0,4,26
1,"RP Mecham, EC Davis, W PARKS, MA GIBSON, M FILIAGGI","ASSEMBLY OF THE ELASTIC FIBER-A COMPLEX PROBLEM IN DEVELOPMENTAL REGULATION",1993,"JOURNAL OF CELLULAR BIOCHEMISTRY","","","https://scholar.google.com/scholar?oi=bibs&hl=en&cites=6697339771553350908",340,"2019-05-16","Journal article","","","https://scholar.google.com/citations?view_op=view_citation&hl=en&user=ABXJvacAAAAJ&cstart=300&pagesize=100&citation_for_view=ABXJvacAAAAJ:a3BOlSfXSfwC",146,,,,1,0.04,0,5,26
1,"TL Doering","Glycosyl Phosphatidylinositol-Linked Membrane Proteins: Structure, Biosynthesis, and Function",1993,"Cell Surface and Extracellular Glycoconjugates","","","https://scholar.google.com/scholar?oi=bibs&hl=en&cites=8597313954225713405",341,"2019-05-16","Book chapter","","","https://scholar.google.com/citations?view_op=view_citation&hl=en&user=ABXJvacAAAAJ&cstart=300&pagesize=100&citation_for_view=ABXJvacAAAAJ:tYavs44e6CUC",,,83,117,1,0.04,1,1,26
1,"MA Gibson, E Davis, M Filiaggi, RP Mecham","Isolation and partial characterization of a new fibrillin-like protein",1992,"MOLECULAR BIOLOGY OF THE CELL 3, A224-A","","","https://scholar.google.com/scholar?oi=bibs&hl=en&cites=13895337970817279655",342,"2019-05-16","Journal article","","","https://scholar.google.com/citations?view_op=view_citation&hl=en&user=ABXJvacAAAAJ&cstart=300&pagesize=100&citation_for_view=ABXJvacAAAAJ:F9fV5C73w3QC",224,,,,1,0.04,0,4,27
1,"A Hinek, GL GRIFFIN, RP MECHAM, EC CROUCH, RM SENIOR","NEUTROPHIL CHEMOTAXIS AND RECEPTOR FOR TYPE-IV COLLAGEN",1988,"FASEB JOURNAL 2 (5), A1178-A","","","https://scholar.google.com/scholar?oi=bibs&hl=en&cites=6713559266976317381",343,"2019-05-16","Journal article","","","https://scholar.google.com/citations?view_op=view_citation&hl=en&user=ABXJvacAAAAJ&cstart=300&pagesize=100&citation_for_view=ABXJvacAAAAJ:jgBuDB5drN8C",1178,,,,1,0.03,0,5,31
1,"RP Mecham","EFFECTS OF STEROID-HORMONES ON ELASTIN SYNTHESIS AND ELASTOGENIC DIFFERENTIATION",1986,"COLLAGEN AND RELATED RESEARCH","","","https://scholar.google.com/scholar?oi=bibs&hl=en&cites=15180736571559979173",344,"2019-05-16","Journal article","","","https://scholar.google.com/citations?view_op=view_citation&hl=en&user=ABXJvacAAAAJ&cstart=300&pagesize=100&citation_for_view=ABXJvacAAAAJ:MpfHP-DdYjUC",6,5,440,440,1,0.03,1,1,33
1,"GL Griffin, RM Senior, RP Mecham","ELASTIN PEPTIDE-INDUCED CHEMOTAXIS OF HUMAN-BLOOD MONOCYTES",1980,"CLINICAL RESEARCH 28 (2), A425-A","","","https://scholar.google.com/scholar?oi=bibs&hl=en&cites=3876877346030349054",345,"2019-05-16","Journal article","","","https://scholar.google.com/citations?view_op=view_citation&hl=en&user=ABXJvacAAAAJ&cstart=300&pagesize=100&citation_for_view=ABXJvacAAAAJ:LdasjJ6CEcoC",425,,,,1,0.03,0,3,39
0,"D Kim, RP Mecham, NH Nguyen, S Roy","Decreased lysyl oxidase level protects against development of retinal vascular lesions in diabetic retinopathy",2019,"Experimental eye research","","","",346,"2019-05-16","Journal article","","","https://scholar.google.com/citations?view_op=view_citation&hl=en&user=ABXJvacAAAAJ&cstart=300&pagesize=100&citation_for_view=ABXJvacAAAAJ:__bU50VfleQC",184,,221,226,0,0.00,0,4,1
0,"CM Halabi, M Lin, TJ Broekelmann, RP Mecham","Fibulin-4 and Lysyl Oxidase Cooperate to Maintain Arterial Wall Integrity in Large but not Small Vessels",2019,"The FASEB Journal 33 (1_supplement), 687.1-687.","","","",347,"2019-05-16","Journal article","","","https://scholar.google.com/citations?view_op=view_citation&hl=en&user=ABXJvacAAAAJ&cstart=300&pagesize=100&citation_for_view=ABXJvacAAAAJ:A8cqit5AE6sC",1,,,,0,0.00,0,4,1
0,"CJ Lin, MC Staiculescu, J Wagenseil, RP Mecham","VASCULAR SMOOTH MUSCLE-SPECIFIC ELASTIN DELETION IS A NOVEL GENETIC MODEL FOR NEOINTIMAL HYPERPLASIA",2019,"Journal of the American College of Cardiology 73 (9 Supplement 1)","","","",348,"2019-05-16","Journal article","","","https://scholar.google.com/citations?view_op=view_citation&hl=en&user=ABXJvacAAAAJ&cstart=300&pagesize=100&citation_for_view=ABXJvacAAAAJ:-6RzNnnwWf8C",2035,,,,0,0.00,0,4,1
0,"C McClenaghan, Y Huang, C Halabi, T Harter, RP Mecham, MS Remedi, ...","The Mechanism of Cardiovascular Pathophysiology in Cantu Syndrome and Response to Glibenclamide in Novel KATP Channel Mutant Mouse Models",2019,"Biophysical Journal 116 (3), 31a","","","",349,"2019-05-16","Journal article","","","https://scholar.google.com/citations?view_op=view_citation&hl=en&user=ABXJvacAAAAJ&cstart=300&pagesize=100&citation_for_view=ABXJvacAAAAJ:SAZ1SQo2q1kC",,,,,0,0.00,0,7,1
0,"S Dahal, T Broekelman, RP Mecham, A Ramamurthi","Maintaining Elastogenicity of Mesenchymal Stem Cell-Derived Smooth Muscle Cells in Two-Dimensional Culture",2018,"Tissue Engineering Part A 24 (11-12)","","","",350,"2019-05-16","Book chapter","","","https://scholar.google.com/citations?view_op=view_citation&hl=en&user=ABXJvacAAAAJ&cstart=300&pagesize=100&citation_for_view=ABXJvacAAAAJ:UmS_249rOGwC",,,979,989,0,0.00,0,4,1
0,"C McClenaghan, Y Huang, T Harter, G Brown, K Hinman, C Halabi, ...","Abstract 011",2018,"Arteriosclerosis, Thrombosis, and Vascular Biology 38 (Suppl_1)","","","",351,"2019-05-16","","","","https://scholar.google.com/citations?view_op=view_citation&hl=en&user=ABXJvacAAAAJ&cstart=300&pagesize=100&citation_for_view=ABXJvacAAAAJ:MIg0yeAD4ggC",,,,,0,0.00,0,7,1
0,"C McClenaghan, Y Huang, T Harter, GS Brown, K Hinman, C Halabi, ...","Cardiovascular Consequences of Cantu Syndrome and Response to Glibenclamide Treatment in Two Novel KATP Channel Mutant Mouse Models",2018,"Arteriosclerosis, Thrombosis, and Vascular Biology 38 (Suppl_1), A011-A","","","",352,"2019-05-16","Journal article","","","https://scholar.google.com/citations?view_op=view_citation&hl=en&user=ABXJvacAAAAJ&cstart=300&pagesize=100&citation_for_view=ABXJvacAAAAJ:z6xuaG2dYH0C",11,,,,0,0.00,0,7,1
0,"SE Turecamo, TA Walji, TJ Broekelmann, JW Williams, S Ivanov, NK Wee, ...","Contribution of metabolic disease to bone fragility in MAGP1-deficient mice",2018,"Matrix Biology","","","",353,"2019-05-16","Journal article","","","https://scholar.google.com/citations?view_op=view_citation&hl=en&user=ABXJvacAAAAJ&cstart=300&pagesize=100&citation_for_view=ABXJvacAAAAJ:qe6vwMD2xtsC",67,,1,14,0,0.00,0,7,1
0,"R Mecham","Methods in Extracellular Matrix Biology",2018,"","Academic Press","","",354,"2019-05-16","Book","","","https://scholar.google.com/citations?view_op=view_citation&hl=en&user=ABXJvacAAAAJ&cstart=300&pagesize=100&citation_for_view=ABXJvacAAAAJ:AYInfyleIOsC",,,,,0,0.00,0,1,1
0,"RP Mecham","Methods in Cell Biology Methods in Extracellular Matrix Biology Volume 143 Preface",2018,"METHODS IN EXTRACELLULAR MATRIX BIOLOGY 143, XIX-XXI","","","",355,"2019-05-16","","","","https://scholar.google.com/citations?view_op=view_citation&hl=en&user=ABXJvacAAAAJ&cstart=300&pagesize=100&citation_for_view=ABXJvacAAAAJ:kJDgFkosVoMC",,,,,0,0.00,0,1,1
0,"A Camardo, D Seshadri, TP Broekelmann, RP Mecham, A Ramamurthi","JNK-inhibitory Nanotherapeutics to Augment Vascular Elastic Matrix Regenerative Repair",2017,"TISSUE ENGINEERING PART A 23, S66-S","","","",356,"2019-05-16","Journal article","","","https://scholar.google.com/citations?view_op=view_citation&hl=en&user=ABXJvacAAAAJ&cstart=300&pagesize=100&citation_for_view=ABXJvacAAAAJ:SIv7DqKytYAC",66,,,,0,0.00,0,5,2
0,"MC Staiculescu, J Kim, RP Mecham, JE Wagenseil","Vascular Biology and Microcirculation: Mechanical behavior and matrisome gene expression in the aneurysm-prone thoracic aorta of newborn lysyl oxidase knockout mice",2017,"American Journal of Physiology-Heart and Circulatory Physiology 313 (2), H","","","",357,"2019-05-16","Journal article","","","https://scholar.google.com/citations?view_op=view_citation&hl=en&user=ABXJvacAAAAJ&cstart=300&pagesize=100&citation_for_view=ABXJvacAAAAJ:eGYfIraVYiQC",446,,,,0,0.00,0,4,2
0,"CM Halabi, M Lin, TJ Broekelmann, ML Chu, RP Mecham","Fibulin-4 Is Important for Maintaining Vascular Wall Integrity in Large but Not Small Vessels",2017,"The FASEB Journal 31 (1_supplement), 682.3-682.","","","",358,"2019-05-16","Journal article","","","https://scholar.google.com/citations?view_op=view_citation&hl=en&user=ABXJvacAAAAJ&cstart=300&pagesize=100&citation_for_view=ABXJvacAAAAJ:HJSXoJQnj-YC",3,,,,0,0.00,0,5,2
0,"G Swaminathan, I Stoilov, I Bratz, R Mecham, A Ramamurthi","Phenotypic Coordinates of Mesenchymal Stem Cell-derived Smooth Muscle Cells Determine their Potential for Elastic Matrix Regenerative Repair",2015,"TISSUE ENGINEERING PART A 21, S25-S","","","",359,"2019-05-16","Journal article","","","https://scholar.google.com/citations?view_op=view_citation&hl=en&user=ABXJvacAAAAJ&cstart=300&pagesize=100&citation_for_view=ABXJvacAAAAJ:-95Q15plzcUC",25,,,,0,0.00,0,5,4
0,"D Kim, S Amin, E Bae, S Wong, J Zhang, RP Mecham, S Roy","Decreasing diabetes-induced overexpression of lysyl oxidase prevents development of retinal vascular lesions associated with diabetic retinopathy",2015,"DIABETOLOGIA 58, S518-S","","","",360,"2019-05-16","Journal article","","","https://scholar.google.com/citations?view_op=view_citation&hl=en&user=ABXJvacAAAAJ&cstart=300&pagesize=100&citation_for_view=ABXJvacAAAAJ:1DsIQWDZLl8C",518,,,,0,0.00,0,7,4
0,"S Bassnett, A De Maria, Y Shi, R Mecham","Role of ltbp2 in eye development",2015,"Investigative Ophthalmology & Visual Science","","","",361,"2019-05-16","Journal article","","","https://scholar.google.com/citations?view_op=view_citation&hl=en&user=ABXJvacAAAAJ&cstart=300&pagesize=100&citation_for_view=ABXJvacAAAAJ:DrR-2ekChdkC",56,7,4009,4009,0,0.00,0,4,4
0,"G Swaminathan, I Stoilov, I Bratz, RP Mecham, A Ramamurthi","Phenotype as a Basis for Selection of BM-MSC-Derived SMCs for Regenerative Repair of Abdominal Aortic Aneurysms",2015,"Arteriosclerosis, Thrombosis, and Vascular Biology 35 (suppl_1), A617-A","","","",362,"2019-05-16","Journal article","","","https://scholar.google.com/citations?view_op=view_citation&hl=en&user=ABXJvacAAAAJ&cstart=300&pagesize=100&citation_for_view=ABXJvacAAAAJ:RoXSNcbkSzsC",617,,,,0,0.00,0,5,4
0,"RP Mecham, MA Gibson, R Mecham","Mini Review# 2 The Microfibril-Associated Glycoproteins (MAGPs) and the Microfibrillar Niche",2015,"","","","",363,"2019-05-16","","","","https://scholar.google.com/citations?view_op=view_citation&hl=en&user=ABXJvacAAAAJ&cstart=300&pagesize=100&citation_for_view=ABXJvacAAAAJ:qE4H1tSSYIIC",,,,,0,0.00,0,3,4
0,"MG Frid, BA McKeon, M Li, AR Flockton, SR Riddle, RP Mecham, ...","D101 INFLAMMATION IN THE TRANSPLANTED LUNG AND FIBROSIS: Elastin Degradation Products, Generated In The Setting Of Pulmonary Hypertension, Activate Resident Macrophages Within …",2015,"American Journal of Respiratory and Critical Care Medicine","","","",364,"2019-05-16","Journal article","","","https://scholar.google.com/citations?view_op=view_citation&hl=en&user=ABXJvacAAAAJ&cstart=300&pagesize=100&citation_for_view=ABXJvacAAAAJ:8Xgff_V0N9gC",191,,1,1,0,0.00,0,7,4
0,"BA McKeon, M Li, AR Flockton, SR Riddle, RP Mecham, TJ Broekelmann, ...","Elastin Degradation Products, Generated In The Setting Of Pulmonary Hypertension, Activate Resident Macrophages Within The Pulmonary Vascular Media And Perpetuate Pro …",2015,"Am J Respir Crit Care Med 191, A","","","",365,"2019-05-16","Journal article","","","https://scholar.google.com/citations?view_op=view_citation&hl=en&user=ABXJvacAAAAJ&cstart=300&pagesize=100&citation_for_view=ABXJvacAAAAJ:6_hjMsCP8ZoC",6140,,,,0,0.00,0,7,4
0,"G Swaminathan, B Sivaraman, I Stoilov, M Shah, G Zhang, RP Mecham, ...","Magnetic Labeling of BM-MSC-Derived SMCs Maintains Their Pro-Elastogenic Trophic Effects on Aneurysmal SMCs",2014,"","","","",366,"2019-05-16","","","","https://scholar.google.com/citations?view_op=view_citation&hl=en&user=ABXJvacAAAAJ&cstart=300&pagesize=100&citation_for_view=ABXJvacAAAAJ:1yWc8FF-_SYC",,,,,0,0.00,0,7,5
0,"JK Cheng, RP Mecham, JE Wagenseil","Postnatal Time Course of Arterial Mechanics in a Mouse Model of Pathological Remodeling due to Decreased Elastin Amounts",2013,"ASME 2013 Summer Bioengineering Conference, V01AT13A013-V01AT13A","","","",367,"2019-05-16","Conference paper","","","https://scholar.google.com/citations?view_op=view_citation&hl=en&user=ABXJvacAAAAJ&cstart=300&pagesize=100&citation_for_view=ABXJvacAAAAJ:lgwcVrK6X84C",13,,,,0,0.00,0,3,6
0,"L Beene, L Wang, R Mecham, D Reinhardt, E Traboulsi, S Apte","Fibrillin-2 is a component of the mouse zonule",2013,"Investigative Ophthalmology & Visual Science","","","",368,"2019-05-16","Journal article","","","https://scholar.google.com/citations?view_op=view_citation&hl=en&user=ABXJvacAAAAJ&cstart=300&pagesize=100&citation_for_view=ABXJvacAAAAJ:NDuN12AVoxsC",54,15,466,466,0,0.00,0,6,6
0,"AM Opoka, AL Juraszek, H Osinska, JM Smith, WH Merrill, P Eghtesady, ...","Elastic Fiber Fragmentation and Aberrant Angiogenesis Precede Inflammation in Early-Onset Aortic Valve Disease",2013,"Arteriosclerosis, Thrombosis, and Vascular Biology 33 (suppl_1), A520-A","","","",369,"2019-05-16","Journal article","","","https://scholar.google.com/citations?view_op=view_citation&hl=en&user=ABXJvacAAAAJ&cstart=300&pagesize=100&citation_for_view=ABXJvacAAAAJ:kF1pexMAQbMC",520,,,,0,0.00,0,7,6
0,"A Opoka, AL Juraszek, H Osinska, JM Smith, WH Merrill, P Eghtesady, ...","Early aberrant angiogenesis due to elastic fiber fragmentation in aortic valve disease",2013,"Cardiovascular Pathology","","","",370,"2019-05-16","Journal article","","","https://scholar.google.com/citations?view_op=view_citation&hl=en&user=ABXJvacAAAAJ&cstart=300&pagesize=100&citation_for_view=ABXJvacAAAAJ:HtS1dXgVpQUC",22,3,44,,0,0.00,0,7,6
