Cites,Authors,Title,Year,Source,Publisher,ArticleURL,CitesURL,GSRank,QueryDate,Type,DOI,ISSN,CitationURL,Volume,Issue,StartPage,EndPage,ECC,CitesPerYear,CitesPerAuthor,AuthorCount,Age
16,"M Casiraghi, JR Tatreau, JB Abano, JW Blackwell, L Watson, K Burridge, ...","In vitro modeling of nonhypoxic cold ischemia–reperfusion simulating lung transplantation",2009,"The Journal of thoracic and cardiovascular surgery","","","https://scholar.google.com/scholar?oi=bibs&hl=en&cites=5734259932814816418",214,"2019-06-05","Journal article","","","https://scholar.google.com/citations?view_op=view_citation&hl=en&user=QHbmOhQAAAAJ&cstart=200&pagesize=100&citation_for_view=QHbmOhQAAAAJ:yB1At4FlUx8C",138,3,760,767,16,1.60,2,7,10
16,"K Burridge, S Tsukita","Editorial overview: Cell-to-cell contact and extracellular matrix",2001,"Current Opinion in Cell Biology","","","https://scholar.google.com/scholar?oi=bibs&hl=en&cites=6035300591634793409",215,"2019-06-05","Journal article","","","https://scholar.google.com/citations?view_op=view_citation&hl=en&user=QHbmOhQAAAAJ&cstart=200&pagesize=100&citation_for_view=QHbmOhQAAAAJ:7T2F9Uy0os0C",5,13,525,528,16,0.89,8,2,18
15,"DW Scott, CE Tolbert, DM Graham, E Wittchen, JE Bear, K Burridge","N-glycosylation controls the function of junctional adhesion molecule-A",2015,"Molecular biology of the cell","","","https://scholar.google.com/scholar?oi=bibs&hl=en&cites=9120044467351438901",216,"2019-06-05","Journal article","","","https://scholar.google.com/citations?view_op=view_citation&hl=en&user=QHbmOhQAAAAJ&cstart=200&pagesize=100&citation_for_view=QHbmOhQAAAAJ:KUbvn5osdkgC",26,18,3205,3214,15,3.75,3,6,4
13,"CD Lawson, C Fan, N Mitin, NM Baker, SD George, DM Graham, ...","Rho GTPase transcriptome analysis reveals oncogenic roles for Rho GTPase-activating proteins in basal-like breast cancers",2016,"Cancer research","","","https://scholar.google.com/scholar?oi=bibs&hl=en&cites=122264371964279191",217,"2019-06-05","Journal article","","","https://scholar.google.com/citations?view_op=view_citation&hl=en&user=QHbmOhQAAAAJ&cstart=200&pagesize=100&citation_for_view=QHbmOhQAAAAJ:k8Z6L05lTy4C",76,13,3826,3837,13,4.33,2,7,3
13,"CE Tolbert, PM Thompson, R Superfine, K Burridge, SL Campbell","Phosphorylation at Y1065 in vinculin mediates actin bundling, cell spreading, and mechanical responses to force",2014,"Biochemistry","","","https://scholar.google.com/scholar?oi=bibs&hl=en&cites=14742347147651206157",218,"2019-06-05","Journal article","","","https://scholar.google.com/citations?view_op=view_citation&hl=en&user=QHbmOhQAAAAJ&cstart=200&pagesize=100&citation_for_view=QHbmOhQAAAAJ:EkHepimYqZsC",53,34,5526,5536,13,2.60,3,5,5
13,"CE Tolbert, K Burridge, SL Campbell","Vinculin regulation of F-actin bundle formation: what does it mean for the cell?",2013,"Cell adhesion & migration","","","https://scholar.google.com/scholar?oi=bibs&hl=en&cites=16173804451079305578",219,"2019-06-05","Journal article","","","https://scholar.google.com/citations?view_op=view_citation&hl=en&user=QHbmOhQAAAAJ&cstart=200&pagesize=100&citation_for_view=QHbmOhQAAAAJ:fEOibwPWpKIC",7,2,219,225,13,2.17,4,3,6
13,"Z Chen, E Lessey, ME Berginski, L Cao, J Li, X Trepat, M Itano, ...","Gleevec, an Abl family inhibitor, produces a profound change in cell shape and migration",2013,"PLoS One","","","https://scholar.google.com/scholar?oi=bibs&hl=en&cites=9084856532168387489",220,"2019-06-05","Journal article","","","https://scholar.google.com/citations?view_op=view_citation&hl=en&user=QHbmOhQAAAAJ&cstart=200&pagesize=100&citation_for_view=QHbmOhQAAAAJ:-_dYPAW6P2MC",8,1,52233,,13,2.17,2,8,6
13,"R Bigelis, K Burridge","The immunological detection of yeast nonsense termination fragments on sodium dodecylsulfate-polyacrylamide gels",1978,"Biochemical and biophysical research communications","","","https://scholar.google.com/scholar?oi=bibs&hl=en&cites=4185537719486721610",221,"2019-06-05","Journal article","","","https://scholar.google.com/citations?view_op=view_citation&hl=en&user=QHbmOhQAAAAJ&cstart=200&pagesize=100&citation_for_view=QHbmOhQAAAAJ:ZfRJV9d4-WMC",82,1,322,327,13,0.32,7,2,41
12,"K Burridge","Cell biology: A break in the chain?",2006,"Nature","","","https://scholar.google.com/scholar?oi=bibs&hl=en&cites=18125490968051363193",222,"2019-06-05","Journal article","","","https://scholar.google.com/citations?view_op=view_citation&hl=en&user=QHbmOhQAAAAJ&cstart=200&pagesize=100&citation_for_view=QHbmOhQAAAAJ:tKAzc9rXhukC",440,7080,38,38,12,0.92,12,1,13
11,"DE Bosch, ES Wittchen, C Qiu, K Burridge, DP Siderovski","Unique structural and nucleotide exchange features of the Rho1 GTPase of Entamoeba histolytica",2011,"Journal of Biological Chemistry","","","https://scholar.google.com/scholar?oi=bibs&hl=en&cites=18100530975296132725",223,"2019-06-05","Journal article","","","https://scholar.google.com/citations?view_op=view_citation&hl=en&user=QHbmOhQAAAAJ&cstart=200&pagesize=100&citation_for_view=QHbmOhQAAAAJ:VLnqNzywnoUC",286,45,39236,39246,11,1.38,2,5,8
11,"WT Jackman, K Burridge","Polymerization of additional actin is not required for capping of surface antigens in B‐lymphocytes",1989,"Cell motility and the cytoskeleton","","","https://scholar.google.com/scholar?oi=bibs&hl=en&cites=12937543748049553950",224,"2019-06-05","Journal article","","","https://scholar.google.com/citations?view_op=view_citation&hl=en&user=QHbmOhQAAAAJ&cstart=200&pagesize=100&citation_for_view=QHbmOhQAAAAJ:uJ-U7cs_P_0C",12,1,23,32,11,0.37,6,2,30
9,"M Tatar, JM Sedivy","Mitochondria: masters of epigenetics",2016,"Cell","","","https://scholar.google.com/scholar?oi=bibs&hl=en&cites=17460223233880604123",225,"2019-06-05","Journal article","","","https://scholar.google.com/citations?view_op=view_citation&hl=en&user=QHbmOhQAAAAJ&cstart=200&pagesize=100&citation_for_view=QHbmOhQAAAAJ:6ZxmRoH8BuwC",165,5,1052,1054,9,3.00,5,2,3
9,"L Peterson, K Burridge","Focal adhesions and focal complexes",2001,"Cell adhesion","","","https://scholar.google.com/scholar?oi=bibs&hl=en&cites=5902871729240779600",226,"2019-06-05","Journal article","","","https://scholar.google.com/citations?view_op=view_citation&hl=en&user=QHbmOhQAAAAJ&cstart=200&pagesize=100&citation_for_view=QHbmOhQAAAAJ:j8SEvjWlNXcC",39,,288,323,9,0.50,5,2,18
9,"JJC Lin, K Burridge, SH Blose, A Bushnell, SA Queally, JR Feramisco","Use of monoclonal antibodies to study cytoskeleton",1982,"Cell and muscle motility","","","https://scholar.google.com/scholar?oi=bibs&hl=en&cites=1527094080747929300",227,"2019-06-05","Book chapter","","","https://scholar.google.com/citations?view_op=view_citation&hl=en&user=QHbmOhQAAAAJ&cstart=200&pagesize=100&citation_for_view=QHbmOhQAAAAJ:z_wVstp3MssC",,,63,71,9,0.24,2,6,37
8,"K Burridge, J Feramisco, S Blose","The association of alpha-actinin and clathrin with the plasma membrane.",1980,"Progress in clinical and biological research","","","https://scholar.google.com/scholar?oi=bibs&hl=en&cites=7688509912893184322",228,"2019-06-05","Journal article","","","https://scholar.google.com/citations?view_op=view_citation&hl=en&user=QHbmOhQAAAAJ&cstart=200&pagesize=100&citation_for_view=QHbmOhQAAAAJ:t7zJ5fGR-2UC",41,,907,924,8,0.21,3,3,39
7,"E Monaghan-Benson, K Burridge","VE-cadherin status as an indicator of microvascular permeability",2013,"Adhesion Protein Protocols","","","https://scholar.google.com/scholar?oi=bibs&hl=en&cites=12158919132680829565,7763348008962224870",229,"2019-06-05","Book chapter","","","https://scholar.google.com/citations?view_op=view_citation&hl=en&user=QHbmOhQAAAAJ&cstart=200&pagesize=100&citation_for_view=QHbmOhQAAAAJ:vDijr-p_gm4C",,,335,342,7,1.17,4,2,6
7,"K Burridge","Studies on alpha-actinin and vinculin: proteins of the adhesion plaque.",1983,"The Anatomical record","Supplement: an offical publication of the American …","","https://scholar.google.com/scholar?oi=bibs&hl=en&cites=16994352650168764717",230,"2019-06-05","","","","https://scholar.google.com/citations?view_op=view_citation&hl=en&user=QHbmOhQAAAAJ&cstart=200&pagesize=100&citation_for_view=QHbmOhQAAAAJ:uc_IGeMz5qoC",,,,,7,0.19,7,1,36
7,"L Connell, K Burridge","A new protein of the adhesion plaque",1982,"JOURNAL OF CELL BIOLOGY 95 (2), A299-A","","","https://scholar.google.com/scholar?oi=bibs&hl=en&cites=82224955458851225",231,"2019-06-05","Journal article","","","https://scholar.google.com/citations?view_op=view_citation&hl=en&user=QHbmOhQAAAAJ&cstart=200&pagesize=100&citation_for_view=QHbmOhQAAAAJ:9Nmd_mFXekcC",299,,,,7,0.19,4,2,37
7,"K Burridge, L Jordan","The application of labeled lectins and antibodies to SDS gels and their use in studying glycoproteins and cell surface antigens during development",1980,"Current topics in developmental biology","","","https://scholar.google.com/scholar?oi=bibs&hl=en&cites=13648775350869966333",232,"2019-06-05","Journal article","","","https://scholar.google.com/citations?view_op=view_citation&hl=en&user=QHbmOhQAAAAJ&cstart=200&pagesize=100&citation_for_view=QHbmOhQAAAAJ:ipzZ9siozwsC",14,,227,241,7,0.18,4,2,39
6,"Y Wang, K Burridge, M Dembo, G Gabbiani, SK Hanks, H Hosoya, ...","Biomedical research publication system",2004,"Science","","","https://scholar.google.com/scholar?oi=bibs&hl=en&cites=14406395727064058721",233,"2019-06-05","Journal article","","","https://scholar.google.com/citations?view_op=view_citation&hl=en&user=QHbmOhQAAAAJ&cstart=200&pagesize=100&citation_for_view=QHbmOhQAAAAJ:AvfA0Oy_GE0C",303,5666,1974,1977,6,0.40,1,7,15
6,"K Burridge, L Molony","Talin: biochemistry and cell biology",1990,"Advances in Molecular and Cell Biology","","","https://scholar.google.com/scholar?oi=bibs&hl=en&cites=12623247755973865903",234,"2019-06-05","Journal article","","","https://scholar.google.com/citations?view_op=view_citation&hl=en&user=QHbmOhQAAAAJ&cstart=200&pagesize=100&citation_for_view=QHbmOhQAAAAJ:XD-gHx7UXLsC",3,,95,109,6,0.21,3,2,29
6,"JH Phillips, K Burridge, PM Conn","Cytoskeletal proteins in cultured secretory cells from rat pituitary",1983,"Experimental cell research","","","https://scholar.google.com/scholar?oi=bibs&hl=en&cites=2050827031024616768",235,"2019-06-05","Journal article","","","https://scholar.google.com/citations?view_op=view_citation&hl=en&user=QHbmOhQAAAAJ&cstart=200&pagesize=100&citation_for_view=QHbmOhQAAAAJ:nrtMV_XWKgEC",148,1,235,242,6,0.17,2,3,36
5,"BP Liu, M ChrzanowskaWodnicka, K Burridge","Rho mediates nocodazole-induced stress fiber and focal adhesion formation.",1996,"Molecular Biology of the Cell","","","https://scholar.google.com/scholar?oi=bibs&hl=en&cites=6482100555957773920",236,"2019-06-05","Journal article","","","https://scholar.google.com/citations?view_op=view_citation&hl=en&user=QHbmOhQAAAAJ&cstart=200&pagesize=100&citation_for_view=QHbmOhQAAAAJ:epqYDVWIO7EC",7,,3055,3055,5,0.22,2,3,23
4,"WR Thompson, SS Yen, G Uzer, Z Xie, B Sen, M Styner, K Burridge, ...","LARG GEF and ARHGAP18 orchestrate RhoA activity to control mesenchymal stem cell lineage",2018,"Bone","","","https://scholar.google.com/scholar?oi=bibs&hl=en&cites=5997383638802799490",237,"2019-06-05","Journal article","","","https://scholar.google.com/citations?view_op=view_citation&hl=en&user=QHbmOhQAAAAJ&cstart=200&pagesize=100&citation_for_view=QHbmOhQAAAAJ:PaBasH6fAo0C",107,,172,180,4,4.00,1,8,1
4,"A Schaefer, TJ Van Duijn, J Majolee, K Burridge, PL Hordijk","Endothelial CD2AP binds the receptor ICAM-1 to control mechanosignaling, leukocyte adhesion, and the route of leukocyte diapedesis in vitro",2017,"The Journal of Immunology","","","https://scholar.google.com/scholar?oi=bibs&hl=en&cites=12348438235539372632",238,"2019-06-05","Journal article","","","https://scholar.google.com/citations?view_op=view_citation&hl=en&user=QHbmOhQAAAAJ&cstart=200&pagesize=100&citation_for_view=QHbmOhQAAAAJ:BzfGm06jWhQC",198,12,4823,4836,4,2.00,1,5,2
4,"PH Mangeat, K Burridge","Microinjection and immunofluorescence microscopy as tools to study cytoskeletal organization in tissue culture cells",1985,"Techniques in immunocytochemistry","","","https://scholar.google.com/scholar?oi=bibs&hl=en&cites=11218917840203442050",239,"2019-06-05","Journal article","","","https://scholar.google.com/citations?view_op=view_citation&hl=en&user=QHbmOhQAAAAJ&cstart=200&pagesize=100&citation_for_view=QHbmOhQAAAAJ:ML0RJ9NH7IQC",3,,79,79,4,0.12,2,2,34
4,"JR Feramisco, K Burridge, JE Smart, GP Thomas","COEXISTENCE OF VINCULIN AND A VINCULIN-LIKE PROTEIN OF HIGHER MOLECULAR-WEIGHT IN SMOOTH-MUSCLE",1981,"JOURNAL OF CELL BIOLOGY 91 (2), A292-A","","","https://scholar.google.com/scholar?oi=bibs&hl=en&cites=12412579998912664464",240,"2019-06-05","Journal article","","","https://scholar.google.com/citations?view_op=view_citation&hl=en&user=QHbmOhQAAAAJ&cstart=200&pagesize=100&citation_for_view=QHbmOhQAAAAJ:uWiczbcajpAC",292,,,,4,0.11,1,4,38
4,"JR Feramisco, K Burridge, P de Lanerolle, RS Adelstein","Localization of myosin light-chain kinase in nonmuscle cells",1981,"Protein Phosphorylation. O. M Rosen and EG Krebs, editors","Cold Spring …","","https://scholar.google.com/scholar?oi=bibs&hl=en&cites=3320428913123882810",241,"2019-06-05","","","","https://scholar.google.com/citations?view_op=view_citation&hl=en&user=QHbmOhQAAAAJ&cstart=200&pagesize=100&citation_for_view=QHbmOhQAAAAJ:zLWjf1WUPmwC",,,,,4,0.11,1,4,38
3,"YM Morillon, EC Lessey-Morillon, M Clark, R Zhang, B Wang, K Burridge, ...","Antibody binding to CD4 induces Rac GTPase activation and alters T cell migration",2016,"The Journal of Immunology","","","https://scholar.google.com/scholar?oi=bibs&hl=en&cites=2495591679052734009",242,"2019-06-05","Journal article","","","https://scholar.google.com/citations?view_op=view_citation&hl=en&user=QHbmOhQAAAAJ&cstart=200&pagesize=100&citation_for_view=QHbmOhQAAAAJ:NyGDZy8z5eUC",197,9,3504,3511,3,1.00,0,7,3
3,"AP Gilmore, K Burridge","THE ASSOCIATION OF VINCULIN WITH ITS LIGANDS IS REGULATED BY PHOSPHATIDYLINOSITOL-4-5-BISPHOSPHATE",1995,"MOLECULAR BIOLOGY OF THE CELL","","","https://scholar.google.com/scholar?oi=bibs&hl=en&cites=8069321497106221149",243,"2019-06-05","Journal article","","","https://scholar.google.com/citations?view_op=view_citation&hl=en&user=QHbmOhQAAAAJ&cstart=200&pagesize=100&citation_for_view=QHbmOhQAAAAJ:Z5m8FVwuT1cC",6,,1978,1978,3,0.13,2,2,24
3,"P Mangeat, T Kelly, K Burridge","NON-ERYTHROCYTE SPECTRINS-ACTIN-MEMBRANE ATTACHMENT PROTEINS OCCURRING IN MANY CELL-TYPES",1982,"JOURNAL OF CELL BIOLOGY 95 (2), A294-A","","","https://scholar.google.com/scholar?oi=bibs&hl=en&cites=12990491868423829364",244,"2019-06-05","Journal article","","","https://scholar.google.com/citations?view_op=view_citation&hl=en&user=QHbmOhQAAAAJ&cstart=200&pagesize=100&citation_for_view=QHbmOhQAAAAJ:4MWp96NkSFoC",294,,,,3,0.08,1,3,37
3,"JJC Lin, K Burridge","PREPARATION OF MONOCLONAL-ANTIBODIES AGAINST CYTOSKELETAL COMPONENTS OF CHICKEN GIZZARD",1980,"JOURNAL OF CELL BIOLOGY 87 (2), A216-A","","","https://scholar.google.com/scholar?oi=bibs&hl=en&cites=1191442685921833078",245,"2019-06-05","Journal article","","","https://scholar.google.com/citations?view_op=view_citation&hl=en&user=QHbmOhQAAAAJ&cstart=200&pagesize=100&citation_for_view=QHbmOhQAAAAJ:p__nRnzSRKYC",216,,,,3,0.08,2,2,39
2,"MC Srougi, K Burridge","Undressing a cellular corset: septins exposed",2009,"nature cell biology","","","https://scholar.google.com/scholar?oi=bibs&hl=en&cites=18398892822827045013",246,"2019-06-05","Journal article","","","https://scholar.google.com/citations?view_op=view_citation&hl=en&user=QHbmOhQAAAAJ&cstart=200&pagesize=100&citation_for_view=QHbmOhQAAAAJ:LI9QrySNdTsC",11,1,9,9,2,0.20,1,2,10
2,"B Liu, M Chrzanowska-Wodnicka, K Burridge","Regulation of cell contractility by RhoA: stress fiber and focal adhesion assembly",1999,"Signaling through Cell Adhesion Molecules","","","https://scholar.google.com/scholar?oi=bibs&hl=en&cites=11097459764526488655",247,"2019-06-05","Book chapter","","","https://scholar.google.com/citations?view_op=view_citation&hl=en&user=QHbmOhQAAAAJ&cstart=200&pagesize=100&citation_for_view=QHbmOhQAAAAJ:WC9gN4BGCRcC",,,245,259,2,0.10,1,3,20
2,"K Burridge","Focal adhesions: Assembly and signaling",1997,"FASEB JOURNAL 11 (9), A1001-A","","","https://scholar.google.com/scholar?oi=bibs&hl=en&cites=15720433148947268126",248,"2019-06-05","Journal article","","","https://scholar.google.com/citations?view_op=view_citation&hl=en&user=QHbmOhQAAAAJ&cstart=200&pagesize=100&citation_for_view=QHbmOhQAAAAJ:EYYDruWGBe4C",1001,,,,2,0.09,2,1,22
2,"SM Bockholt, K Burridge","Focal adhesions and integrin-mediated cell signaling",1995,"The Cytoskeleton: A Multi-Volume Treatise","","","https://scholar.google.com/scholar?oi=bibs&hl=en&cites=8552740299410718160",249,"2019-06-05","Journal article","","","https://scholar.google.com/citations?view_op=view_citation&hl=en&user=QHbmOhQAAAAJ&cstart=200&pagesize=100&citation_for_view=QHbmOhQAAAAJ:0CzhzZyukY4C",2,,167,206,2,0.08,1,2,24
2,"R Sealock, B Paschal, K Burridge","TALIN IS A COMPONENT OF THE MAMMALIAN NEUROMUSCULAR-JUNCTION",1984,"JOURNAL OF CELL BIOLOGY 99 (4), A296-A","","","https://scholar.google.com/scholar?oi=bibs&hl=en&cites=11150226546819065330",250,"2019-06-05","Journal article","","","https://scholar.google.com/citations?view_op=view_citation&hl=en&user=QHbmOhQAAAAJ&cstart=200&pagesize=100&citation_for_view=QHbmOhQAAAAJ:tYavs44e6CUC",296,,,,2,0.06,1,3,35
2,"T OHALLORAN, K Burridge","ISOLATION OF A 195,000 DALTON VINCULIN-BINDING PROTEIN FROM CHICKEN GIZZARD-RELATIONSHIP TO TALIN",1984,"JOURNAL OF CELL BIOLOGY 99 (4), A305-A","","","https://scholar.google.com/scholar?oi=bibs&hl=en&cites=315496434728842525",251,"2019-06-05","Journal article","","","https://scholar.google.com/citations?view_op=view_citation&hl=en&user=QHbmOhQAAAAJ&cstart=200&pagesize=100&citation_for_view=QHbmOhQAAAAJ:BwyfMAYsbu0C",305,,,,2,0.06,1,2,35
2,"K Burridge","A new view inside cells",1980,"Nature","","","https://scholar.google.com/scholar?oi=bibs&hl=en&cites=17975416217608976327",252,"2019-06-05","Journal article","","","https://scholar.google.com/citations?view_op=view_citation&hl=en&user=QHbmOhQAAAAJ&cstart=200&pagesize=100&citation_for_view=QHbmOhQAAAAJ:MLfJN-KU85MC",288,5790,433,433,2,0.05,2,1,39
2,"K Burridge","Multiple forms of non-muscle myosin",1976,"Cell Motility","","","https://scholar.google.com/scholar?oi=bibs&hl=en&cites=13642360498762047766",253,"2019-06-05","Book chapter","","","https://scholar.google.com/citations?view_op=view_citation&hl=en&user=QHbmOhQAAAAJ&cstart=200&pagesize=100&citation_for_view=QHbmOhQAAAAJ:hsZV8lGYWTMC",,,739,747,2,0.05,2,1,43
1,"W Xu, ES Wittchen, SL Hoopes, L Stefanini, K Burridge, KM Caron","Small GTPase Rap1A/B is required for lymphatic development and adrenomedullin-induced stabilization of lymphatic endothelial junctions",2018,"Arteriosclerosis, Thrombosis, and Vascular Biology","","","https://scholar.google.com/scholar?oi=bibs&hl=en&cites=7522318905775816460",254,"2019-06-05","Journal article","","","https://scholar.google.com/citations?view_op=view_citation&hl=en&user=QHbmOhQAAAAJ&cstart=200&pagesize=100&citation_for_view=QHbmOhQAAAAJ:wKETBy42zhYC",38,10,2410,2422,1,1.00,0,6,1
1,"E Monaghan-Benson, ES Wittchen, CM Doerschuk, K Burridge","A Rnd3/p190RhoGAP pathway regulates RhoA activity in idiopathic pulmonary fibrosis fibroblasts",2018,"Molecular biology of the cell","","","https://scholar.google.com/scholar?oi=bibs&hl=en&cites=10424167491361605371",255,"2019-06-05","Journal article","","","https://scholar.google.com/citations?view_op=view_citation&hl=en&user=QHbmOhQAAAAJ&cstart=200&pagesize=100&citation_for_view=QHbmOhQAAAAJ:7H_MAutzIkAC",29,18,2165,2175,1,1.00,0,4,1
1,"EC Lessey-Morillon, LD Osborne, E Monaghan-Benson, C Guilluy, ...","The RhoA GEF, LARG, mediates ICAM-1-dependent mechanotransduction in endothelial cells to stimulate transendothelial migration",2014,"Journal of immunology (Baltimore, Md.: 1950)","","","https://scholar.google.com/scholar?oi=bibs&hl=en&cites=11997291779184496784",256,"2019-06-05","Journal article","","","https://scholar.google.com/citations?view_op=view_citation&hl=en&user=QHbmOhQAAAAJ&cstart=200&pagesize=100&citation_for_view=QHbmOhQAAAAJ:HeT0ZceujKMC",192,7,3390,3390,1,0.20,0,5,5
1,"K Burridge, ES Wittchen","Stress fibers get a makeover",2012,"Biophysical journal","","","https://scholar.google.com/scholar?oi=bibs&hl=en&cites=11433321995027325588",257,"2019-06-05","Journal article","","","https://scholar.google.com/citations?view_op=view_citation&hl=en&user=QHbmOhQAAAAJ&cstart=200&pagesize=100&citation_for_view=QHbmOhQAAAAJ:TIZ-Mc8IlK0C",103,10,2045,2045,1,0.14,1,2,7
1,"S Jha, V Jones, K Burridge, S Mukhopadhyay","Cb2 receptor-mediated regulation of prostate cancer cell migration: involvement of rhoa and stress fiber formation",2012,"The FASEB Journal 26 (1_supplement), 782.11-782.","","","https://scholar.google.com/scholar?oi=bibs&hl=en&cites=15790894507377204765",258,"2019-06-05","Journal article","","","https://scholar.google.com/citations?view_op=view_citation&hl=en&user=QHbmOhQAAAAJ&cstart=200&pagesize=100&citation_for_view=QHbmOhQAAAAJ:5icHVeHT4IsC",11,,,,1,0.14,0,4,7
1,"K Burridge, A Dubash, R Garcia-Mata, E Monaghan-Benson","Rho GTPases and cell adhesion: upstream and downstream signaling",2009,"FEBS JOURNAL","","","https://scholar.google.com/scholar?oi=bibs&hl=en&cites=3116814568342128181",259,"2019-06-05","Journal article","","","https://scholar.google.com/citations?view_op=view_citation&hl=en&user=QHbmOhQAAAAJ&cstart=200&pagesize=100&citation_for_view=QHbmOhQAAAAJ:XoXfffV-tXoC",276,,49,49,1,0.10,0,4,10
1,"M Casiraghi, J Abano, K Burridge, S Randell, TM Egan","427: Toll-Like Receptor-4 (TLR4) Inhibition Reduces Actin Cytoskeletal Re-Arrangement and Gap Formation in Cultured Human Pulmonary Microvascular Endothelial Cells (HMVECs …",2008,"Journal of Heart and Lung Transplantation 2 (27), S214-S","","","https://scholar.google.com/scholar?oi=bibs&hl=en&cites=13317423021966112537",260,"2019-06-05","Journal article","","","https://scholar.google.com/citations?view_op=view_citation&hl=en&user=QHbmOhQAAAAJ&cstart=200&pagesize=100&citation_for_view=QHbmOhQAAAAJ:gsN89kCJA0AC",215,,,,1,0.09,0,5,11
1,"B Worthylake, K Burridge","RhoA and p160ROCK regulate tail retraction in migrating monoctyes",2001,"MOLECULAR BIOLOGY OF THE CELL 12, 304A-305A","","","https://scholar.google.com/scholar?oi=bibs&hl=en&cites=17312200143909399577",261,"2019-06-05","","","","https://scholar.google.com/citations?view_op=view_citation&hl=en&user=QHbmOhQAAAAJ&cstart=200&pagesize=100&citation_for_view=QHbmOhQAAAAJ:tuHXwOkdijsC",,,,,1,0.06,1,2,18
1,"K Burridge, S Tsukita","Cell-to-cell contact and extracellular matrix-Editorial overview",2001,"CURRENT OPINION IN CELL BIOLOGY","","","https://scholar.google.com/scholar?oi=bibs&hl=en&cites=13585512173106928222",262,"2019-06-05","Journal article","","","https://scholar.google.com/citations?view_op=view_citation&hl=en&user=QHbmOhQAAAAJ&cstart=200&pagesize=100&citation_for_view=QHbmOhQAAAAJ:kuK5TVdYjLIC",13,5,525,528,1,0.06,1,2,18
1,"CL Zhong, M Kinch, K Burridge","Rho-stimulated contractility contributes to the fibroblastic phenotype of Ras-transformed epithelial cells.",1996,"MOLECULAR BIOLOGY OF THE CELL","","","https://scholar.google.com/scholar?oi=bibs&hl=en&cites=6719834968296617597",263,"2019-06-05","Journal article","","","https://scholar.google.com/citations?view_op=view_citation&hl=en&user=QHbmOhQAAAAJ&cstart=200&pagesize=100&citation_for_view=QHbmOhQAAAAJ:g3aElNc5_aQC",7,,3056,3056,1,0.04,0,3,23
1,"AM Belkin, NI Zhidkova, F Balzac, F ALTRUDA, D TOMATIS, A MAYER, ...","BETA-1D-A NOVEL CYTOPLASMIC DOMAIN ISOFORM OF BETA-1 INTEGRIN EXPRESSED IN STRIATED MUSCLES",1995,"MOLECULAR BIOLOGY OF THE CELL","","","https://scholar.google.com/scholar?oi=bibs&hl=en&cites=18263972229222903297",264,"2019-06-05","Journal article","","","https://scholar.google.com/citations?view_op=view_citation&hl=en&user=QHbmOhQAAAAJ&cstart=200&pagesize=100&citation_for_view=QHbmOhQAAAAJ:lmc2jWPfTJgC",6,,1651,1651,1,0.04,0,7,24
1,"K Burridge, WT Jackman","Membrane-cytoskeletal interactions in cell adhesion and locomotion",1990,"Biophysics of the Cell Surface","","","https://scholar.google.com/scholar?oi=bibs&hl=en&cites=14540858255661717974",265,"2019-06-05","Book chapter","","","https://scholar.google.com/citations?view_op=view_citation&hl=en&user=QHbmOhQAAAAJ&cstart=200&pagesize=100&citation_for_view=QHbmOhQAAAAJ:b1wdh0AR-JQC",,,323,339,1,0.03,1,2,29
1,"K Burridge, T OHALLORAN, B Paschal, L Milam, P MAHGEAT, R Sealock","PROTEINS THAT INTERFACE BETWEEN THE CYTOSKELETON AND THE PLASMA-MEMBRANE",1984,"JOURNAL OF CELL BIOLOGY 99 (4), A113-A","","","https://scholar.google.com/scholar?oi=bibs&hl=en&cites=4349981659012463850",266,"2019-06-05","Journal article","","","https://scholar.google.com/citations?view_op=view_citation&hl=en&user=QHbmOhQAAAAJ&cstart=200&pagesize=100&citation_for_view=QHbmOhQAAAAJ:L7CI7m0gUJcC",113,,,,1,0.03,0,6,35
1,"P Mangeat, K Burridge","Immunoprecipitation of non-erythrocyte spectrin within cultured fibroblasts following antibody microinjection",1983,"JOURNAL OF CELL BIOLOGY 97 (5), A285-A","","","https://scholar.google.com/scholar?oi=bibs&hl=en&cites=4524795558426419222",267,"2019-06-05","Journal article","","","https://scholar.google.com/citations?view_op=view_citation&hl=en&user=QHbmOhQAAAAJ&cstart=200&pagesize=100&citation_for_view=QHbmOhQAAAAJ:ILKRHgRFtOwC",285,,,,1,0.03,1,2,36
0,"BP Liu, M Chrzanowska-Wodnicka, K Burridge","Regulation of Cell Contractility by RhoA: Stress Fiber and Focal",2019,"Signaling Through Cell Adhesion Molecules","","","",268,"2019-06-05","Journal article","","","https://scholar.google.com/citations?view_op=view_citation&hl=en&user=QHbmOhQAAAAJ&cstart=200&pagesize=100&citation_for_view=QHbmOhQAAAAJ:yqoGN6RLRZoC",245,,,,0,0.00,0,3,1
