Cites,Authors,Title,Year,Source,Publisher,ArticleURL,CitesURL,GSRank,QueryDate,Type,DOI,ISSN,CitationURL,Volume,Issue,StartPage,EndPage,ECC,CitesPerYear,CitesPerAuthor,AuthorCount,Age
4603,"AJ Ridley, MA Schwartz, K Burridge, RA Firtel, MH Ginsberg, G Borisy, ...","Cell migration: integrating signals from front to back",2003,"Science","","","https://scholar.google.com/scholar?oi=bibs&hl=en&cites=337921202486555877",1,"2019-06-05","Journal article","","","https://scholar.google.com/citations?view_op=view_citation&hl=en&user=QHbmOhQAAAAJ&pagesize=100&citation_for_view=QHbmOhQAAAAJ:u5HHmVD_uO8C",302,5651,1704,1709,4603,287.69,658,7,16
2417,"K Burridge, K Fath, T Kelly, G Nuckolls, C Turner","Focal adhesions: transmembrane junctions between the extracellular matrix and the cytoskeleton",1988,"Annual review of cell biology","","","https://scholar.google.com/scholar?oi=bibs&hl=en&cites=14567429589621742102",2,"2019-06-05","Journal article","","","https://scholar.google.com/citations?view_op=view_citation&hl=en&user=QHbmOhQAAAAJ&pagesize=100&citation_for_view=QHbmOhQAAAAJ:u-x6o8ySG0sC",4,1,487,525,2417,77.97,483,5,31
2167,"K Burridge, M Chrzanowska-Wodnicka","Focal adhesions, contractility, and signaling",1996,"Annual review of cell and developmental biology","","","https://scholar.google.com/scholar?oi=bibs&hl=en&cites=12817029232994963091",3,"2019-06-05","Journal article","","","https://scholar.google.com/citations?view_op=view_citation&hl=en&user=QHbmOhQAAAAJ&pagesize=100&citation_for_view=QHbmOhQAAAAJ:d1gkVwhDpl0C",12,1,463,519,2167,94.22,1084,2,23
1970,"K Burridge, K Wennerberg","Rho and Rac take center stage",2004,"Cell","","","https://scholar.google.com/scholar?oi=bibs&hl=en&cites=11400335426402982815",4,"2019-06-05","Journal article","","","https://scholar.google.com/citations?view_op=view_citation&hl=en&user=QHbmOhQAAAAJ&pagesize=100&citation_for_view=QHbmOhQAAAAJ:9yKSN-GCB0IC",116,2,167,179,1970,131.33,985,2,15
1699,"M Chrzanowska-Wodnicka, K Burridge","Rho-stimulated contractility drives the formation of stress fibers and focal adhesions.",1996,"The Journal of cell biology","","","https://scholar.google.com/scholar?oi=bibs&hl=en&cites=6795511266105309745",5,"2019-06-05","Journal article","","","https://scholar.google.com/citations?view_op=view_citation&hl=en&user=QHbmOhQAAAAJ&pagesize=100&citation_for_view=QHbmOhQAAAAJ:2osOgNQ5qMEC",133,6,1403,1415,1699,73.87,850,2,23
1415,"K Burridge, CE Turner, LH Romer","Tyrosine phosphorylation of paxillin and pp125FAK accompanies cell adhesion to extracellular matrix: a role in cytoskeletal assembly.",1992,"The Journal of cell biology","","","https://scholar.google.com/scholar?oi=bibs&hl=en&cites=16109030994728238762",6,"2019-06-05","Journal article","","","https://scholar.google.com/citations?view_op=view_citation&hl=en&user=QHbmOhQAAAAJ&pagesize=100&citation_for_view=QHbmOhQAAAAJ:qjMakFHDy7sC",119,4,893,903,1415,52.41,472,3,27
1291,"A Horwitz, K Duggan, C Buck, MC Beckerle, K Burridge","Interaction of plasma membrane fibronectin receptor with talin—a transmembrane linkage",1986,"Nature","","","https://scholar.google.com/scholar?oi=bibs&hl=en&cites=6473767986192212537",7,"2019-06-05","Journal article","","","https://scholar.google.com/citations?view_op=view_citation&hl=en&user=QHbmOhQAAAAJ&pagesize=100&citation_for_view=QHbmOhQAAAAJ:UeHWp8X0CEIC",320,6062,531,531,1291,39.12,258,5,33
982,"CA Otey, FM Pavalko, K Burridge","An interaction between alpha-actinin and the beta 1 integrin subunit in vitro.",1990,"The Journal of cell biology","","","https://scholar.google.com/scholar?oi=bibs&hl=en&cites=7608131102855178203",8,"2019-06-05","Journal article","","","https://scholar.google.com/citations?view_op=view_citation&hl=en&user=QHbmOhQAAAAJ&pagesize=100&citation_for_view=QHbmOhQAAAAJ:IjCSPb-OGe4C",111,2,721,729,982,33.86,327,3,29
843,"SM Schoenwaelder, K Burridge","Bidirectional signaling between the cytoskeleton and integrins",1999,"Current opinion in cell biology","","","https://scholar.google.com/scholar?oi=bibs&hl=en&cites=713945179478618737",9,"2019-06-05","Journal article","","","https://scholar.google.com/citations?view_op=view_citation&hl=en&user=QHbmOhQAAAAJ&pagesize=100&citation_for_view=QHbmOhQAAAAJ:zYLM7Y9cAGgC",11,2,274,286,843,42.15,422,2,20
743,"Q Chen, MS Kinch, TH Lin, K Burridge, RL Juliano","Integrin-mediated cell adhesion activates mitogen-activated protein kinases.",1994,"Journal of Biological Chemistry","","","https://scholar.google.com/scholar?oi=bibs&hl=en&cites=7376174349379346158",10,"2019-06-05","Journal article","","","https://scholar.google.com/citations?view_op=view_citation&hl=en&user=QHbmOhQAAAAJ&pagesize=100&citation_for_view=QHbmOhQAAAAJ:Tyk-4Ss8FVUC",269,43,26602,26605,743,29.72,149,5,25
707,"R Gilmore, P Walter, G Blobel","Protein translocation across the endoplasmic reticulum. II. Isolation and characterization of the signal recognition particle receptor.",1982,"The Journal of cell biology","","","https://scholar.google.com/scholar?oi=bibs&hl=en&cites=14181339484230566043,1412742589778739598",11,"2019-06-05","Journal article","","","https://scholar.google.com/citations?view_op=view_citation&hl=en&user=QHbmOhQAAAAJ&pagesize=100&citation_for_view=QHbmOhQAAAAJ:PVgj2kMGcgYC",95,2,470,477,707,19.11,236,3,37
693,"CE Turner, JR Glenney, K Burridge","Paxillin: a new vinculin-binding protein present in focal adhesions.",1990,"The Journal of cell biology","","","https://scholar.google.com/scholar?oi=bibs&hl=en&cites=11349706579072237205",12,"2019-06-05","Journal article","","","https://scholar.google.com/citations?view_op=view_citation&hl=en&user=QHbmOhQAAAAJ&pagesize=100&citation_for_view=QHbmOhQAAAAJ:Y0pCki6q_DkC",111,3,1059,1068,693,23.90,231,3,29
659,"E Lazarides, K Burridge","α-Actinin: immunofluorescent localization of a muscle structural protein in nonmuscle cells",1975,"Cell","","","https://scholar.google.com/scholar?oi=bibs&hl=en&cites=13905820393645101966",13,"2019-06-05","Journal article","","","https://scholar.google.com/citations?view_op=view_citation&hl=en&user=QHbmOhQAAAAJ&pagesize=100&citation_for_view=QHbmOhQAAAAJ:W7OEmFMy1HYC",6,3,289,298,659,14.98,330,2,44
620,"NK Noren, BP Liu, K Burridge, B Kreft","p120 catenin regulates the actin cytoskeleton via Rho family GTPases",2000,"The Journal of cell biology","","","https://scholar.google.com/scholar?oi=bibs&hl=en&cites=13178477565183615923",14,"2019-06-05","Journal article","","","https://scholar.google.com/citations?view_op=view_citation&hl=en&user=QHbmOhQAAAAJ&pagesize=100&citation_for_view=QHbmOhQAAAAJ:eQOLeE2rZwMC",150,3,567,580,620,32.63,155,4,19
579,"KA DeMali, K Wennerberg, K Burridge","Integrin signaling to the actin cytoskeleton",2003,"Current opinion in cell biology","","","https://scholar.google.com/scholar?oi=bibs&hl=en&cites=10572977613322292266",15,"2019-06-05","Journal article","","","https://scholar.google.com/citations?view_op=view_citation&hl=en&user=QHbmOhQAAAAJ&pagesize=100&citation_for_view=QHbmOhQAAAAJ:ufrVoPGSRksC",15,5,572,582,579,36.19,193,3,16
574,"AP Gilmore, K Burridge","Regulation of vinculin binding to talin and actin by phosphatidyl-inositol-4-5-bisphosphate",1996,"Nature","","","https://scholar.google.com/scholar?oi=bibs&hl=en&cites=60028973943801231",16,"2019-06-05","Journal article","","","https://scholar.google.com/citations?view_op=view_citation&hl=en&user=QHbmOhQAAAAJ&pagesize=100&citation_for_view=QHbmOhQAAAAJ:YsMSGLbcyi4C",381,6582,531,531,574,24.96,287,2,23
568,"C Zhong, M Chrzanowska-Wodnicka, J Brown, A Shaub, AM Belkin, ...","Rho-mediated contractility exposes a cryptic site in fibronectin and induces fibronectin matrix assembly",1998,"The Journal of cell biology","","","https://scholar.google.com/scholar?oi=bibs&hl=en&cites=4282224521413760951",17,"2019-06-05","Journal article","","","https://scholar.google.com/citations?view_op=view_citation&hl=en&user=QHbmOhQAAAAJ&pagesize=100&citation_for_view=QHbmOhQAAAAJ:_FxGoFyzp5QC",141,2,539,551,568,27.05,95,6,21
558,"SK Sastry, K Burridge","Focal adhesions: a nexus for intracellular signaling and cytoskeletal dynamics",2000,"Experimental cell research","","","https://scholar.google.com/scholar?oi=bibs&hl=en&cites=13314001714195446355",18,"2019-06-05","Journal article","","","https://scholar.google.com/citations?view_op=view_citation&hl=en&user=QHbmOhQAAAAJ&pagesize=100&citation_for_view=QHbmOhQAAAAJ:WF5omc3nYNoC",261,1,25,36,558,29.37,279,2,19
530,"RA Worthylake, S Lemoine, JM Watson, K Burridge","RhoA is required for monocyte tail retraction during transendothelial migration",2001,"The Journal of cell biology","","","https://scholar.google.com/scholar?oi=bibs&hl=en&cites=16346349501437007284",19,"2019-06-05","Journal article","","","https://scholar.google.com/citations?view_op=view_citation&hl=en&user=QHbmOhQAAAAJ&pagesize=100&citation_for_view=QHbmOhQAAAAJ:LkGwnXOMwfcC",154,1,147,160,530,29.44,133,4,18
502,"CM Waterman-Storer, RA Worthylake, BP Liu, K Burridge, ED Salmon","Microtubule growth activates Rac1 to promote lamellipodial protrusion in fibroblasts",1999,"Nature cell biology","","","https://scholar.google.com/scholar?oi=bibs&hl=en&cites=25242470649281408",20,"2019-06-05","Journal article","","","https://scholar.google.com/citations?view_op=view_citation&hl=en&user=QHbmOhQAAAAJ&pagesize=100&citation_for_view=QHbmOhQAAAAJ:roLk4NBRz8UC",1,1,45,45,502,25.10,100,5,20
488,"WT Arthur, K Burridge","RhoA inactivation by p190RhoGAP regulates cell spreading and migration by promoting membrane protrusion and polarity",2001,"Molecular biology of the cell","","","https://scholar.google.com/scholar?oi=bibs&hl=en&cites=11553067791390152441,4212253782734831152",21,"2019-06-05","Journal article","","","https://scholar.google.com/citations?view_op=view_citation&hl=en&user=QHbmOhQAAAAJ&pagesize=100&citation_for_view=QHbmOhQAAAAJ:Se3iqnhoufwC",12,9,2711,2720,488,27.11,244,2,18
475,"WT Arthur, LA Petch, K Burridge","Integrin engagement suppresses RhoA activity via a c-Src-dependent mechanism",2000,"Current Biology","","","https://scholar.google.com/scholar?oi=bibs&hl=en&cites=7849679003871924466",22,"2019-06-05","Journal article","","","https://scholar.google.com/citations?view_op=view_citation&hl=en&user=QHbmOhQAAAAJ&pagesize=100&citation_for_view=QHbmOhQAAAAJ:hqOjcs7Dif8C",10,12,719,722,475,25.00,158,3,19
469,"NK Noren, CM Niessen, BM Gumbiner, K Burridge","Cadherin engagement regulates Rho family GTPases",2001,"Journal of Biological Chemistry","","","https://scholar.google.com/scholar?oi=bibs&hl=en&cites=15036292926727160226",23,"2019-06-05","Journal article","","","https://scholar.google.com/citations?view_op=view_citation&hl=en&user=QHbmOhQAAAAJ&pagesize=100&citation_for_view=QHbmOhQAAAAJ:UebtZRa9Y70C",276,36,33305,33308,469,26.06,117,4,18
457,"K Burridge, P Mangeat","An interaction between vinculin and talin",1984,"Nature","","","https://scholar.google.com/scholar?oi=bibs&hl=en&cites=6927384613550719966",24,"2019-06-05","Journal article","","","https://scholar.google.com/citations?view_op=view_citation&hl=en&user=QHbmOhQAAAAJ&pagesize=100&citation_for_view=QHbmOhQAAAAJ:5nxA0vEk-isC",308,5961,744,744,457,13.06,229,2,35
439,"K Burridge, JR Feramisco","Microinjection and localization of a 130K protein in living fibroblasts: a relationship to actin and fibronectin",1980,"Cell","","","https://scholar.google.com/scholar?oi=bibs&hl=en&cites=16229539687696912055",25,"2019-06-05","Journal article","","","https://scholar.google.com/citations?view_op=view_citation&hl=en&user=QHbmOhQAAAAJ&pagesize=100&citation_for_view=QHbmOhQAAAAJ:8k81kl-MbHgC",19,3,587,595,439,11.26,220,2,39
427,"JR Feramisco, K Burridge","A rapid purification of alpha-actinin, filamin, and a 130,000-dalton protein from smooth muscle.",1980,"Journal of Biological Chemistry","","","https://scholar.google.com/scholar?oi=bibs&hl=en&cites=4171106322066114205",26,"2019-06-05","Journal article","","","https://scholar.google.com/citations?view_op=view_citation&hl=en&user=QHbmOhQAAAAJ&pagesize=100&citation_for_view=QHbmOhQAAAAJ:0EnyYjriUFMC",255,3,1194,1199,427,10.95,214,2,39
421,"K Burridge, L Connell","A new protein of adhesion plaques and ruffling membranes.",1983,"The Journal of cell biology","","","https://scholar.google.com/scholar?oi=bibs&hl=en&cites=7898146964532386099",27,"2019-06-05","Journal article","","","https://scholar.google.com/citations?view_op=view_citation&hl=en&user=QHbmOhQAAAAJ&pagesize=100&citation_for_view=QHbmOhQAAAAJ:MXK_kJrjxJIC",97,2,359,367,421,11.69,211,2,36
398,"KA DeMali, CA Barlow, K Burridge","Recruitment of the Arp2/3 complex to vinculin: coupling membrane protrusion to matrix adhesion",2002,"J Cell Biol","","","https://scholar.google.com/scholar?oi=bibs&hl=en&cites=8148520182470892744",28,"2019-06-05","Journal article","","","https://scholar.google.com/citations?view_op=view_citation&hl=en&user=QHbmOhQAAAAJ&pagesize=100&citation_for_view=QHbmOhQAAAAJ:3fE2CSJIrl8C",159,5,881,891,398,23.41,133,3,17
393,"R Garcia-Mata, E Boulter, K Burridge","The'invisible hand': regulation of RHO GTPases by RHOGDIs",2011,"Nature reviews Molecular cell biology","","","https://scholar.google.com/scholar?oi=bibs&hl=en&cites=9913507211584314542",29,"2019-06-05","Journal article","","","https://scholar.google.com/citations?view_op=view_citation&hl=en&user=QHbmOhQAAAAJ&pagesize=100&citation_for_view=QHbmOhQAAAAJ:9ZlFYXVOiuMC",12,8,493,493,393,49.13,131,3,8
349,"K Burridge","Changes in cellular glycoproteins after transformation: identification of specific glycoproteins and antigens in sodium dodecyl sulfate gels",1976,"Proceedings of the National Academy of Sciences","","","https://scholar.google.com/scholar?oi=bibs&hl=en&cites=1919945730414911062",30,"2019-06-05","Journal article","","","https://scholar.google.com/citations?view_op=view_citation&hl=en&user=QHbmOhQAAAAJ&pagesize=100&citation_for_view=QHbmOhQAAAAJ:KlAtU1dfN6UC",73,12,4457,4461,349,8.12,349,1,43
344,"JR Feramisco, JE Smart, K Burridge, DM Helfman, GP Thomas","Co-existence of vinculin and a vinculin-like protein of higher molecular weight in smooth muscle.",1982,"Journal of Biological Chemistry","","","https://scholar.google.com/scholar?oi=bibs&hl=en&cites=6796444413358187897",31,"2019-06-05","Journal article","","","https://scholar.google.com/citations?view_op=view_citation&hl=en&user=QHbmOhQAAAAJ&pagesize=100&citation_for_view=QHbmOhQAAAAJ:kNdYIx-mwKoC",257,18,11024,11031,344,9.30,69,5,37
341,"MS Kinch, GJ Clark, CJ Der, K Burridge","Tyrosine phosphorylation regulates the adhesions of ras-transformed breast epithelia.",1995,"The Journal of Cell Biology","","","https://scholar.google.com/scholar?oi=bibs&hl=en&cites=6526677986767749582",32,"2019-06-05","Journal article","","","https://scholar.google.com/citations?view_op=view_citation&hl=en&user=QHbmOhQAAAAJ&pagesize=100&citation_for_view=QHbmOhQAAAAJ:Zph67rFs4hoC",130,2,461,471,341,14.21,85,4,24
322,"RA Worthylake, K Burridge","RhoA and ROCK promote migration by limiting membrane protrusions",2003,"Journal of Biological Chemistry","","","https://scholar.google.com/scholar?oi=bibs&hl=en&cites=15115699740263715374",33,"2019-06-05","Journal article","","","https://scholar.google.com/citations?view_op=view_citation&hl=en&user=QHbmOhQAAAAJ&pagesize=100&citation_for_view=QHbmOhQAAAAJ:_kc_bZDykSQC",278,15,13578,13584,322,20.13,161,2,16
320,"RA Worthylake, K Burridge","Leukocyte transendothelial migration: orchestrating the underlying molecular machinery",2001,"Current opinion in cell biology","","","https://scholar.google.com/scholar?oi=bibs&hl=en&cites=5824062603905364275",34,"2019-06-05","Journal article","","","https://scholar.google.com/citations?view_op=view_citation&hl=en&user=QHbmOhQAAAAJ&pagesize=100&citation_for_view=QHbmOhQAAAAJ:YOwf2qJgpHMC",13,5,569,577,320,17.78,160,2,18
317,"GE Pollerberg, K Burridge, KE Krebs, SR Goodman, M Schachner","The 180-kD component of the neural cell adhesion molecule N-CAM is involved in cell-cell contacts and cytoskeleton-membrane interactions",1987,"Cell and tissue research","","","https://scholar.google.com/scholar?oi=bibs&hl=en&cites=23584100265744101",35,"2019-06-05","Journal article","","","https://scholar.google.com/citations?view_op=view_citation&hl=en&user=QHbmOhQAAAAJ&pagesize=100&citation_for_view=QHbmOhQAAAAJ:ULOm3_A8WrAC",250,1,227,236,317,9.91,63,5,32
314,"CA Otey, GB Vasquez, K Burridge, BW Erickson","Mapping of the alpha-actinin binding site within the beta 1 integrin cytoplasmic domain.",1993,"Journal of Biological Chemistry","","","https://scholar.google.com/scholar?oi=bibs&hl=en&cites=4074626777568185499",36,"2019-06-05","Journal article","","","https://scholar.google.com/citations?view_op=view_citation&hl=en&user=QHbmOhQAAAAJ&pagesize=100&citation_for_view=QHbmOhQAAAAJ:4TOpqqG69KYC",268,28,21193,21197,314,12.08,79,4,26
310,"SM Ellerbroek, K Wennerberg, K Burridge","Serine phosphorylation negatively regulates RhoA in vivo",2003,"Journal of Biological Chemistry","","","https://scholar.google.com/scholar?oi=bibs&hl=en&cites=9497961589967830484",37,"2019-06-05","Journal article","","","https://scholar.google.com/citations?view_op=view_citation&hl=en&user=QHbmOhQAAAAJ&pagesize=100&citation_for_view=QHbmOhQAAAAJ:Wp0gIr-vW9MC",278,21,19023,19031,310,19.38,103,3,16
310,"K Burridge","Substrate adhesion in normal and transformed fibroblasts: organization and regulation of cytoskeletal, membrane and extracellular matrix components at focal contacts",1986,"Cancer Rev","","","https://scholar.google.com/scholar?oi=bibs&hl=en&cites=13379638677713892392,5832622455328022593",38,"2019-06-05","Journal article","","","https://scholar.google.com/citations?view_op=view_citation&hl=en&user=QHbmOhQAAAAJ&pagesize=100&citation_for_view=QHbmOhQAAAAJ:aqlVkmm33-oC",4,,487,525,310,9.39,310,1,33
298,"MC Beckerle, K Burridge, GN DeMartino, DE Croall","Colocalization of calcium-dependent protease II and one of its substrates at sites of cell adhesion",1987,"Cell","","","https://scholar.google.com/scholar?oi=bibs&hl=en&cites=7686385919102516674",39,"2019-06-05","Journal article","","","https://scholar.google.com/citations?view_op=view_citation&hl=en&user=QHbmOhQAAAAJ&pagesize=100&citation_for_view=QHbmOhQAAAAJ:qxL8FJ1GzNcC",51,4,569,577,298,9.31,75,4,32
296,"K Burridge, T Kelly, P Mangeat","Nonerythrocyte spectrins: actin-membrane attachment proteins occurring in many cell types.",1982,"The Journal of cell biology","","","https://scholar.google.com/scholar?oi=bibs&hl=en&cites=7678060895224221586",40,"2019-06-05","Journal article","","","https://scholar.google.com/citations?view_op=view_citation&hl=en&user=QHbmOhQAAAAJ&pagesize=100&citation_for_view=QHbmOhQAAAAJ:M3ejUd6NZC8C",95,2,478,486,296,8.00,99,3,37
294,"E Boulter, R Garcia-Mata, C Guilluy, A Dubash, G Rossi, PJ Brennwald, ...","Regulation of Rho GTPase crosstalk, degradation and activity by RhoGDI1",2010,"Nature cell biology","","","https://scholar.google.com/scholar?oi=bibs&hl=en&cites=16444179028713303524",41,"2019-06-05","Journal article","","","https://scholar.google.com/citations?view_op=view_citation&hl=en&user=QHbmOhQAAAAJ&pagesize=100&citation_for_view=QHbmOhQAAAAJ:TQgYirikUcIC",12,5,477,477,294,32.67,42,7,9
294,"MJ Allingham, JD van Buul, K Burridge","ICAM-1-mediated, Src-and Pyk2-dependent vascular endothelial cadherin tyrosine phosphorylation is required for leukocyte transendothelial migration",2007,"The Journal of Immunology","","","https://scholar.google.com/scholar?oi=bibs&hl=en&cites=2255663111977010916",42,"2019-06-05","Journal article","","","https://scholar.google.com/citations?view_op=view_citation&hl=en&user=QHbmOhQAAAAJ&pagesize=100&citation_for_view=QHbmOhQAAAAJ:mB3voiENLucC",179,6,4053,4064,294,24.50,98,3,12
293,"K Burridge, JR Feramisco","Non-muscle α-actinins are calcium-sensitive actin-binding proteins",1981,"Nature","","","https://scholar.google.com/scholar?oi=bibs&hl=en&cites=9206659192630499009",43,"2019-06-05","Journal article","","","https://scholar.google.com/citations?view_op=view_citation&hl=en&user=QHbmOhQAAAAJ&pagesize=100&citation_for_view=QHbmOhQAAAAJ:mVmsd5A6BfQC",294,5841,565,565,293,7.71,147,2,38
282,"SM Bockholt, K Burridge","Cell spreading on extracellular matrix proteins induces tyrosine phosphorylation of tensin.",1993,"Journal of Biological Chemistry","","","https://scholar.google.com/scholar?oi=bibs&hl=en&cites=13786825183399086746",44,"2019-06-05","Journal article","","","https://scholar.google.com/citations?view_op=view_citation&hl=en&user=QHbmOhQAAAAJ&pagesize=100&citation_for_view=QHbmOhQAAAAJ:4DMP91E08xMC",268,20,14565,14567,282,10.85,141,2,26
276,"K Wennerberg, MA Forget, SM Ellerbroek, WT Arthur, K Burridge, ...","Rnd proteins function as RhoA antagonists by activating p190 RhoGAP",2003,"Current Biology","","","https://scholar.google.com/scholar?oi=bibs&hl=en&cites=15935997592821938976",45,"2019-06-05","Journal article","","","https://scholar.google.com/citations?view_op=view_citation&hl=en&user=QHbmOhQAAAAJ&pagesize=100&citation_for_view=QHbmOhQAAAAJ:hFOr9nPyWt4C",13,13,1106,1115,276,17.25,46,6,16
276,"K Abe, KL Rossman, B Liu, KD Ritola, D Chiang, SL Campbell, K Burridge, ...","Vav2 is an activator of Cdc42, Rac1, and RhoA",2000,"Journal of Biological Chemistry","","","https://scholar.google.com/scholar?oi=bibs&hl=en&cites=7598619159794417305",46,"2019-06-05","Journal article","","","https://scholar.google.com/citations?view_op=view_citation&hl=en&user=QHbmOhQAAAAJ&pagesize=100&citation_for_view=QHbmOhQAAAAJ:ZeXyd9-uunAC",275,14,10141,10149,276,14.53,35,8,19
266,"C Guilluy, LD Osborne, L Van Landeghem, L Sharek, R Superfine, ...","Isolated nuclei adapt to force and reveal a mechanotransduction pathway in the nucleus",2014,"Nature cell biology","","","https://scholar.google.com/scholar?oi=bibs&hl=en&cites=234763263055446093",47,"2019-06-05","Journal article","","","https://scholar.google.com/citations?view_op=view_citation&hl=en&user=QHbmOhQAAAAJ&pagesize=100&citation_for_view=QHbmOhQAAAAJ:NhqRSupF_l8C",16,4,376,376,266,53.20,44,6,5
266,"C Guilluy, V Swaminathan, R Garcia-Mata, ET O’Brien, R Superfine, ...","The Rho GEFs LARG and GEF-H1 regulate the mechanical response to force on integrins",2011,"Nature cell biology","","","https://scholar.google.com/scholar?oi=bibs&hl=en&cites=14829549953231637736",48,"2019-06-05","Journal article","","","https://scholar.google.com/citations?view_op=view_citation&hl=en&user=QHbmOhQAAAAJ&pagesize=100&citation_for_view=QHbmOhQAAAAJ:M3NEmzRMIkIC",13,6,722,722,266,33.25,44,6,8
255,"CE Turner, K Burridge","Transmembrane molecular assemblies in cell-extracellular matrix interactions",1991,"Current opinion in cell biology","","","https://scholar.google.com/scholar?oi=bibs&hl=en&cites=8249969917226026702",49,"2019-06-05","Journal article","","","https://scholar.google.com/citations?view_op=view_citation&hl=en&user=QHbmOhQAAAAJ&pagesize=100&citation_for_view=QHbmOhQAAAAJ:IWHjjKOFINEC",3,5,849,853,255,9.11,128,2,28
253,"K Burridge","Are stress fibres contractile?",1981,"Nature","","","https://scholar.google.com/scholar?oi=bibs&hl=en&cites=3999355329441137430",50,"2019-06-05","Journal article","","","https://scholar.google.com/citations?view_op=view_citation&hl=en&user=QHbmOhQAAAAJ&pagesize=100&citation_for_view=QHbmOhQAAAAJ:dhFuZR0502QC",294,5843,691,691,253,6.66,253,1,38
249,"PC Letourneau","Differences in the organization of actin in the growth cones compared with the neurites of cultured neurons from chick embryos.",1983,"The Journal of cell biology","","","https://scholar.google.com/scholar?oi=bibs&hl=en&cites=6630218859473461664,10107887196577679408",51,"2019-06-05","Journal article","","","https://scholar.google.com/citations?view_op=view_citation&hl=en&user=QHbmOhQAAAAJ&pagesize=100&citation_for_view=QHbmOhQAAAAJ:lgwcVrK6X84C",97,4,963,973,249,6.92,249,1,36
249,"K Burridge","[5] Direct identification of specific glycoproteins and antigens in sodium dodecyl sulfate gels",1978,"Methods in enzymology","","","https://scholar.google.com/scholar?oi=bibs&hl=en&cites=7243314071676430128",52,"2019-06-05","Journal article","","","https://scholar.google.com/citations?view_op=view_citation&hl=en&user=QHbmOhQAAAAJ&pagesize=100&citation_for_view=QHbmOhQAAAAJ:QIV2ME_5wuYC",50,,54,64,249,6.07,249,1,41
248,"AS Maddox, K Burridge","RhoA is required for cortical retraction and rigidity during mitotic cell rounding",2003,"The Journal of cell biology","","","https://scholar.google.com/scholar?oi=bibs&hl=en&cites=11604819962129397840",53,"2019-06-05","Journal article","","","https://scholar.google.com/citations?view_op=view_citation&hl=en&user=QHbmOhQAAAAJ&pagesize=100&citation_for_view=QHbmOhQAAAAJ:HDshCWvjkbEC",160,2,255,265,248,15.50,124,2,16
248,"K Burridge, M Chrzanowska-Wodnicka, C Zhong","Focal adhesion assembly",1997,"Trends in cell biology","","","https://scholar.google.com/scholar?oi=bibs&hl=en&cites=11465688852199289528",54,"2019-06-05","Journal article","","","https://scholar.google.com/citations?view_op=view_citation&hl=en&user=QHbmOhQAAAAJ&pagesize=100&citation_for_view=QHbmOhQAAAAJ:L8Ckcad2t8MC",7,9,342,347,248,11.27,83,3,22
247,"C Guilluy, R Garcia-Mata, K Burridge","Rho protein crosstalk: another social network?",2011,"Trends in cell biology","","","https://scholar.google.com/scholar?oi=bibs&hl=en&cites=18389905076457082781",55,"2019-06-05","Journal article","","","https://scholar.google.com/citations?view_op=view_citation&hl=en&user=QHbmOhQAAAAJ&pagesize=100&citation_for_view=QHbmOhQAAAAJ:NMxIlDl6LWMC",21,12,718,726,247,30.88,82,3,8
