Cites,Authors,Title,Year,Source,Publisher,ArticleURL,CitesURL,GSRank,QueryDate,Type,DOI,ISSN,CitationURL,Volume,Issue,StartPage,EndPage,ECC,CitesPerYear,CitesPerAuthor,AuthorCount,Age
0,"G Stamatakis, H Fessi, S Cholletmartin, S Bailly, MA Gougerotpocidalo, ...","Membrane-characteristics Have An Effect On Monocyte Stimulation in Patients Receiving Chronic-hemodialysis (hd)",1991,"Kidney International","","","",110,"2019-10-07","Journal article","","","https://scholar.google.com/citations?view_op=view_citation&hl=en&user=p2WDOT4AAAAJ&cstart=100&pagesize=100&citation_for_view=p2WDOT4AAAAJ:LjlpjdlvIbIC",39,6,1321,1321,0,0.00,0,6,28
0,"S BAILLY, B FERRUA, M FAY, MA GOUGEROTPOCIDALO","DIFFERENTIAL REGULATION OF IL-6, IL-1-ALPHA, IL-1-BETA AND TNF-ALPHA IN LPS-STIMULATED HUMAN MONOCYTES-ROLE OF CYCLIC-AMP",1990,"LYMPHOKINE RESEARCH","","","",111,"2019-10-07","Journal article","","","https://scholar.google.com/citations?view_op=view_citation&hl=en&user=p2WDOT4AAAAJ&cstart=100&pagesize=100&citation_for_view=p2WDOT4AAAAJ:uLbwQdceFCQC",9,4,598,598,0,0.00,0,4,29
0,"S Bailly","Regulation de la production des cytokines d'origine monocytaire chez l'homme",1990,"Paris","","","",112,"2019-10-07","Journal article","","","https://scholar.google.com/citations?view_op=view_citation&hl=en&user=p2WDOT4AAAAJ&cstart=100&pagesize=100&citation_for_view=p2WDOT4AAAAJ:ZfRJV9d4-WMC",11,,,,0,0.00,0,1,29
0,"S BAILLY, Y MAHE, Y ROCHE, M FAY, C SCAMPS, H WAKASUGI, ...","SELECTIVE-INHIBITION OF IL-1-GAMMA MESSENGER-RNA SYNTHESIS BY CIPROFLOXACIN-TREATED HUMAN-MONOCYTES",1988,"LYMPHOKINE RESEARCH","","","",113,"2019-10-07","Journal article","","","https://scholar.google.com/citations?view_op=view_citation&hl=en&user=p2WDOT4AAAAJ&cstart=100&pagesize=100&citation_for_view=p2WDOT4AAAAJ:kzcrU_BdoSEC",7,3,270,270,0,0.00,0,7,31
0,"L David, C Mallet, S Mazerbourg, JJ Feige, S Bailly","Identification of BMP9 and BMP10 as functional activators of the orphan",,"","","","",114,"2019-10-07","","","","https://scholar.google.com/citations?view_op=view_citation&hl=en&user=p2WDOT4AAAAJ&cstart=100&pagesize=100&citation_for_view=p2WDOT4AAAAJ:uc_IGeMz5qoC",,,,,0,0.00,0,5,
0,"C MALLET, D VITTET, JJ FEIGE, S BAILLY","TGFß1 Induces Vasculogenesis and Inhibits Angiogenic Sprouting in an Embryonic Stem Cell Differentiation Model: Respective Contribution of ALK1 and ALK5",,"","","","",115,"2019-10-07","","","","https://scholar.google.com/citations?view_op=view_citation&hl=en&user=p2WDOT4AAAAJ&cstart=100&pagesize=100&citation_for_view=p2WDOT4AAAAJ:0KyAp5RtaNEC",,,,,0,0.00,0,4,
0,"L David, C Mallet, M Keramidas, N Lamandé, JM Gasc, S Dupuis-Girod, ...","BMP9 is A circulating VASCULAR QUIESCENCE FACTOR Running title: BMP9 is present in serum and inhibits angiogenesis",,"","","","",116,"2019-10-07","","","","https://scholar.google.com/citations?view_op=view_citation&hl=en&user=p2WDOT4AAAAJ&cstart=100&pagesize=100&citation_for_view=p2WDOT4AAAAJ:W5xh706n7nkC",,,,,0,0.00,0,7,
0,"FA el Din, S Patri, V Thoreau, M Rodriguez-Ballesteros, E Hamade, ...","Caractérisation de 12 mutations du gène ACVRL1 et étude de leurs implications physio-pathologiques dans la maladie de Rendu-Osler",,"","","","",117,"2019-10-07","","","","https://scholar.google.com/citations?view_op=view_citation&hl=en&user=p2WDOT4AAAAJ&cstart=100&pagesize=100&citation_for_view=p2WDOT4AAAAJ:VL0QpB8kHFEC",,,,,0,0.00,0,6,
0,"FP Navarro, I Texier, JJ Feige, S Bailly, D Vittet, S Levet, D Ciais, ...","Bone morphogenetic protein 9 (BMP9) controls lymphatic vessel",,"","","","",118,"2019-10-07","","","","https://scholar.google.com/citations?view_op=view_citation&hl=en&user=p2WDOT4AAAAJ&cstart=100&pagesize=100&citation_for_view=p2WDOT4AAAAJ:WqliGbK-hY8C",,,,,0,0.00,0,8,
