Cites,Authors,Title,Year,Source,Publisher,ArticleURL,CitesURL,GSRank,QueryDate,Type,DOI,ISSN,CitationURL,Volume,Issue,StartPage,EndPage,ECC,CitesPerYear,CitesPerAuthor,AuthorCount,Age
84,"IB Robertson, DB Rifkin","Unchaining the beast; insights from structural and evolutionary studies on TGFβ secretion, sequestration, and activation",2013,"Cytokine & growth factor reviews","Elsevier","https://www.sciencedirect.com/science/article/pii/S1359610113000610","https://scholar.google.com/scholar?cites=7898053837999080483&as_sdt=800005&sciodt=0,15&hl=en",192,"2019-06-18","HTML","","","",,,,,84,14.00,42,2,6
3,"M Hara, I Inoue, Y Yamazaki…","L 59 TGF-β LAP degradation products serve as a promising blood biomarker for liver fibrogenesis in mice",2015,"… & tissue repair","fibrogenesis.biomedcentral.com","https://fibrogenesis.biomedcentral.com/articles/10.1186/s13069-015-0034-9","https://scholar.google.com/scholar?cites=4465377654523282304&as_sdt=800005&sciodt=0,15&hl=en",193,"2019-06-18","HTML","","","",,,,,3,0.75,1,4,4
9,"ST ROHRLICH, L Haim, DB RIFKIN","Purification and characterization of a low molecular mass cysteine proteinase inhibitor from human amniotic fluid",1985,"Biological Chemistry","degruyter.com","https://www.degruyter.com/view/j/bchm3.1985.366.issue-1/bchm3.1985.366.1.147/bchm3.1985.366.1.147.xml","https://scholar.google.com/scholar?cites=14055404137331810054&as_sdt=800005&sciodt=0,15&hl=en",194,"2019-06-18","","","","",,,,,9,0.26,3,3,34
2,"R Eger, D Rifkin","Characterization of a temperature-sensitive membrane alteration in chick embryo fibroblasts infected with a temperature-sensitive mutant of Rous sarcoma virus",1980,"Biochimica et Biophysica Acta (BBA)-Biomembranes","Elsevier","https://www.sciencedirect.com/science/article/pii/0005273680904356","https://scholar.google.com/scholar?cites=14851326455831529449&as_sdt=800005&sciodt=0,15&hl=en",195,"2019-06-18","","","","",,,,,2,0.05,1,2,39
3,"PK Welch, JM Endres, DM Rifkin","A Comparison of the Dietary Intake of Institutionlized Elderly Fed in Two Different Settings",1986,"Journal of Nutrition for the …","Taylor & Francis","https://www.tandfonline.com/doi/abs/10.1300/J052v06n01_03","https://scholar.google.com/scholar?cites=5065667546574884641&as_sdt=800005&sciodt=0,15&hl=en",196,"2019-06-18","","","","",,,,,3,0.09,1,3,33
103,"P Mignatti, DB Rifkin","Nonenzymatic interactions between proteinases and the cell surface: novel roles in normal and malignant cell physiology",1999,"Advances in cancer research","Elsevier","https://www.sciencedirect.com/science/article/pii/S0065230X08610246","https://scholar.google.com/scholar?cites=1017088585812804804&as_sdt=800005&sciodt=0,15&hl=en",197,"2019-06-18","HTML","","","",,,,,103,5.15,52,2,20
2,"V Todorovic, DB Rifkin","TGF-β Availability: Latent TGF-β and Latent TGF-β Binding Proteins",2008,"Transforming Growth Factor-β in Cancer Therapy …","Springer","https://link.springer.com/chapter/10.1007/978-1-59745-292-2_3","https://scholar.google.com/scholar?cites=139219915997348352&as_sdt=800005&sciodt=0,15&hl=en",198,"2019-06-18","","","","",,,,,2,0.18,1,2,11
2,"MJ Thorpy, D Rifkin","Sleep starts",2004,"MedLink Neurology","","","https://scholar.google.com/scholar?cites=13165831224504836146&as_sdt=800005&sciodt=0,15&hl=en",199,"2019-06-18","CITATION","","","",,,,,2,0.13,1,2,15
1,"DB Rifkin, R Flaumenhaft, S Kojima, P Dennis…","Cell Surface Activation of Latent Transforming Growth Factor β1",1992,"Growth Factors of the …","karger.com","https://www.karger.com/Article/Abstract/420887","https://scholar.google.com/scholar?cites=14030827047199374961&as_sdt=800005&sciodt=0,15&hl=en",200,"2019-06-18","CITATION","","","",,,,,1,0.04,0,5,27
1,"P Mignattl, C Hebert, TCJ Wun, DB Rifkin","Inhibition of cell invasion by plasminogen activator inhibitors type 1 and 2 and protease nexin 1",1989,"Fibrinolysis","Churchill Livingstone","","https://scholar.google.com/scholar?cites=1962646413231873858&as_sdt=800005&sciodt=0,15&hl=en",201,"2019-06-18","CITATION","","","",,,,,1,0.03,0,4,30
1,"T Sasaki, S Lee-Arteaga, L Zilberberg…","Latent Transforming Growth Factor ß-binding Proteins and Fibulins Compete for Fibrillin-1 and Exhibit Exquisite Specificities in Binding Sites",2009,"THE JOURNAL OF …","researchgate.net","https://www.researchgate.net/profile/Hans_Peter_Baechinger/publication/24260338_Latent_Transforming_Growth_Factor_-binding_Proteins_and_Fibulins_Compete_for_Fibrillin-1_and_Exhibit_Exquisite_Specificities_in_Binding_Sites/links/58acbf91a6fdccac900b0f22/Latent-Transforming-Growth-Factor-binding-Proteins-and-Fibulins-Compete-for-Fibrillin-1-and-Exhibit-Exquisite-Specificities-in-Binding-Sites.pdf","https://scholar.google.com/scholar?cites=3944890815418975748&as_sdt=800005&sciodt=0,15&hl=en",202,"2019-06-18","PDF","","","",,,,,1,0.10,0,4,10
5,"F Ramirez, DB Rifkin","Is losartan the drug for all seasons?",2012,"Current opinion in pharmacology","cyberleninka.org","https://cyberleninka.org/article/n/456628.pdf","https://scholar.google.com/scholar?cites=11904666217062655535&as_sdt=800005&sciodt=0,15&hl=en",203,"2019-06-18","PDF","","","",,,,,5,0.71,3,2,7
1,"DA Moscatelli, DB Rifkin","Fibroblast growth factors",2001,"BASIC AND CLINICAL ONCOLOGY","the-eye.eu","https://the-eye.eu/public/Books/Medical/texts/Tumor%20Angiogenesis%20and%20Microcirculation%20-%20E.%20Voest%2C%20et.%20al.%2C%20%28Informa%2C%202001%29%20WW.pdf#page=244","https://scholar.google.com/scholar?cites=9296657667740400835&as_sdt=800005&sciodt=0,15&hl=en",204,"2019-06-18","PDF","","","",,,,,1,0.06,1,2,18
0,"DB Rifkin","The Rockefeller University, New York, NY 1002",2014,"Regulatory Proteolytic Enzymes and Their Inhibitors …","books.google.com","https://books.google.com/books?hl=en&lr=&id=voGQBQAAQBAJ&oi=fnd&pg=PA147&dq=%22daniel+b+rifkin%22+OR+%22daniel+rifkin%22+(%22new+york%22)&ots=-pNbGeVTWE&sig=HBPy1552vv9Y-36tOT2WvJDyLbc","",205,"2019-06-18","","","","",,,,,0,0.00,0,1,5
0,"DW Cleveland, W Franke, E Fuchs…","Ira Mellman Department of Cell Biology. Yale University School of Medicine. 333 Cedar Street. PO Box 208002. New Haven. CT 06520. Tel.:(203) 785 …",1999,"The Journal of …","Rockefeller University Press","","",206,"2019-06-18","CITATION","","","",,,,,0,0.00,0,4,20
0,"RGW Anderson, DW Cleveland, W Franke…","Norton B. Gilula",1992,"The Journal of Cell …","jcb.rupress.org","http://jcb.rupress.org/content/jcb/126/6/local/ed-board.pdf","",207,"2019-06-18","","","","",,,,,0,0.00,0,4,27
0,"DB RIFKIN, JL GROSS, E JAFFE","by Endothelial Cells",2017,"Pathobiology of the …","books.google.com","https://books.google.com/books?hl=en&lr=&id=zcfYBAAAQBAJ&oi=fnd&pg=PA191&dq=%22daniel+b+rifkin%22+OR+%22daniel+rifkin%22+(%22new+york%22)&ots=Wa6u2exZ9B&sig=4kOPNbUBBXLkAibyCthbJhkD-IA","",208,"2019-06-18","","","","",,,,,0,0.00,0,3,2
0,"DB Rifkin, JS Munger, JP Annes","Genetic screen for bioactive peptides",2009,"US Patent 7,517,647","Google Patents","https://patents.google.com/patent/US7517647B2/en","",209,"2019-06-18","","","","",,,,,0,0.00,0,3,10
0,"DB Rifkin","Metastatic Mechanisms",1976,"","science.sciencemag.org","http://science.sciencemag.org/content/194/4270/1154.1.short","",210,"2019-06-18","CITATION","","","",,,,,0,0.00,0,1,43
0,"MC Kugler, CA Loomis, J Ramos, AL Joyner…","Sonic Hedgehog (shh) Signaling Regulates Myofibroblast Function During Alveolar Septum Formation In Postnatal Lung",2016,"A75. STEM …","atsjournals.org","https://www.atsjournals.org/doi/pdf/10.1164/ajrccm-conference.2016.193.1_MeetingAbstracts.A2448","",211,"2019-06-18","","","","",,,,,0,0.00,0,5,3
0,"S Krishnan, AB Deora, JP Annes…","Annexin II-Mediated Plasmin Generation Activates TGF-β3 During Epithelial-Mesenchymal Transformation in the Developing Avian Heart",2002,"…","… 1900 M STREET. NW SUITE 200 …","","",212,"2019-06-18","CITATION","","","",,,,,0,0.00,0,4,17
0,"N Quarto, DB Rifkin","The NH2-terminal extension of bFGF contains a nuclear targeting sequence (NTS)",1990,"Cell Biology International …","No longer published by Elsevier","","",213,"2019-06-18","CITATION","","","",,,,,0,0.00,0,2,29
0,"DB Rifkin","Studies of Wound Healing in the Presence of an Angiogenesis Factor",1989,"","apps.dtic.mil","https://apps.dtic.mil/docs/citations/ADA215887","",214,"2019-06-18","","","","",,,,,0,0.00,0,1,30
0,"DB Rifkin, A Poindexter, MS as a Potential, D Meruelo…","Grapevine",,"","","","",215,"2019-06-18","CITATION","","","",,,,,0,0.00,0,5,
0,"DB Rifkin, P Dennis, Y Sato, R Tsuboi","Cell to Cell Interaction and the Control of Growth Factor Activity1",1990,"Cell to Cell Interaction","karger.com","https://www.karger.com/Article/Abstract/419802","",216,"2019-06-18","CITATION","","","",,,,,0,0.00,0,4,29
0,"M Ota, M Horiguchi, V Fang, K Shibahara, K Kadota…","Genetic Suppression of Inflammation Blocks the Tumor-Promoting Effects of TGF-β in Gastric Tissue Mitsuhiko Ota1, 7, Masahito Horiguchi1, Victoria Fang1 …",,"pdfs.semanticscholar.org","","https://pdfs.semanticscholar.org/a8f1/161d577b3be4bf333a11caafffbec3158891.pdf","",217,"2019-06-18","PDF","","","",,,,,0,0.00,0,6,
0,"DB Rifkin, D Moscatelli","I the past four years there has been an enormous increase in",1989,"The Journal of Cell Biology","Rockefeller University Press","","",218,"2019-06-18","CITATION","","","",,,,,0,0.00,0,2,30
0,"DB Rifkin, R Flaumenhaft, S Kojima, P Dennis…","Transforming Growth Factor 3",1992,"Growth Factors of the …","S Karger Ag","","",219,"2019-06-18","CITATION","","","",,,,,0,0.00,0,5,27
0,"PJ Wipff, DB Rifkin, JJ Meister, B Hinz","MYOFIBROBLAST CONTRACTION ACTIVATES LATENT TGFb1 FROM THE ECM",,"","","","",220,"2019-06-18","CITATION","","","",,,,,0,0.00,0,4,
0,"Y Safo, DB Rifkin","Activation of latent TGF-beta-1 by plasmin: Physiological regulation of growth factor activity",1989,"Fibrinolysis","Churchill Livingstone","","",221,"2019-06-18","CITATION","","","",,,,,0,0.00,0,2,30
0,"BB Dabovic, DB Rifkin","TGF-Beta and Breast Cancer Induction",2002,"","apps.dtic.mil","https://apps.dtic.mil/docs/citations/ADA407399","",222,"2019-06-18","","","","",,,,,0,0.00,0,2,17
0,"L Wilson, L Oliver, D Rifkin","The modulation of proteolytic activity by bone marrow stromal cells",1989,"Fibrinolysis","Elsevier","","",223,"2019-06-18","CITATION","","","",,,,,0,0.00,0,3,30
0,"D CLEVELAND, E FUCHS, A HALL…","IRA MELLMAN",2005,"The Journal of …","Rockefeller University Press","","",224,"2019-06-18","CITATION","","","",,,,,0,0.00,0,4,14
0,"DB Rifkin","TGF-ß and Breast Cancer Induction",2002,"","researchgate.net","https://www.researchgate.net/profile/Branka_Dabovic/publication/235192396_TGF-Beta_and_Breast_Cancer_Induction/links/540097c20cf2c48563ae530a.pdf","",225,"2019-06-18","PDF","","","",,,,,0,0.00,0,1,17
0,"P Mignatti, DB Rifkin","Nonenzymatic Interactions between Proteinases and the Cell Surface: Novel Roles in Normal and Malignant Cell Physiology-References",1999,"Advances in …","New York, Academic Press, 1953-","","",226,"2019-06-18","CITATION","","","",,,,,0,0.00,0,2,20
0,"P Mignatti, DB Rifkin","Nonenzymatic Interactions between Proteinases and the Cell Surface: Novel Roles in Normal and Malignant Cell Physiology-III. Proteolysis-Independent …",1999,"Advances in …","New York, Academic Press, 1953-","","",227,"2019-06-18","CITATION","","","",,,,,0,0.00,0,2,20
0,"P Mignatti, DB Rifkin","Nonenzymatic Interactions between Proteinases and the Cell Surface: Novel Roles in Normal and Malignant Cell Physiology-I. Introduction",1999,"Advances in …","New York, Academic Press, 1953-","","",228,"2019-06-18","CITATION","","","",,,,,0,0.00,0,2,20
0,"P Mignatti, DB Rifkin","Nonenzymatic Interactions between Proteinases and the Cell Surface: Novel Roles in Normal and Malignant Cell Physiology-II. Extracellular Matrix …",1999,"Advances in …","New York, Academic Press, 1953-","","",229,"2019-06-18","CITATION","","","",,,,,0,0.00,0,2,20
0,"P Mignatti, DB Rifkin","Nonenzymatic Interactions between Proteinases and the Cell Surface: Novel Roles in Normal and Malignant Cell Physiology-IV. Conclusions and …",1999,"Advances in …","New York, Academic Press, 1953-","","",230,"2019-06-18","CITATION","","","",,,,,0,0.00,0,2,20
0,"H Abdel-Nabi, D Rifkin, S Wisniewski…","PET-FDG distribution in patients with untreated, severe obstructive sleep apnea: A pilot study",2008,"Journal of Nuclear …","Soc Nuclear Med","http://jnm.snmjournals.org/content/49/supplement_1/229P.1.short","",231,"2019-06-18","","","","",,,,,0,0.00,0,4,11
0,"D Rifkin","Cell transformation: a missed opportunity",1981,"","nature.com","https://www.nature.com/articles/294292a0","",232,"2019-06-18","CITATION","","","",,,,,0,0.00,0,1,38
0,"MI Ching, BH Sung, MF Wilson…","P-5: Small artery compliance is reduced in sleep apnea",2005,"American Journal of …","search.proquest.com","http://search.proquest.com/openview/021ad6770d43ecfc48e4a712dd184e49/1?pq-origsite=gscholar&cbl=536305","",233,"2019-06-18","","","","",,,,,0,0.00,0,4,14
0,"DB Rifkin","CELL SURFACE PROTEOLYSIS AND THE TRANSFORMED PHENOTYPE",1978,"Regulatory Proteolytic Enzymes and their Inhibitors","Elsevier","https://www.sciencedirect.com/science/article/pii/B9780080226286500166","",234,"2019-06-18","","","","",,,,,0,0.00,0,1,41
0,"DB RIFKIN, MR RIFKIN, W KONIGSBERG","Clearly, an attempt to explain these solubility differences by investigation of differences in amino acid sequences was desirable. Our study was undertaken with …",,"pdfs.semanticscholar.org","","https://pdfs.semanticscholar.org/a26c/aee0ed566456e2f615a262ccb8a8c753b336.pdf","",235,"2019-06-18","PDF","","","",,,,,0,0.00,0,3,
23,"I Noguera, H Obata, A Gualandris, P Cowin, DB Rifkin","Molecular cloning of the mouse Ltbp-1 gene reveals tissue specific expression of alternatively spliced forms",2003,"Gene","Elsevier","https://www.sciencedirect.com/science/article/pii/S0378111903004633","https://scholar.google.com/scholar?cites=7349816029640203894&as_sdt=800005&sciodt=0,15&hl=en",236,"2019-06-18","HTML","","","",,,,,23,1.44,5,5,16
21,"S Krishnan, AB Deora, JP Annes, J Osoria…","Annexin II-mediated plasmin generation activates TGF-β3 during epithelial–mesenchymal transformation in the developing avian heart",2004,"Developmental …","Elsevier","https://www.sciencedirect.com/science/article/pii/S0012160603005268","https://scholar.google.com/scholar?cites=13427099194681440236&as_sdt=800005&sciodt=0,15&hl=en",237,"2019-06-18","HTML","","","",,,,,21,1.40,4,5,15
0,"DBR PAOLOMIGNATTI…","Proteinases and Tissue Remodeling",2013,"The Molecular and …","books.google.com","https://books.google.com/books?hl=en&lr=&id=HOzcBwAAQBAJ&oi=fnd&pg=PA427&dq=%22daniel+b+rifkin%22+OR+%22daniel+rifkin%22+(%22new+york%22)&ots=BtjSpOqtvj&sig=z8Yc7f9AvLGpRHUtVJkZcnl-J2U","",238,"2019-06-18","","","","",,,,,0,0.00,0,2,6
