Cites,Authors,Title,Year,Source,Publisher,ArticleURL,CitesURL,GSRank,QueryDate,Type,DOI,ISSN,CitationURL,Volume,Issue,StartPage,EndPage,ECC,CitesPerYear,CitesPerAuthor,AuthorCount,Age
718,"DY Li, B Brooke, EC Davis, RP Mecham, LK Sorensen, BB Boak, ...","Elastin is an essential determinant of arterial morphogenesis",1998,"Nature","","","https://scholar.google.com/scholar?oi=bibs&hl=en&cites=3520196228131111730",1,"2019-05-16","Journal article","","","https://scholar.google.com/citations?view_op=view_citation&hl=en&user=ABXJvacAAAAJ&pagesize=100&citation_for_view=ABXJvacAAAAJ:d1gkVwhDpl0C",393,6682,276,276,718,34.19,103,7,21
651,"JE Wagenseil, RP Mecham","Vascular extracellular matrix and arterial mechanics",2009,"Physiological reviews","","","https://scholar.google.com/scholar?oi=bibs&hl=en&cites=13090282613453809053",2,"2019-05-16","Journal article","","","https://scholar.google.com/citations?view_op=view_citation&hl=en&user=ABXJvacAAAAJ&pagesize=100&citation_for_view=ABXJvacAAAAJ:L8Ckcad2t8MC",89,3,957,989,651,65.10,326,2,10
615,"J Rosenbloom, WR Abrams, R Mecham","Extracellular matrix 4: the elastic fiber.",1993,"The FASEB Journal","","","https://scholar.google.com/scholar?oi=bibs&hl=en&cites=9628835054146639404",3,"2019-05-16","Journal article","","","https://scholar.google.com/citations?view_op=view_citation&hl=en&user=ABXJvacAAAAJ&pagesize=100&citation_for_view=ABXJvacAAAAJ:u-x6o8ySG0sC",7,13,1208,1218,615,23.65,205,3,26
552,"RM Senior, GL Griffin, RP Mecham","Chemotactic activity of elastin-derived peptides.",1980,"The Journal of clinical investigation","","","https://scholar.google.com/scholar?oi=bibs&hl=en&cites=1897493026586983094",4,"2019-05-16","Journal article","","","https://scholar.google.com/citations?view_op=view_citation&hl=en&user=ABXJvacAAAAJ&pagesize=100&citation_for_view=ABXJvacAAAAJ:u5HHmVD_uO8C",66,4,859,862,552,14.15,184,3,39
527,"CM Ng, A Cheng, LA Myers, F Martinez-Murillo, C Jie, D Bedja, ...","TGF-β–dependent pathogenesis of mitral valve prolapse in a mouse model of Marfan syndrome",2004,"The Journal of clinical investigation","","","https://scholar.google.com/scholar?oi=bibs&hl=en&cites=18327135356764632080",5,"2019-05-16","Journal article","","","https://scholar.google.com/citations?view_op=view_citation&hl=en&user=ABXJvacAAAAJ&pagesize=100&citation_for_view=ABXJvacAAAAJ:IjCSPb-OGe4C",114,11,1586,1592,527,35.13,75,7,15
470,"RW Thompson, DR Holmes, RA Mertens, S Liao, MD Botney, RP Mecham, ...","Production and localization of 92-kilodalton gelatinase in abdominal aortic aneurysms. An elastolytic metalloproteinase expressed by aneurysm-infiltrating macrophages.",1995,"The Journal of clinical investigation","","","https://scholar.google.com/scholar?oi=bibs&hl=en&cites=15334730621661536734",6,"2019-05-16","Journal article","","","https://scholar.google.com/citations?view_op=view_citation&hl=en&user=ABXJvacAAAAJ&pagesize=100&citation_for_view=ABXJvacAAAAJ:9yKSN-GCB0IC",96,1,318,326,470,19.58,67,7,24
402,"KR Stenmark, RP Mecham","Cellular and molecular mechanisms of pulmonary vascular remodeling",1997,"Annual review of physiology","","","https://scholar.google.com/scholar?oi=bibs&hl=en&cites=8962540405526721510",7,"2019-05-16","Journal article","","","https://scholar.google.com/citations?view_op=view_citation&hl=en&user=ABXJvacAAAAJ&pagesize=100&citation_for_view=ABXJvacAAAAJ:qjMakFHDy7sC",59,1,89,144,402,18.27,201,2,22
400,"AMG Houghton, PA Quintero, DL Perkins, DK Kobayashi, DG Kelley, ...","Elastin fragments drive disease progression in a murine model of emphysema",2006,"The Journal of clinical investigation","","","https://scholar.google.com/scholar?oi=bibs&hl=en&cites=4720022201212528734",8,"2019-05-16","Journal article","","","https://scholar.google.com/citations?view_op=view_citation&hl=en&user=ABXJvacAAAAJ&pagesize=100&citation_for_view=ABXJvacAAAAJ:eQOLeE2rZwMC",116,3,753,759,400,30.77,67,6,13
383,"RM Senior, GL Griffin, RP Mecham, DS Wrenn, KU Prasad, DW Urry","Val-Gly-Val-Ala-Pro-Gly, a repeating peptide in elastin, is chemotactic for fibroblasts and monocytes.",1984,"The Journal of cell biology","","","https://scholar.google.com/scholar?oi=bibs&hl=en&cites=8885089522453929312",9,"2019-05-16","Journal article","","","https://scholar.google.com/citations?view_op=view_citation&hl=en&user=ABXJvacAAAAJ&pagesize=100&citation_for_view=ABXJvacAAAAJ:zYLM7Y9cAGgC",99,3,870,874,383,10.94,64,6,35
376,"H Zhang, SD Apfelroth, W Hu, EC Davis, C Sanguineti, J Bonadio, ...","Structure and expression of fibrillin-2, a novel microfibrillar component preferentially located in elastic matrices",1994,"The Journal of cell biology","","","https://scholar.google.com/scholar?oi=bibs&hl=en&cites=14054406045034528584",10,"2019-05-16","Journal article","","","https://scholar.google.com/citations?view_op=view_citation&hl=en&user=ABXJvacAAAAJ&pagesize=100&citation_for_view=ABXJvacAAAAJ:2osOgNQ5qMEC",124,5,855,863,376,15.04,54,7,25
364,"DY Li, G Faury, DG Taylor, EC Davis, WA Boyle, RP Mecham, P Stenzel, ...","Novel arterial pathology in mice and humans hemizygous for elastin.",1998,"The Journal of clinical investigation","","","https://scholar.google.com/scholar?oi=bibs&hl=en&cites=3736716314747945755",11,"2019-05-16","Journal article","","","https://scholar.google.com/citations?view_op=view_citation&hl=en&user=ABXJvacAAAAJ&pagesize=100&citation_for_view=ABXJvacAAAAJ:Y0pCki6q_DkC",102,10,1783,1787,364,17.33,46,8,21
360,"RP Mecham, WC Parks","Matrix metalloproteinases",1998,"Elsevier","","","https://scholar.google.com/scholar?oi=bibs&hl=en&cites=16670292842153388152",12,"2019-05-16","","","","https://scholar.google.com/citations?view_op=view_citation&hl=en&user=ABXJvacAAAAJ&pagesize=100&citation_for_view=ABXJvacAAAAJ:UeHWp8X0CEIC",,,,,360,17.14,180,2,21
343,"SP Heximer, RH Knutsen, X Sun, KM Kaltenbronn, MH Rhee, N Peng, ...","Hypertension and prolonged vasoconstrictor signaling in RGS2-deficient mice",2003,"The Journal of clinical investigation","","","https://scholar.google.com/scholar?oi=bibs&hl=en&cites=11082847189777009615",13,"2019-05-16","Journal article","","","https://scholar.google.com/citations?view_op=view_citation&hl=en&user=ABXJvacAAAAJ&pagesize=100&citation_for_view=ABXJvacAAAAJ:W7OEmFMy1HYC",111,4,445,452,343,21.44,49,7,16
334,"JE Wagenseil, RP Mecham","New insights into elastic fiber assembly",2007,"Birth Defects Research Part C: Embryo Today: Reviews","","","https://scholar.google.com/scholar?oi=bibs&hl=en&cites=7492363613156312202",14,"2019-05-16","Journal article","","","https://scholar.google.com/citations?view_op=view_citation&hl=en&user=ABXJvacAAAAJ&pagesize=100&citation_for_view=ABXJvacAAAAJ:4TOpqqG69KYC",81,4,229,240,334,27.83,167,2,12
334,"JF Woessner","The metalloproteinase family",1998,"Matrix metalloproteinases","","","https://scholar.google.com/scholar?oi=bibs&hl=en&cites=7191310714989142378",15,"2019-05-16","Journal article","","","https://scholar.google.com/citations?view_op=view_citation&hl=en&user=ABXJvacAAAAJ&pagesize=100&citation_for_view=ABXJvacAAAAJ:LPtt_HFRSbwC",1,,,,334,15.90,334,1,21
329,"A Hinek, DS Wrenn, RP Mecham, SH Barondes","The elastin receptor: a galactoside-binding protein",1988,"Science","","","https://scholar.google.com/scholar?oi=bibs&hl=en&cites=17629959253164385348",16,"2019-05-16","Journal article","","","https://scholar.google.com/citations?view_op=view_citation&hl=en&user=ABXJvacAAAAJ&pagesize=100&citation_for_view=ABXJvacAAAAJ:Tyk-4Ss8FVUC",239,4847,1539,1541,329,10.61,82,4,31
272,"IK Hornstra, S Birge, B Starcher, AJ Bailey, RP Mecham, SD Shapiro","Lysyl oxidase is required for vascular and diaphragmatic development in mice",2003,"Journal of Biological Chemistry","","","https://scholar.google.com/scholar?oi=bibs&hl=en&cites=3217858630880266968",17,"2019-05-16","Journal article","","","https://scholar.google.com/citations?view_op=view_citation&hl=en&user=ABXJvacAAAAJ&pagesize=100&citation_for_view=ABXJvacAAAAJ:LkGwnXOMwfcC",278,16,14387,14393,272,17.00,45,6,16
266,"RP Mecham","Receptors for laminin on mammalian cells.",1991,"The FASEB Journal","","","https://scholar.google.com/scholar?oi=bibs&hl=en&cites=14564032311934365307",18,"2019-05-16","Journal article","","","https://scholar.google.com/citations?view_op=view_citation&hl=en&user=ABXJvacAAAAJ&pagesize=100&citation_for_view=ABXJvacAAAAJ:YsMSGLbcyi4C",5,11,2538,2546,266,9.50,266,1,28
222,"P Brown-augsburger, T Broekelmann, J Rosenbloom, RP Mecham","Functional domains on elastin and microfibril-associated glycoprotein involved in elastic fibre assembly",1996,"Biochemical Journal","","","https://scholar.google.com/scholar?oi=bibs&hl=en&cites=5858028473096954075,17933864730609728710",19,"2019-05-16","Journal article","","","https://scholar.google.com/citations?view_op=view_citation&hl=en&user=ABXJvacAAAAJ&pagesize=100&citation_for_view=ABXJvacAAAAJ:ULOm3_A8WrAC",318,1,149,155,222,9.65,56,4,23
219,"RP Mecham, TJ Broekelmann, CJ Fliszar, SD Shapiro, HG Welgus, ...","Elastin degradation by matrix metalloproteinases Cleavage site specificity and mechanisms of elastolysis",1997,"Journal of Biological Chemistry","","","https://scholar.google.com/scholar?oi=bibs&hl=en&cites=10309195195853595029,15286031429727627768",20,"2019-05-16","Journal article","","","https://scholar.google.com/citations?view_op=view_citation&hl=en&user=ABXJvacAAAAJ&pagesize=100&citation_for_view=ABXJvacAAAAJ:3fE2CSJIrl8C",272,29,18071,18076,219,9.95,37,6,22
217,"JE Wagenseil, RP Mecham","Elastin in large artery stiffness and hypertension",2012,"Journal of cardiovascular translational research","","","https://scholar.google.com/scholar?oi=bibs&hl=en&cites=15158741087942212919",21,"2019-05-16","Journal article","","","https://scholar.google.com/citations?view_op=view_citation&hl=en&user=ABXJvacAAAAJ&pagesize=100&citation_for_view=ABXJvacAAAAJ:_FM0Bhl9EiAC",5,3,264,273,217,31.00,109,2,7
216,"RP Mecham, LA Whitehouse, DS Wrenn, WC Parks, GL Griffin, RM Senior, ...","Smooth muscle-mediated connective tissue remodeling in pulmonary hypertension",1987,"Science","","","https://scholar.google.com/scholar?oi=bibs&hl=en&cites=11579904356724566148,13150724092669464653",22,"2019-05-16","Journal article","","","https://scholar.google.com/citations?view_op=view_citation&hl=en&user=ABXJvacAAAAJ&pagesize=100&citation_for_view=ABXJvacAAAAJ:ufrVoPGSRksC",237,4813,423,426,216,6.75,31,7,32
211,"G Faury, M Pezet, RH Knutsen, WA Boyle, SP Heximer, SE McLean, ...","Developmental adaptation of the mouse cardiovascular system to elastin haploinsufficiency",2003,"The Journal of clinical investigation","","","https://scholar.google.com/scholar?oi=bibs&hl=en&cites=364093989603898754",23,"2019-05-16","Journal article","","","https://scholar.google.com/citations?view_op=view_citation&hl=en&user=ABXJvacAAAAJ&pagesize=100&citation_for_view=ABXJvacAAAAJ:M3ejUd6NZC8C",112,9,1419,1428,211,13.19,30,7,16
210,"C Bernal-Mizrachi, S Weng, C Feng, BN Finck, RH Knutsen, TC Leone, ...","Dexamethasone induction of hypertension and diabetes is PPAR-α dependent in LDL receptor–null mice",2003,"Nature medicine","","","https://scholar.google.com/scholar?oi=bibs&hl=en&cites=12455393258695473692",24,"2019-05-16","Journal article","","","https://scholar.google.com/citations?view_op=view_citation&hl=en&user=ABXJvacAAAAJ&pagesize=100&citation_for_view=ABXJvacAAAAJ:hqOjcs7Dif8C",9,8,1069,1069,210,13.13,30,7,16
199,"IW Prosser, KR Stenmark, M Suthar, EC Crouch, RP Mecham, WC Parks","Regional heterogeneity of elastin and collagen gene expression in intralobar arteries in response to hypoxic pulmonary hypertension as demonstrated by in situ hybridization.",1989,"The American journal of pathology","","","https://scholar.google.com/scholar?oi=bibs&hl=en&cites=17577550307426242095",25,"2019-05-16","Journal article","","","https://scholar.google.com/citations?view_op=view_citation&hl=en&user=ABXJvacAAAAJ&pagesize=100&citation_for_view=ABXJvacAAAAJ:WF5omc3nYNoC",135,6,1073,1073,199,6.63,33,6,30
194,"RP Mecham, A Hinek, R Entwistle, DS Wrenn, GL Griffin, RM Senior","Elastin binds to a multifunctional 67-kilodalton peripheral membrane protein",1989,"Biochemistry","","","https://scholar.google.com/scholar?oi=bibs&hl=en&cites=15530262831445443953",26,"2019-05-16","Journal article","","","https://scholar.google.com/citations?view_op=view_citation&hl=en&user=ABXJvacAAAAJ&pagesize=100&citation_for_view=ABXJvacAAAAJ:8k81kl-MbHgC",28,9,3716,3722,194,6.47,32,6,30
192,"PJ McLaughlin, Q Chen, M Horiguchi, BC Starcher, JB Stanton, ...","Targeted disruption of fibulin-4 abolishes elastogenesis and causes perinatal lethality in mice",2006,"Molecular and cellular biology","","","https://scholar.google.com/scholar?oi=bibs&hl=en&cites=3845209386322753600",27,"2019-05-16","Journal article","","","https://scholar.google.com/citations?view_op=view_citation&hl=en&user=ABXJvacAAAAJ&pagesize=100&citation_for_view=ABXJvacAAAAJ:QIV2ME_5wuYC",26,5,1700,1709,192,14.77,32,6,13
186,"RP Mecham, A Hinek, GL Griffin, RM Senior, LA Liotta","The elastin receptor shows structural and functional similarities to the 67-kDa tumor cell laminin receptor.",1989,"Journal of Biological Chemistry","","","https://scholar.google.com/scholar?oi=bibs&hl=en&cites=5779773534216609625",28,"2019-05-16","Journal article","","","https://scholar.google.com/citations?view_op=view_citation&hl=en&user=ABXJvacAAAAJ&pagesize=100&citation_for_view=ABXJvacAAAAJ:UebtZRa9Y70C",264,28,16652,16657,186,6.20,37,5,30
185,"MA Gibson, G Hatzinikolas, EC Davis, E Baker, GR Sutherland, ...","Bovine latent transforming growth factor beta 1-binding protein 2: molecular cloning, identification of tissue isoforms, and immunolocalization to elastin-associated microfibrils.",1995,"Molecular and cellular biology","","","https://scholar.google.com/scholar?oi=bibs&hl=en&cites=16576575295972294465",29,"2019-05-16","Journal article","","","https://scholar.google.com/citations?view_op=view_citation&hl=en&user=ABXJvacAAAAJ&pagesize=100&citation_for_view=ABXJvacAAAAJ:_FxGoFyzp5QC",15,12,6932,6942,185,7.71,31,6,24
177,"H Sakamoto, T Broekelmann, DA Cheresh, F Ramirez, J Rosenbloom, ...","Cell-type specific recognition of RGD-and non-RGD-containing cell binding domains in fibrillin-1",1996,"Journal of Biological Chemistry","","","https://scholar.google.com/scholar?oi=bibs&hl=en&cites=2886248682186675951",30,"2019-05-16","Journal article","","","https://scholar.google.com/citations?view_op=view_citation&hl=en&user=ABXJvacAAAAJ&pagesize=100&citation_for_view=ABXJvacAAAAJ:Se3iqnhoufwC",271,9,4916,4922,177,7.70,30,6,23
177,"SD Shapiro, CJ Fliszar, TJ Broekelmann, RP Mecham, RM Senior, ...","Activation of the 92-kDa Gelatinase by Stromelysin and 4-Aminophenylmercuric Acetate DIFFERENTIAL PROCESSING AND STABILIZATION OF THE CARBOXYL-TERMINAL DOMAIN BY TISSUE …",1995,"Journal of Biological Chemistry","","","https://scholar.google.com/scholar?oi=bibs&hl=en&cites=10255379886586635531",31,"2019-05-16","Journal article","","","https://scholar.google.com/citations?view_op=view_citation&hl=en&user=ABXJvacAAAAJ&pagesize=100&citation_for_view=ABXJvacAAAAJ:5nxA0vEk-isC",270,11,6351,6356,177,7.38,30,6,24
177,"RP Mecham, JE Heuser","The elastic fiber",1991,"Cell biology of extracellular matrix","","","https://scholar.google.com/scholar?oi=bibs&hl=en&cites=17048344210937961273",32,"2019-05-16","Book chapter","","","https://scholar.google.com/citations?view_op=view_citation&hl=en&user=ABXJvacAAAAJ&pagesize=100&citation_for_view=ABXJvacAAAAJ:MXK_kJrjxJIC",,,79,109,177,6.32,89,2,28
175,"RP Mecham, DE Birk","Extracellular matrix assembly and structure",2013,"","Academic Press","","https://scholar.google.com/scholar?oi=bibs&hl=en&cites=17559880881524130426",33,"2019-05-16","Book","","","https://scholar.google.com/citations?view_op=view_citation&hl=en&user=ABXJvacAAAAJ&pagesize=100&citation_for_view=ABXJvacAAAAJ:0EnyYjriUFMC",,,,,175,29.17,88,2,6
164,"CM Kelleher, SE McLean, RP Mecham","Vascular extracellular matrix and aortic development",2004,"Current topics in developmental biology","","","https://scholar.google.com/scholar?oi=bibs&hl=en&cites=6262113472981277927",34,"2019-05-16","Journal article","","","https://scholar.google.com/citations?view_op=view_citation&hl=en&user=ABXJvacAAAAJ&pagesize=100&citation_for_view=ABXJvacAAAAJ:blknAaTinKkC",62,,153,188,164,10.93,55,3,15
161,"W Yin, E Smiley, J Germiller, RP Mecham, JB Florer, RJ Wenstrup, ...","Isolation of a novel latent transforming growth factor-β binding protein gene (LTBP-3)",1995,"Journal of Biological Chemistry","","","https://scholar.google.com/scholar?oi=bibs&hl=en&cites=10027588757903146706",35,"2019-05-16","Journal article","","","https://scholar.google.com/citations?view_op=view_citation&hl=en&user=ABXJvacAAAAJ&pagesize=100&citation_for_view=ABXJvacAAAAJ:roLk4NBRz8UC",270,17,10147,10160,161,6.71,23,7,24
159,"JE Wagenseil, NL Nerurkar, RH Knutsen, RJ Okamoto, DY Li, ...","Effects of elastin haploinsufficiency on the mechanical behavior of mouse arteries",2005,"American Journal of Physiology-Heart and Circulatory Physiology 289 (3 …","","","https://scholar.google.com/scholar?oi=bibs&hl=en&cites=5179291304225503210",36,"2019-05-16","Journal article","","","https://scholar.google.com/citations?view_op=view_citation&hl=en&user=ABXJvacAAAAJ&pagesize=100&citation_for_view=ABXJvacAAAAJ:j3f4tGmQtD8C",,,,,159,11.36,27,6,14
159,"RM Senior, GL Griffin, RP Mecham","Chemotactic responses of fibroblasts to tropoelastin and elastin-derived peptides.",1982,"The Journal of clinical investigation","","","https://scholar.google.com/scholar?oi=bibs&hl=en&cites=8593478183848025669",37,"2019-05-16","Journal article","","","https://scholar.google.com/citations?view_op=view_citation&hl=en&user=ABXJvacAAAAJ&pagesize=100&citation_for_view=ABXJvacAAAAJ:Zph67rFs4hoC",70,3,614,618,159,4.30,53,3,37
158,"GA Rutter, TJ Pullen, DJ Hodson, A Martinez-Sanchez","Pancreatic β-cell identity, glucose sensing and the control of insulin secretion",2015,"Biochemical Journal","","","https://scholar.google.com/scholar?oi=bibs&hl=en&cites=2390331165159733325",38,"2019-05-16","Journal article","","","https://scholar.google.com/citations?view_op=view_citation&hl=en&user=ABXJvacAAAAJ&pagesize=100&citation_for_view=ABXJvacAAAAJ:a9-T7VOCCH8C",466,2,203,218,158,39.50,40,4,4
158,"RP Mecham","Elastic fiber structure and assembly",1994,"Extracellular matrix assembly and structure","","","https://scholar.google.com/scholar?oi=bibs&hl=en&cites=366952212084399349",39,"2019-05-16","","","","https://scholar.google.com/citations?view_op=view_citation&hl=en&user=ABXJvacAAAAJ&pagesize=100&citation_for_view=ABXJvacAAAAJ:CYCckWUYoCcC",,,,,158,6.32,158,1,25
151,"BA Kozel, BJ Rongish, A Czirok, J Zach, CD Little, EC Davis, RH Knutsen, ...","Elastic fiber formation: a dynamic view of extracellular matrix assembly using timer reporters",2006,"Journal of cellular physiology","","","https://scholar.google.com/scholar?oi=bibs&hl=en&cites=710099337251491837",40,"2019-05-16","Journal article","","","https://scholar.google.com/citations?view_op=view_citation&hl=en&user=ABXJvacAAAAJ&pagesize=100&citation_for_view=ABXJvacAAAAJ:-f6ydRqryjwC",207,1,87,96,151,11.62,19,8,13
150,"A Hinek, RP Mecham, F Keeley, M Rabinovitch","Impaired elastin fiber assembly related to reduced 67-kD elastin-binding protein in fetal lamb ductus arteriosus and in cultured aortic smooth muscle cells treated with …",1991,"The Journal of clinical investigation","","","https://scholar.google.com/scholar?oi=bibs&hl=en&cites=13237338524187318578",41,"2019-05-16","Journal article","","","https://scholar.google.com/citations?view_op=view_citation&hl=en&user=ABXJvacAAAAJ&pagesize=100&citation_for_view=ABXJvacAAAAJ:qxL8FJ1GzNcC",88,6,2083,2094,150,5.36,38,4,28
149,"A Shifren, RP Mecham","The stumbling block in lung repair of emphysema: elastic fiber assembly",2006,"Proceedings of the American Thoracic Society","","","https://scholar.google.com/scholar?oi=bibs&hl=en&cites=6499516086487178231",42,"2019-05-16","Conference paper","","","https://scholar.google.com/citations?view_op=view_citation&hl=en&user=ABXJvacAAAAJ&pagesize=100&citation_for_view=ABXJvacAAAAJ:M05iB0D1s5AC",3,5,428,433,149,11.46,75,2,13
148,"UI Sires, GL Griffin, TJ Broekelmann, RP Mecham, G Murphy, AE Chung, ...","Degradation of entactin by matrix metalloproteinases. Susceptibility to matrilysin and identification of cleavage sites.",1993,"Journal of Biological Chemistry","","","https://scholar.google.com/scholar?oi=bibs&hl=en&cites=10349994513627044984",43,"2019-05-16","Journal article","","","https://scholar.google.com/citations?view_op=view_citation&hl=en&user=ABXJvacAAAAJ&pagesize=100&citation_for_view=ABXJvacAAAAJ:KlAtU1dfN6UC",268,3,2069,2074,148,5.69,21,7,26
142,"RP Mecham","Laminin receptors",1991,"Annual review of cell biology","","","https://scholar.google.com/scholar?oi=bibs&hl=en&cites=12232517726186492876",44,"2019-05-16","Journal article","","","https://scholar.google.com/citations?view_op=view_citation&hl=en&user=ABXJvacAAAAJ&pagesize=100&citation_for_view=ABXJvacAAAAJ:kNdYIx-mwKoC",7,1,71,91,142,5.07,142,1,28
140,"BC Trask, TM Trask, T Broekelmann, RP Mecham","The microfibrillar proteins MAGP-1 and fibrillin-1 form a ternary complex with the chondroitin sulfate proteoglycan decorin",2000,"Molecular biology of the cell","","","https://scholar.google.com/scholar?oi=bibs&hl=en&cites=17484240677022787268",45,"2019-05-16","Journal article","","","https://scholar.google.com/citations?view_op=view_citation&hl=en&user=ABXJvacAAAAJ&pagesize=100&citation_for_view=ABXJvacAAAAJ:YOwf2qJgpHMC",11,5,1499,1507,140,7.37,35,4,19
137,"P Brown-Augsburger, C Tisdale, T Broekelmann, C Sloan, RP Mecham","Identification of an elastin cross-linking domain that joins three peptide chains possible role in nucleated assembly",1995,"Journal of Biological Chemistry","","","https://scholar.google.com/scholar?oi=bibs&hl=en&cites=14786304351342646423",46,"2019-05-16","Journal article","","","https://scholar.google.com/citations?view_op=view_citation&hl=en&user=ABXJvacAAAAJ&pagesize=100&citation_for_view=ABXJvacAAAAJ:4DMP91E08xMC",270,30,17778,17783,137,5.71,27,5,24
135,"TJ Broekelmann, BA Kozel, H Ishibashi, CC Werneck, FW Keeley, ...","Tropoelastin interacts with cell-surface glycosaminoglycans via its COOH-terminal domain",2005,"Journal of Biological Chemistry","","","https://scholar.google.com/scholar?oi=bibs&hl=en&cites=8945165308128532156",47,"2019-05-16","Journal article","","","https://scholar.google.com/citations?view_op=view_citation&hl=en&user=ABXJvacAAAAJ&pagesize=100&citation_for_view=ABXJvacAAAAJ:RHpTSmoSYBkC",280,49,40939,40947,135,9.64,23,6,14
134,"L Thomassin, CC Werneck, TJ Broekelmann, C Gleyzal, IK Hornstra, ...","The Pro-regions of lysyl oxidase and lysyl oxidase-like 1 are required for deposition onto elastic fibers",2005,"Journal of Biological Chemistry","","","https://scholar.google.com/scholar?oi=bibs&hl=en&cites=15985236805220514408",48,"2019-05-16","Journal article","","","https://scholar.google.com/citations?view_op=view_citation&hl=en&user=ABXJvacAAAAJ&pagesize=100&citation_for_view=ABXJvacAAAAJ:TQgYirikUcIC",280,52,42848,42855,134,9.57,22,6,14
130,"P Brown-Augsburger, T Broekelmann, L Mecham, R Mercer, MA Gibson, ...","Microfibril-associated glycoprotein binds to the carboxyl-terminal domain of tropoelastin and is a substrate for transglutaminase.",1994,"Journal of Biological Chemistry","","","https://scholar.google.com/scholar?oi=bibs&hl=en&cites=8930498844160334200",49,"2019-05-16","Journal article","","","https://scholar.google.com/citations?view_op=view_citation&hl=en&user=ABXJvacAAAAJ&pagesize=100&citation_for_view=ABXJvacAAAAJ:_kc_bZDykSQC",269,45,28443,28449,130,5.20,22,6,25
126,"SR Lammers, PH Kao, HJ Qi, K Hunter, C Lanning, J Albietz, S Hofmeister, ...","Changes in the structure-function relationship of elastin and its impact on the proximal pulmonary arterial mechanics of hypertensive calves",2008,"American Journal of Physiology-Heart and Circulatory Physiology 295 (4 …","","","https://scholar.google.com/scholar?oi=bibs&hl=en&cites=10880556240648201450",50,"2019-05-16","Journal article","","","https://scholar.google.com/citations?view_op=view_citation&hl=en&user=ABXJvacAAAAJ&pagesize=100&citation_for_view=ABXJvacAAAAJ:cFHS6HbyZ2cC",,,,,126,11.45,16,8,11
126,"TM Trask, BC Trask, TM Ritty, WR Abrams, J Rosenbloom, RP Mecham","Interaction of tropoelastin with the amino-terminal domains of fibrillin-1 and fibrillin-2 suggests a role for the fibrillins in elastic fiber assembly",2000,"Journal of Biological Chemistry","","","https://scholar.google.com/scholar?oi=bibs&hl=en&cites=3682477266936013030",51,"2019-05-16","Journal article","","","https://scholar.google.com/citations?view_op=view_citation&hl=en&user=ABXJvacAAAAJ&pagesize=100&citation_for_view=ABXJvacAAAAJ:9ZlFYXVOiuMC",275,32,24400,24406,126,6.63,21,6,19
124,"RP Mecham, G Lange, J Madaras, B Starcher","Elastin synthesis by ligamentum nuchae fibroblasts: effects of culture conditions and extracellular matrix on elastin production.",1981,"The Journal of cell biology","","","https://scholar.google.com/scholar?oi=bibs&hl=en&cites=1200473680636649207",52,"2019-05-16","Journal article","","","https://scholar.google.com/citations?view_op=view_citation&hl=en&user=ABXJvacAAAAJ&pagesize=100&citation_for_view=ABXJvacAAAAJ:aqlVkmm33-oC",90,2,332,338,124,3.26,31,4,38
123,"Z Indik, WR Abrams, U Kucich, CW Gibson, RP Mecham, J Rosenbloom","Production of recombinant human tropoelastin: characterization and demonstration of immunologic and chemotactic activity",1990,"Archives of biochemistry and biophysics","","","https://scholar.google.com/scholar?oi=bibs&hl=en&cites=553327559053636405",53,"2019-05-16","Journal article","","","https://scholar.google.com/citations?view_op=view_citation&hl=en&user=ABXJvacAAAAJ&pagesize=100&citation_for_view=ABXJvacAAAAJ:R3hNpaxXUhUC",280,1,80,86,123,4.24,21,6,29
