Cites,Authors,Title,Year,Source,Publisher,ArticleURL,CitesURL,GSRank,QueryDate,Type,DOI,ISSN,CitationURL,Volume,Issue,StartPage,EndPage,ECC,CitesPerYear,CitesPerAuthor,AuthorCount,Age
227,"AA Gashev, MJ Davis, DC Zawieja","Inhibition of the active lymph pump by flow in rat mesenteric lymphatics and thoracic duct",2002,"The Journal of physiology","","","https://scholar.google.com/scholar?oi=bibs&hl=en&cites=16965730421607895851",1,"2019-05-17","Journal article","","","https://scholar.google.com/citations?view_op=view_citation&hl=en&user=iDSFxxsAAAAJ&pagesize=100&citation_for_view=iDSFxxsAAAAJ:9yKSN-GCB0IC",540,3,1023,1037,227,13.35,76,3,17
221,"JN Benoit, DC Zawieja, AH Goodman, HJ Granger","Characterization of intact mesenteric lymphatic pump and its responsiveness to acute edemagenic stress",1989,"American Journal of Physiology-Heart and Circulatory Physiology 257 (6 …","","","https://scholar.google.com/scholar?oi=bibs&hl=en&cites=15619577334086860505",2,"2019-05-17","Journal article","","","https://scholar.google.com/citations?view_op=view_citation&hl=en&user=iDSFxxsAAAAJ&pagesize=100&citation_for_view=iDSFxxsAAAAJ:u-x6o8ySG0sC",,,,,221,7.37,55,4,30
216,"Y Yuan, HJ Granger, DC Zawieja, DV DeFily, WM Chilian","Histamine increases venular permeability via a phospholipase C-NO synthase-guanylate cyclase cascade",1993,"American Journal of Physiology-Heart and Circulatory Physiology 264 (5 …","","","https://scholar.google.com/scholar?oi=bibs&hl=en&cites=1706885930588401387",3,"2019-05-17","Journal article","","","https://scholar.google.com/citations?view_op=view_citation&hl=en&user=iDSFxxsAAAAJ&pagesize=100&citation_for_view=iDSFxxsAAAAJ:u5HHmVD_uO8C",,,,,216,8.31,43,5,26
207,"DC Zawieja","Contractile physiology of lymphatics",2009,"Lymphatic research and biology","","","https://scholar.google.com/scholar?oi=bibs&hl=en&cites=1228021682447960195",4,"2019-05-17","Journal article","","","https://scholar.google.com/citations?view_op=view_citation&hl=en&user=iDSFxxsAAAAJ&pagesize=100&citation_for_view=iDSFxxsAAAAJ:Y0pCki6q_DkC",7,2,87,96,207,20.70,207,1,10
191,"GA Meininger, DC Zawieja, JC Falcone, MA Hill, JP Davey","Calcium measurement in isolated arterioles during myogenic and agonist stimulation",1991,"American Journal of Physiology-Heart and Circulatory Physiology 261 (3 …","","","https://scholar.google.com/scholar?oi=bibs&hl=en&cites=7383319537607005990",5,"2019-05-17","Journal article","","","https://scholar.google.com/citations?view_op=view_citation&hl=en&user=iDSFxxsAAAAJ&pagesize=100&citation_for_view=iDSFxxsAAAAJ:d1gkVwhDpl0C",,,,,191,6.82,38,5,28
185,"H Wu, Y Yuan, DC Zawieja, J Tinsley, HJ Granger","Role of phospholipase C, protein kinase C, and calcium in VEGF-induced venular hyperpermeability",1999,"American Journal of Physiology-Heart and Circulatory Physiology 276 (2 …","","","https://scholar.google.com/scholar?oi=bibs&hl=en&cites=17390030540971412006",6,"2019-05-17","Journal article","","","https://scholar.google.com/citations?view_op=view_citation&hl=en&user=iDSFxxsAAAAJ&pagesize=100&citation_for_view=iDSFxxsAAAAJ:2osOgNQ5qMEC",,,,,185,9.25,37,5,20
181,"Y Yuan, HJ Granger, DC Zawieja, WM Chilian","Flow modulates coronary venular permeability by a nitric oxide-related mechanism",1992,"American Journal of Physiology-Heart and Circulatory Physiology 263 (2 …","","","https://scholar.google.com/scholar?oi=bibs&hl=en&cites=15494107305787779437",7,"2019-05-17","Journal article","","","https://scholar.google.com/citations?view_op=view_citation&hl=en&user=iDSFxxsAAAAJ&pagesize=100&citation_for_view=iDSFxxsAAAAJ:qjMakFHDy7sC",,,,,181,6.70,45,4,27
173,"AN Stratman, WB Saunders, A Sacharidou, W Koh, KE Fisher, ...","Endothelial cell lumen and vascular guidance tunnel formation requires MT1-MMP–dependent proteolysis in 3-dimensional collagen matrices",2009,"Blood","","","https://scholar.google.com/scholar?oi=bibs&hl=en&cites=2517619973853648298",8,"2019-05-17","Journal article","","","https://scholar.google.com/citations?view_op=view_citation&hl=en&user=iDSFxxsAAAAJ&pagesize=100&citation_for_view=iDSFxxsAAAAJ:IjCSPb-OGe4C",114,2,237,247,173,17.30,29,6,10
171,"MJ Flister, A Wilber, KL Hall, C Iwata, K Miyazono, RE Nisato, MS Pepper, ...","Inflammation induces lymphangiogenesis through up-regulation of VEGFR-3 mediated by NF-κB and Prox1",2010,"Blood","","","https://scholar.google.com/scholar?oi=bibs&hl=en&cites=9085969950831201344",9,"2019-05-17","Journal article","","","https://scholar.google.com/citations?view_op=view_citation&hl=en&user=iDSFxxsAAAAJ&pagesize=100&citation_for_view=iDSFxxsAAAAJ:zYLM7Y9cAGgC",115,2,418,429,171,19.00,21,8,9
166,"JB Dixon, ST Greiner, AA Gashev, GL Cote, JE Moore Jr, DC Zawieja","Lymph flow, shear stress, and lymphocyte velocity in rat mesenteric prenodal lymphatics",2006,"Microcirculation","","","https://scholar.google.com/scholar?oi=bibs&hl=en&cites=3113594463463055009",10,"2019-05-17","Journal article","","","https://scholar.google.com/citations?view_op=view_citation&hl=en&user=iDSFxxsAAAAJ&pagesize=100&citation_for_view=iDSFxxsAAAAJ:W7OEmFMy1HYC",13,7,597,610,166,12.77,28,6,13
164,"DC Zawieja, KL Davis, R Schuster, WM Hinds, HJ Granger","Distribution, propagation, and coordination of contractile activity in lymphatics",1993,"American Journal of Physiology-Heart and Circulatory Physiology 264 (4 …","","","https://scholar.google.com/scholar?oi=bibs&hl=en&cites=12566401341377864373",11,"2019-05-17","Journal article","","","https://scholar.google.com/citations?view_op=view_citation&hl=en&user=iDSFxxsAAAAJ&pagesize=100&citation_for_view=iDSFxxsAAAAJ:Tyk-4Ss8FVUC",,,,,164,6.31,33,5,26
153,"MJ Davis, GA Meininger, DC Zawieja","Stretch-induced increases in intracellular calcium of isolated vascular smooth muscle cells",1992,"American Journal of Physiology-Heart and Circulatory Physiology 263 (4 …","","","https://scholar.google.com/scholar?oi=bibs&hl=en&cites=8207011547550206592",12,"2019-05-17","Journal article","","","https://scholar.google.com/citations?view_op=view_citation&hl=en&user=iDSFxxsAAAAJ&pagesize=100&citation_for_view=iDSFxxsAAAAJ:UeHWp8X0CEIC",,,,,153,5.67,51,3,27
147,"AA GASHEV, MJ DAVIS, MD DELP, DC ZAWIEJA","Regional variations of contractile activity in isolated rat lymphatics",2004,"Microcirculation","","","https://scholar.google.com/scholar?oi=bibs&hl=en&cites=1674456492884453202",13,"2019-05-17","Journal article","","","https://scholar.google.com/citations?view_op=view_citation&hl=en&user=iDSFxxsAAAAJ&pagesize=100&citation_for_view=iDSFxxsAAAAJ:eQOLeE2rZwMC",11,6,477,492,147,9.80,37,4,15
134,"PY von der Weid, DC Zawieja","Lymphatic smooth muscle: the motor unit of lymph drainage",2004,"The international journal of biochemistry & cell biology","","","https://scholar.google.com/scholar?oi=bibs&hl=en&cites=18341123855880683136",14,"2019-05-17","Journal article","","","https://scholar.google.com/citations?view_op=view_citation&hl=en&user=iDSFxxsAAAAJ&pagesize=100&citation_for_view=iDSFxxsAAAAJ:WF5omc3nYNoC",36,7,1147,1153,134,8.93,67,2,15
132,"OY Gasheva, DC Zawieja, AA Gashev","Contraction‐initiated NO‐dependent lymphatic relaxation: a self‐regulatory mechanism in rat thoracic duct",2006,"The Journal of physiology","","","https://scholar.google.com/scholar?oi=bibs&hl=en&cites=17252574853531703481",15,"2019-05-17","Journal article","","","https://scholar.google.com/citations?view_op=view_citation&hl=en&user=iDSFxxsAAAAJ&pagesize=100&citation_for_view=iDSFxxsAAAAJ:YsMSGLbcyi4C",575,3,821,832,132,10.15,44,3,13
121,"M Muthuchamy, A Gashev, N Boswell, N Dawson, D Zawieja","Molecular and functional analyses of the contractile apparatus in lymphatic muscle",2003,"The FASEB journal","","","https://scholar.google.com/scholar?oi=bibs&hl=en&cites=17483613037392844130",16,"2019-05-17","Journal article","","","https://scholar.google.com/citations?view_op=view_citation&hl=en&user=iDSFxxsAAAAJ&pagesize=100&citation_for_view=iDSFxxsAAAAJ:ufrVoPGSRksC",17,8,920,922,121,7.56,24,5,16
99,"M Muthuchamy, D Zawieja","Molecular regulation of lymphatic contractility",2008,"Annals of the New York Academy of Sciences","","","https://scholar.google.com/scholar?oi=bibs&hl=en&cites=17890547556366289634",17,"2019-05-17","Journal article","","","https://scholar.google.com/citations?view_op=view_citation&hl=en&user=iDSFxxsAAAAJ&pagesize=100&citation_for_view=iDSFxxsAAAAJ:_FxGoFyzp5QC",1131,1,89,99,99,9.00,50,2,11
95,"HG Bohlen, W Wang, A Gashev, O Gasheva, D Zawieja","Phasic contractions of rat mesenteric lymphatics increase basal and phasic nitric oxide generation in vivo",2009,"American Journal of Physiology-Heart and Circulatory Physiology 297 (4 …","","","https://scholar.google.com/scholar?oi=bibs&hl=en&cites=5826636089685730866",18,"2019-05-17","Journal article","","","https://scholar.google.com/citations?view_op=view_citation&hl=en&user=iDSFxxsAAAAJ&pagesize=100&citation_for_view=iDSFxxsAAAAJ:IUKN3-7HHlwC",,,,,95,9.50,19,5,10
91,"MJ Davis, E Rahbar, AA Gashev, DC Zawieja, JE Moore Jr","Determinants of valve gating in collecting lymphatic vessels from rat mesentery",2011,"American Journal of Physiology-Heart and Circulatory Physiology 301 (1), H48-H","","","https://scholar.google.com/scholar?oi=bibs&hl=en&cites=9465726533507854069",19,"2019-05-17","Journal article","","","https://scholar.google.com/citations?view_op=view_citation&hl=en&user=iDSFxxsAAAAJ&pagesize=100&citation_for_view=iDSFxxsAAAAJ:5nxA0vEk-isC",60,,,,91,11.38,18,5,8
87,"CM Quick, AM Venugopal, AA Gashev, DC Zawieja, RH Stewart","Intrinsic pump-conduit behavior of lymphangions",2007,"American Journal of Physiology-Regulatory, Integrative and Comparative …","","","https://scholar.google.com/scholar?oi=bibs&hl=en&cites=12989990813071150164",20,"2019-05-17","Journal article","","","https://scholar.google.com/citations?view_op=view_citation&hl=en&user=iDSFxxsAAAAJ&pagesize=100&citation_for_view=iDSFxxsAAAAJ:UebtZRa9Y70C",,,,,87,7.25,17,5,12
85,"CW Tong, RD Gaffin, DC Zawieja, M Muthuchamy","Roles of phosphorylation of myosin binding protein‐C and troponin I in mouse cardiac muscle twitch dynamics",2004,"The Journal of physiology","","","https://scholar.google.com/scholar?oi=bibs&hl=en&cites=12922904970999794299",21,"2019-05-17","Journal article","","","https://scholar.google.com/citations?view_op=view_citation&hl=en&user=iDSFxxsAAAAJ&pagesize=100&citation_for_view=iDSFxxsAAAAJ:LkGwnXOMwfcC",558,3,927,941,85,5.67,21,4,15
80,"D Zawieja","Lymphatic biology and the microcirculation: past, present and future",2005,"Microcirculation","","","https://scholar.google.com/scholar?oi=bibs&hl=en&cites=17376819267116852870",22,"2019-05-17","Journal article","","","https://scholar.google.com/citations?view_op=view_citation&hl=en&user=iDSFxxsAAAAJ&pagesize=100&citation_for_view=iDSFxxsAAAAJ:roLk4NBRz8UC",12,1,141,150,80,5.71,80,1,14
72,"JB Dixon, DC Zawieja, AA Gashev, GL Coté","Measuring microlymphatic flow using fast video microscopy",2005,"Journal of biomedical optics","","","https://scholar.google.com/scholar?oi=bibs&hl=en&cites=13099547254943398639",23,"2019-05-17","Journal article","","","https://scholar.google.com/citations?view_op=view_citation&hl=en&user=iDSFxxsAAAAJ&pagesize=100&citation_for_view=iDSFxxsAAAAJ:8k81kl-MbHgC",10,6,64016,64016,72,5.14,18,4,14
72,"EA Bridenbaugh, AA Gashev, DC Zawieja","Lymphatic muscle: a review of contractile function",2003,"Lymphatic research and biology","","","https://scholar.google.com/scholar?oi=bibs&hl=en&cites=5428348334657776038",24,"2019-05-17","Journal article","","","https://scholar.google.com/citations?view_op=view_citation&hl=en&user=iDSFxxsAAAAJ&pagesize=100&citation_for_view=iDSFxxsAAAAJ:Se3iqnhoufwC",1,2,147,158,72,4.50,24,3,16
71,"MJ Davis, JP Scallan, JH Wolpers, M Muthuchamy, AA Gashev, ...","Intrinsic increase in lymphangion muscle contractility in response to elevated afterload",2012,"American Journal of Physiology-Heart and Circulatory Physiology 303 (7 …","","","https://scholar.google.com/scholar?oi=bibs&hl=en&cites=10896899510553589326",25,"2019-05-17","Journal article","","","https://scholar.google.com/citations?view_op=view_citation&hl=en&user=iDSFxxsAAAAJ&pagesize=100&citation_for_view=iDSFxxsAAAAJ:dhFuZR0502QC",,,,,71,10.14,12,6,7
70,"AA Gashev, DC Zawieja","Physiology of human lymphatic contractility: a historical perspective",2001,"Lymphology","","","https://scholar.google.com/scholar?oi=bibs&hl=en&cites=16373922292865470544",26,"2019-05-17","Journal article","","","https://scholar.google.com/citations?view_op=view_citation&hl=en&user=iDSFxxsAAAAJ&pagesize=100&citation_for_view=iDSFxxsAAAAJ:hqOjcs7Dif8C",34,3,124,134,70,3.89,35,2,18
67,"HG Bohlen, OY Gasheva, DC Zawieja","Nitric oxide formation by lymphatic bulb and valves is a major regulatory component of lymphatic pumping",2011,"American Journal of Physiology-Heart and Circulatory Physiology 301 (5 …","","","https://scholar.google.com/scholar?oi=bibs&hl=en&cites=10311309117815261436",27,"2019-05-17","Journal article","","","https://scholar.google.com/citations?view_op=view_citation&hl=en&user=iDSFxxsAAAAJ&pagesize=100&citation_for_view=iDSFxxsAAAAJ:Zph67rFs4hoC",,,,,67,8.38,22,3,8
67,"MJ Davis, MM Lane, AM Davis, D Durtschi, DC Zawieja, M Muthuchamy, ...","Modulation of lymphatic muscle contractility by the neuropeptide substance P",2008,"American Journal of Physiology-Heart and Circulatory Physiology 295 (2 …","","","https://scholar.google.com/scholar?oi=bibs&hl=en&cites=17213861993464756549",28,"2019-05-17","Journal article","","","https://scholar.google.com/citations?view_op=view_citation&hl=en&user=iDSFxxsAAAAJ&pagesize=100&citation_for_view=iDSFxxsAAAAJ:MXK_kJrjxJIC",,,,,67,6.09,10,7,11
65,"Y Yuan, WM Chilian, HJ Granger, DC Zawieja","Permeability to albumin in isolated coronary venules",1993,"American Journal of Physiology-Heart and Circulatory Physiology 265 (2 …","","","https://scholar.google.com/scholar?oi=bibs&hl=en&cites=1187261168517984938",29,"2019-05-17","Journal article","","","https://scholar.google.com/citations?view_op=view_citation&hl=en&user=iDSFxxsAAAAJ&pagesize=100&citation_for_view=iDSFxxsAAAAJ:0EnyYjriUFMC",,,,,65,2.50,16,4,26
64,"AA Gashev, DC Zawieja","Hydrodynamic regulation of lymphatic transport and the impact of aging",2010,"Pathophysiology","","","https://scholar.google.com/scholar?oi=bibs&hl=en&cites=14010456682222108350",30,"2019-05-17","Journal article","","","https://scholar.google.com/citations?view_op=view_citation&hl=en&user=iDSFxxsAAAAJ&pagesize=100&citation_for_view=iDSFxxsAAAAJ:ULOm3_A8WrAC",17,4,277,287,64,7.11,32,2,9
64,"G Chen, EA Bridenbaugh, AD Akintola, JM Catania, VS Vaidya, ...","Increased susceptibility of aging kidney to ischemic injury: identification of candidate genes changed during aging, but corrected by caloric restriction",2007,"American Journal of Physiology-Renal Physiology 293 (4), F1272-F","","","https://scholar.google.com/scholar?oi=bibs&hl=en&cites=14540442058237482530",31,"2019-05-17","Journal article","","","https://scholar.google.com/citations?view_op=view_citation&hl=en&user=iDSFxxsAAAAJ&pagesize=100&citation_for_view=iDSFxxsAAAAJ:3fE2CSJIrl8C",1281,,,,64,5.33,11,6,12
59,"EL Kuan, S Ivanov, EA Bridenbaugh, G Victora, W Wang, EW Childs, ...","Collecting lymphatic vessel permeability facilitates adipose tissue inflammation and distribution of antigen to lymph node–homing adipose tissue dendritic cells",2015,"The Journal of Immunology","","","https://scholar.google.com/scholar?oi=bibs&hl=en&cites=9477655893924038328",32,"2019-05-17","Journal article","","","https://scholar.google.com/citations?view_op=view_citation&hl=en&user=iDSFxxsAAAAJ&pagesize=100&citation_for_view=iDSFxxsAAAAJ:M3NEmzRMIkIC",194,11,5200,5210,59,14.75,8,7,4
58,"R Zhang, AA Gashev, DC Zawieja, MJ Davis","Length-tension relationships of small arteries, veins, and lymphatics from the rat mesenteric microcirculation",2007,"American Journal of Physiology-Heart and Circulatory Physiology 292 (4 …","","","https://scholar.google.com/scholar?oi=bibs&hl=en&cites=10227961548555846200",33,"2019-05-17","Journal article","","","https://scholar.google.com/citations?view_op=view_citation&hl=en&user=iDSFxxsAAAAJ&pagesize=100&citation_for_view=iDSFxxsAAAAJ:KlAtU1dfN6UC",,,,,58,4.83,15,4,12
57,"WE Cromer, SD Zawieja, B Tharakan, EW Childs, MK Newell, DC Zawieja","The effects of inflammatory cytokines on lymphatic endothelial barrier function",2014,"Angiogenesis","","","https://scholar.google.com/scholar?oi=bibs&hl=en&cites=13627550284857664922",34,"2019-05-17","Journal article","","","https://scholar.google.com/citations?view_op=view_citation&hl=en&user=iDSFxxsAAAAJ&pagesize=100&citation_for_view=iDSFxxsAAAAJ:ZeXyd9-uunAC",17,2,395,406,57,11.40,10,6,5
54,"S Chakraborty, S Zawieja, W Wang, DC Zawieja, M Muthuchamy","Lymphatic system: a vital link between metabolic syndrome and inflammation",2010,"Annals of the New York Academy of Sciences","","","https://scholar.google.com/scholar?oi=bibs&hl=en&cites=5512986806672366257",35,"2019-05-17","Journal article","","","https://scholar.google.com/citations?view_op=view_citation&hl=en&user=iDSFxxsAAAAJ&pagesize=100&citation_for_view=iDSFxxsAAAAJ:qxL8FJ1GzNcC",1207,1,,,54,6.00,11,5,9
51,"W Wang, Z Nepiyushchikh, DC Zawieja, S Chakraborty, SD Zawieja, ...","Inhibition of myosin light chain phosphorylation decreases rat mesenteric lymphatic contractile activity",2009,"American Journal of Physiology-Heart and Circulatory Physiology 297 (2 …","","","https://scholar.google.com/scholar?oi=bibs&hl=en&cites=1769495668392119574",36,"2019-05-17","Journal article","","","https://scholar.google.com/citations?view_op=view_citation&hl=en&user=iDSFxxsAAAAJ&pagesize=100&citation_for_view=iDSFxxsAAAAJ:_kc_bZDykSQC",,,,,51,5.10,9,6,10
50,"SD Zawieja, W Wang, X Wu, ZV Nepiyushchikh, DC Zawieja, ...","Impairments in the intrinsic contractility of mesenteric collecting lymphatics in a rat model of metabolic syndrome",2011,"American Journal of Physiology-Heart and Circulatory Physiology 302 (3 …","","","https://scholar.google.com/scholar?oi=bibs&hl=en&cites=3799226176208844311",37,"2019-05-17","Journal article","","","https://scholar.google.com/citations?view_op=view_citation&hl=en&user=iDSFxxsAAAAJ&pagesize=100&citation_for_view=iDSFxxsAAAAJ:IWHjjKOFINEC",,,,,50,6.25,8,6,8
49,"DC Zawieja, ST Greiner, KL Davis, WM Hinds, HJ Granger","Reactive oxygen metabolites inhibit spontaneous lymphatic contractions",1991,"American Journal of Physiology-Heart and Circulatory Physiology 260 (6 …","","","https://scholar.google.com/scholar?oi=bibs&hl=en&cites=1798407404029690697",38,"2019-05-17","Journal article","","","https://scholar.google.com/citations?view_op=view_citation&hl=en&user=iDSFxxsAAAAJ&pagesize=100&citation_for_view=iDSFxxsAAAAJ:kNdYIx-mwKoC",,,,,49,1.75,10,5,28
48,"BJ Barber, DJ Schaefer, CJ Gordon, DC Zawieja, J Hecker","Thermal effects of MR imaging: worst-case studies on sheep.",1990,"AJR. American journal of roentgenology","","","https://scholar.google.com/scholar?oi=bibs&hl=en&cites=1511538705307003088",39,"2019-05-17","Journal article","","","https://scholar.google.com/citations?view_op=view_citation&hl=en&user=iDSFxxsAAAAJ&pagesize=100&citation_for_view=iDSFxxsAAAAJ:YOwf2qJgpHMC",155,5,1105,1110,48,1.66,10,5,29
47,"JB Dixon, AA Gashev, DC Zawieja, JE Moore, GL Coté","Image correlation algorithm for measuring lymphocyte velocity and diameter changes in contracting microlymphatics",2007,"Annals of biomedical engineering","","","https://scholar.google.com/scholar?oi=bibs&hl=en&cites=7389679598416994122",40,"2019-05-17","Journal article","","","https://scholar.google.com/citations?view_op=view_citation&hl=en&user=iDSFxxsAAAAJ&pagesize=100&citation_for_view=iDSFxxsAAAAJ:4TOpqqG69KYC",35,3,387,396,47,3.92,9,5,12
44,"JP Scallan, JH Wolpers, M Muthuchamy, DC Zawieja, AA Gashev, ...","Independent and interactive effects of preload and afterload on the pump function of the isolated lymphangion",2012,"American Journal of Physiology-Heart and Circulatory Physiology 303 (7 …","","","https://scholar.google.com/scholar?oi=bibs&hl=en&cites=13285704922365697449",41,"2019-05-17","Journal article","","","https://scholar.google.com/citations?view_op=view_citation&hl=en&user=iDSFxxsAAAAJ&pagesize=100&citation_for_view=iDSFxxsAAAAJ:_Qo2XoVZTnwC",,,,,44,6.29,7,6,7
42,"HJ Granger, ME Schelling, RE Lewis, DC Zawieja, CJ Meininger","Physiology and pathobiology of the microcirculation",1988,"American journal of otolaryngology","","","https://scholar.google.com/scholar?oi=bibs&hl=en&cites=6670599761855901431",42,"2019-05-17","Journal article","","","https://scholar.google.com/citations?view_op=view_citation&hl=en&user=iDSFxxsAAAAJ&pagesize=100&citation_for_view=iDSFxxsAAAAJ:TFP_iSt0sucC",9,6,264,277,42,1.35,8,5,31
41,"M Jafarnejad, MC Woodruff, DC Zawieja, MC Carroll, JE Moore Jr","Modeling lymph flow and fluid exchange with blood vessels in lymph nodes",2015,"Lymphatic research and biology","","","https://scholar.google.com/scholar?oi=bibs&hl=en&cites=12876557086077224192",43,"2019-05-17","Journal article","","","https://scholar.google.com/citations?view_op=view_citation&hl=en&user=iDSFxxsAAAAJ&pagesize=100&citation_for_view=iDSFxxsAAAAJ:4OULZ7Gr8RgC",13,4,234,247,41,10.25,8,5,4
41,"D Murchison, DC Zawieja, WH Griffith","Reduced mitochondrial buffering of voltage-gated calcium influx in aged rat basal forebrain neurons",2004,"Cell Calcium","","","https://scholar.google.com/scholar?oi=bibs&hl=en&cites=8690106124781848650",44,"2019-05-17","Journal article","","","https://scholar.google.com/citations?view_op=view_citation&hl=en&user=iDSFxxsAAAAJ&pagesize=100&citation_for_view=iDSFxxsAAAAJ:M3ejUd6NZC8C",36,1,61,75,41,2.73,14,3,15
40,"R Zhang, AA Gashev, DC Zawieja, MM Lane, MJ Davis","Length-dependence of lymphatic phasic contractile activity under isometric and isobaric conditions",2007,"Microcirculation","","","https://scholar.google.com/scholar?oi=bibs&hl=en&cites=2476597840804458245",45,"2019-05-17","Journal article","","","https://scholar.google.com/citations?view_op=view_citation&hl=en&user=iDSFxxsAAAAJ&pagesize=100&citation_for_view=iDSFxxsAAAAJ:9ZlFYXVOiuMC",14,6,613,625,40,3.33,8,5,12
40,"AA Gashev, MD Delp, DC Zawieja","Inhibition of active lymph pump by simulated microgravity in rats",2006,"American Journal of Physiology-Heart and Circulatory Physiology 290 (6 …","","","https://scholar.google.com/scholar?oi=bibs&hl=en&cites=9472818046686003388",46,"2019-05-17","Journal article","","","https://scholar.google.com/citations?view_op=view_citation&hl=en&user=iDSFxxsAAAAJ&pagesize=100&citation_for_view=iDSFxxsAAAAJ:7PzlFSSx8tAC",,,,,40,3.08,13,3,13
40,"Y Yuan, RA Mier, WM Chilian, DC Zawieja, HJ Granger","Interaction of neutrophils and endothelium in isolated coronary venules and arterioles",1995,"American Journal of Physiology-Heart and Circulatory Physiology 268 (1 …","","","https://scholar.google.com/scholar?oi=bibs&hl=en&cites=4668776580173848182",47,"2019-05-17","Journal article","","","https://scholar.google.com/citations?view_op=view_citation&hl=en&user=iDSFxxsAAAAJ&pagesize=100&citation_for_view=iDSFxxsAAAAJ:aqlVkmm33-oC",,,,,40,1.67,8,5,24
39,"NS Dawson, DC Zawieja, MH Wu, HJ Granger, NS Dawson, DC Zawieja, ...","Signaling pathways mediating VEGF165-induced calcium transients and membrane depolarization in human endothelial cells",2006,"The FASEB journal","","","https://scholar.google.com/scholar?oi=bibs&hl=en&cites=2419657486874129417",48,"2019-05-17","Journal article","","","https://scholar.google.com/citations?view_op=view_citation&hl=en&user=iDSFxxsAAAAJ&pagesize=100&citation_for_view=iDSFxxsAAAAJ:QIV2ME_5wuYC",20,7,991,993,39,3.00,6,7,13
39,"S Amerini, M Ziche, ST Greiner, DC Zawieja","Effects of substance P on mesenteric lymphatic contractility in the rat",2004,"Lymphatic research and biology","","","https://scholar.google.com/scholar?oi=bibs&hl=en&cites=1205296744547223838",49,"2019-05-17","Journal article","","","https://scholar.google.com/citations?view_op=view_citation&hl=en&user=iDSFxxsAAAAJ&pagesize=100&citation_for_view=iDSFxxsAAAAJ:Wp0gIr-vW9MC",2,1,2,10,39,2.60,10,4,15
35,"SH Afroze, RR Kalagiri, M Reyes, JD Zimmerman, MR Beeram, N Drever, ...","Apoptotic and stress signaling markers are augmented in preeclamptic placenta and umbilical cord",2016,"BBA clinical","","","https://scholar.google.com/scholar?oi=bibs&hl=en&cites=2497294848095460733",50,"2019-05-17","Journal article","","","https://scholar.google.com/citations?view_op=view_citation&hl=en&user=iDSFxxsAAAAJ&pagesize=100&citation_for_view=iDSFxxsAAAAJ:J-pR_7NvFogC",6,,25,30,35,11.67,5,7,3
34,"HJ Granger","Molecular and cellular basis of myocardial angiogenesis",1994,"Cell Mol Biol Res","","","https://scholar.google.com/scholar?oi=bibs&hl=en&cites=16886929555386975257",51,"2019-05-17","Journal article","","","https://scholar.google.com/citations?view_op=view_citation&hl=en&user=iDSFxxsAAAAJ&pagesize=100&citation_for_view=iDSFxxsAAAAJ:4DMP91E08xMC",40,,81,85,34,1.36,34,1,25
34,"DC Zawieja, C Garcia, HJ Granger","Oxygen radicals, enzymes, and fluid transport through pericardial interstitium",1992,"American Journal of Physiology-Heart and Circulatory Physiology 262 (1 …","","","https://scholar.google.com/scholar?oi=bibs&hl=en&cites=9886586481312094320",52,"2019-05-17","Journal article","","","https://scholar.google.com/citations?view_op=view_citation&hl=en&user=iDSFxxsAAAAJ&pagesize=100&citation_for_view=iDSFxxsAAAAJ:mVmsd5A6BfQC",,,,,34,1.26,11,3,27
